SCHOOL,% PASSED
ABRA STATE INST. OF SCIENCE & TECH.(ABRA IST)-BANGUED,50.00%
ABRA VALLEY COLLEGE,0.00%
ADAMSON UNIVERSITY,25.45%
ALDERSGATE COLLEGE,100.00%
ANDRES BONIFACIO COLLEGE,36.36%
ANGELES UNIVERSITY FOUNDATION,50.00%
AQUINAS UNIVERSITY,18.18%
ARAULLO UNIVERSITY,16.67%
ASIAN DEVELOPMENT FOUNDATION COLLEGE,40.00%
ATENEO DE DAVAO UNIVERSITY,100.00%
ATENEO DE NAGA,75.00%
AURORA STATE COLLEGE OF TECHNOLOGY,40.00%
BAGUIO CENTRAL UNIVERSITY,14.29%
BALIUAG UNIVERSITY (BALIUAG COLLEGES),100.00%
BATAAN HEROES MEMORIAL COLLEGE,0.00%
BATAAN PENINSULA STATE UNIVERSITY- BALANGA (for.BATAAN P.S),35.29%
BATANGAS STATE UNIVERSITY- BATANGAS CITY,54.55%
BICOL UNIVERSITY IND'L TECH.(BUCIT)- LEGAZPI,100.00%
BICOL UNIVERSITY-LEGAZPI,40.63%
BOHOL INSTITUTE OF TECHNOLOGY- TAGBILARAN CITY,0.00%
BOHOL ISLAND STATE UNIVERSITY (FOR.CVSCAFT)-TAGBILARAN,44.44%
BULACAN STATE UNIVERSITY (for.BCAT)- MALOLOS,30.56%
CAGAYAN DE ORO COLLEGE,58.33%
CAGAYAN STATE UNIVERSITY- TUGUEGARAO,35.71%
CAMARINES NORTE STATE COLLEGE- DAET,33.33%
CAMARINES SUR POLYTECHNIC COLLEGE-NABUA,21.05%
CAPITOL UNIVERSITY (for.CAGAYAN CAPITOL COLL.),60.00%
CARLOS C. HILADO MEMORIAL STATE COLLEGE-TALISAY,100.00%
CATANDUANES STATE COLLEGES- VIRAC,46.67%
CAVITE STATE UNIVERSITY (DON SEVERINO AGR'L. COLL.),30.77%
CEBU INSTITUTE OF TECHNOLOGY,39.74%
CENTRAL COLLEGES OF THE PHILIPPINES,40.00%
CENTRAL LUZON STATE UNIVERSITY,61.11%
CENTRAL MAGUINDANAO INSTITUTE,0.00%
CENTRAL MINDANAO COLLEGES,14.29%
CENTRAL MINDANAO UNIVERSITY,58.33%
CENTRAL PHILIPPINE UNIVERSITY,41.67%
COLEGIO DE DAGUPAN (for.COMPUTRONIX COLL),0.00%
COLEGIO DE KIDAPAWAN(for N.COTABATO IT),0.00%
COLEGIO DE LA PURISIMA CONCEPCION,16.67%
COLUMBAN COLLEGE-OLONGAPO CITY,50.00%
COR JESU COLLEGE (HOLY CROSS OF DIGOS),31.82%
CORE GATEWAY COLLEGE (for.THE COLL.OF THE REP),0.00%
COTABATO CITY STATE POLYTECHNIC COLLEGE,5.56%
DAVAO ORIENTAL STATE COLLEGE OF SCIENCE & TECHNOLOGY,28.57%
DE LA SALLE UNIVERSITY-DASMARIÑAS,47.62%
DE LA SALLE UNIVERSITY-MANILA,80.00%
DIVINE WORD COLLEGE OF CALAPAN,30.00%
DIVINE WORD COLLEGE OF LAOAG,25.00%
DIVINE WORD COLLEGE OF LEGAZPI,13.33%
DIVINE WORD UNIVERSITY-TACLOBAN,0.00%
DON HONORIO VENTURA TECHNOLOGICAL STATE UNIVERSITY,25.00%
DON MARIANO MARCOS MEMORIAL STATE UNIVERSITY-SAN FERNANDO,0.00%
EAST CENTRAL COLLEGE,0.00%
EASTERN SAMAR STATE COLLEGE- BORONGAN,46.15%
EASTERN SAMAR STATE COLLEGE- GUIUAN CAMPUS,50.00%
EASTERN VISAYAS STATE UNIVERSITY (for.LIT)TACLOBAN,25.71%
EMILIO AGUINALDO COLLEGE- DASMARINAS,0.00%
EULOGIO (AMANG) RODRIGUEZ INSTITUTE OF SCIENCE & TECHNOLOGY,16.00%
FAR EASTERN UNIVERSITY-MANILA,20.00%
FAR EASTERN UNIVERSITY-NICANOR REYES MEDICAL FOUNDATION,0.00%
FATHER SATURNINO URIOS UNIVERSITY (URIOS COLL),23.53%
FEATI UNIVERSITY,11.11%
FELLOWSHIP BAPTIST COLLEGE,25.00%
FEU-EAST ASIA COLLEGE,65.31%
FLORENCIO L. VARGAS COLLEGE- TUGUEGARAO,0.00%
GARCIA COLLEGE OF TECHNOLOGY,45.45%
GOLDEN GATE COLLEGES,0.00%
GOLDEN WEST COLLEGES,0.00%
GUAGUA NATIONAL COLLEGES,33.33%
HOLY ANGEL UNIVERSITY,31.25%
HOLY NAME UNIVERSITY (for.DIVINE WORD-TAGBILARAN),85.71%
HOLY TRINITY COLLEGE OF PUERTO PRINCESA,0.00%
ISABELA STATE UNIVERSITY-ECHAGUE,25.00%
ISABELA STATE UNIVERSITY-ILAGAN,60.00%
JOHN PAUL COLLEGE,0.00%
JOSE MARIA COLLEGE,50.00%
JOSE RIZAL MEMORIAL STATE UNIVERSITY-DAPITAN,100.00%
LA SALLE UNIVERSITY (for.IMMA.CONCEPCION-LA SALLE),28.57%
LAGUNA COLLEGE,50.00%
LAGUNA STATE POLYTECHNIC COLLEGE-STA. CRUZ (LCAT),28.57%
LEYTE INSTITUTE OF TECHNOLOGY- ORMOC CAMPUS,61.90%
LEYTE INSTITUTE OF TECHNOLOGY- TANAUAN CAMPUS,0.00%
LICEO DE CAGAYAN UNIVERSITY,9.52%
LYCEUM NORTHWESTERN-DAGUPAN CITY,0.00%
LYCEUM OF APARRI,0.00%
LYCEUM OF THE PHILIPPINES UNIVERSITY-MANILA,0.00%
"MAGSAYSAY MEMORIAL COLLEGE OF KORONADAL, INC.",100.00%
MANUEL L. QUEZON UNIVERSITY,0.00%
MANUEL S. ENVERGA UNIV. FOUNDATION-LUCENA CITY,66.67%
MAPUA INSTITUTE OF TECHNOLOGY,52.74%
MARIANO MARCOS STATE UNIVERSITY- BATAC,90.91%
MARINDUQUE STATE COLLEGE-BOAC,56.10%
MINDANAO POLYTECHNIC COLLEGE,0.00%
MINDANAO POLYTECHNIC STATE COLLEGE (DMMMPSC),33.33%
MINDANAO STATE UNIVERSITY-GEN. SANTOS CITY,22.22%
MINDANAO STATE UNIVERSITY-ILIGAN INSTITUTE OF TECHNOLOGY,70.00%
MINDANAO STATE UNIVERSITY-MARAWI CITY,58.33%
MISAMIS UNIVERSITY-OZAMIS CITY,40.00%
MOUNTAIN PROV. STATE POLYTECHNIC COLLEGE-BAUKO,0.00%
MOUNTAIN PROV. STATE POLYTECHNIC COLLEGE-TADIAN,8.33%
NAGA COLLEGE FOUNDATION,33.33%
NATIONAL UNIVERSITY-MANILA,0.00%
NAVAL STATE UNIVERSITY (for.NAVAL INST)-NAVAL,50.00%
NEGROS ORIENTAL STATE UNIVERSITY (CVPC)-DUMAGUETE,66.67%
NEW ERA UNIVERSITY,39.29%
NORTHERN ILOILO POLYTECHNIC STATE COLLEGE-ESTANCIA,66.67%
NORTHWEST SAMAR STATE UNIVERSITY (FOR.TIBURCIO TANCINCO),40.00%
NORTHWESTERN UNIVERSITY,100.00%
NOTRE DAME OF DADIANGAS COLLEGE,28.57%
NOTRE DAME OF KIDAPAWAN COLLEGE,0.00%
NOTRE DAME OF MARBEL UNIVERSITY,44.44%
NOTRE DAME UNIVERSITY,9.68%
NUEVA ECIJA UNIVERSITY OF SCIENCE & TECHNOLOGY-CABANATUAN),20.00%
NUEVA VIZCAYA STATE UNIVERSITY (NVSIT)-BAYOMBONG,30.77%
PALAWAN STATE UNIVERSITY-P. PRINCESA,48.48%
PALAWAN TEACHER'S COLLEGE,100.00%
PAMANTASAN NG LUNGSOD NG MAYNILA,50.00%
PAMANTASAN NG LUNGSOD NG PASAY,100.00%
PANGASINAN STATE UNIVERSITY- URDANETA,52.94%
PANPACIFIC UNIVERSITY NORTH PHILIPPINES (PANG.CST),0.00%
PARTIDO STATE UNIVERSITY-(GOA)GAO,0.00%
PARTIDO STATE UNIVERSITY-SAN JOSE(for.SN JOSE P.I),0.00%
POLYTECHNIC STATE COLLEGE OF ANTIQUE,50.00%
POLYTECHNIC UNIVERSITY OF THE PHILIPPINES-LOPEZ,50.00%
POLYTECHNIC UNIVERSITY OF THE PHILIPPINES-MAIN-STA. MESA,44.34%
QUIRINO POLYTECHNIC COLLEGE,100.00%
RAMON MAGSAYSAY MEMORIAL COLLEGES,9.09%
RAMON MAGSAYSAY TECHNOLOGICAL UNIVERSITY-IBA,50.00%
REPUBLIC CENTRAL COLLEGES,50.00%
RIZAL MEMORIAL COLLEGE,0.00%
RIZAL TECHNOLOGICAL UNIVERSITY,33.33%
ROMBLON STATE COLLEGE-ODIONGAN,10.71%
ROOSEVELT COLLEGE-CAINTA,0.00%
SAINT ANTHONY'S COLLEGE-ANTIQUE,27.27%
SAINT FRANCIS COLLEGE-GUIHULNGAN,100.00%
SAINT FRANCIS INSTITUTE OF TECHNOLOGY,66.67%
SAINT JOSEPH INSTITUTE OF TECHNOLOGY,30.77%
SAINT JOSEPH'S COLLEGE-MAASIN,45.45%
SAINT LOUIS COLLEGE OF SAN FERNANDO,62.50%
SAINT LOUIS UNIVERSITY,42.25%
SAINT MARY'S COLLEGE OF STA. ANA- PAMPANGA,0.00%
SAINT MARY'S COLLEGE-TAGUM,23.81%
SAINT MARY'S UNIVERSITY,33.33%
SAINT PAUL UNIVERSITY-SURIGAO,50.00%
SAINT PAUL UNIVERSITY-TUGUEGARAO,33.33%
SAINT PETER'S COLLEGE-ILIGAN CITY,25.00%
SAMAR STATE UNIVERSITY (SAMAR S.P.C.),53.33%
SILLIMAN UNIVERSITY,42.86%
SORSOGON STATE COLLEGE- SORSOGON,25.00%
SOUTHERN BICOL COLLEGES,0.00%
SOUTHERN CITY COLLEGES,11.11%
SOUTHERN LEYTE STATE UNIVERSITY (SLSCST)-SOGOD,16.67%
SOUTHERN LUZON STATE UNIVERSITY- LUCBAN (SLPC),0.00%
SOUTHERN MINDANAO COLLEGES,21.62%
SOUTHWESTERN UNIVERSITY,0.00%
ST. PATRICK COLLEGE (for.BATAAN EDUC'L.INST.),0.00%
SULTAN KUDARAT POLYTECHNIC STATE COLLEGE-TACURONG,50.00%
SURIGAO DEL SUR POLYTECHNIC COLLEGE-TANDAG,50.00%
SURIGAO EDUCATION CENTER,25.00%
SURIGAO STATE COLLEGE OF TECHNOLOGY,56.25%
TARLAC STATE UNIVERSITY  (TARLAC COLLEGE OF TECH.),29.03%
TECHNOLOGICAL INSTITUTE OF THE PHILIPPINES-MANILA,44.68%
TECHNOLOGICAL INSTITUTE OF THE PHILIPPINES-QUEZON CITY,40.91%
TECHNOLOGICAL UNIVERSITY OF THE PHILIPPINES-MANILA,60.87%
TECHNOLOGICAL UNIVERSITY OF THE PHILIPPINES-TAGUIG,28.57%
UNIVERSIDAD DE ZAMBOANGA (for.ZAEC),36.84%
UNIVERSITY OF BAGUIO,46.15%
UNIVERSITY OF BATANGAS,58.33%
UNIVERSITY OF BOHOL,19.23%
UNIVERSITY OF CEBU,28.57%
UNIVERSITY OF EASTERN PHILIPPINES- CATARMAN,40.00%
UNIVERSITY OF ILOILO,25.00%
UNIVERSITY OF LA SALETTE-SANTIAGO,47.37%
UNIVERSITY OF LUZON (LUZON COLL.),21.05%
UNIVERSITY OF MANILA,33.33%
UNIVERSITY OF MINDANAO-DAVAO CITY,26.87%
UNIVERSITY OF NEGROS OCCIDENTAL- RECOLETOS,44.44%
UNIVERSITY OF NORTHEASTERN PHILIPPINES,100.00%
UNIVERSITY OF NORTHERN PHILIPPINES-VIGAN,24.00%
UNIVERSITY OF NUEVA CACERES,30.43%
UNIVERSITY OF PANGASINAN,22.73%
UNIVERSITY OF PERPETUAL HELP RIZAL-CALAMBA CAMPUS,0.00%
UNIVERSITY OF PERPETUAL HELP SYSTEM DALTA-LAS PINAS,14.29%
UNIVERSITY OF PERPETUAL HELP SYSTEM-LAGUNA,33.33%
UNIVERSITY OF RIZAL SYSTEM-,100.00%
MORONG,
UNIVERSITY OF SAINT ANTHONY,100.00%
UNIVERSITY OF SAINT LOUIS- TUGUEGARAO,50.00%
UNIVERSITY OF SAN AGUSTIN,20.00%
UNIVERSITY OF SAN CARLOS,76.00%
UNIVERSITY OF SAN JOSE-RECOLETOS,35.71%
UNIVERSITY OF SANTO TOMAS,72.00%
UNIVERSITY OF SOUTHEASTERN PHILIPPINES-BISLIG CAMPUS,50.00%
UNIVERSITY OF SOUTHEASTERN PHILIPPINES-DAVAO CITY,48.48%
UNIVERSITY OF SOUTHERN MINDANAO- KABACAN,47.06%
UNIVERSITY OF THE ASSUMPTION,30.00%
UNIVERSITY OF THE CORDILLERAS (for.BAGUIO C.F.),37.50%
UNIVERSITY OF THE EAST-CALOOCAN,26.67%
UNIVERSITY OF THE EAST-MANILA,25.00%
UNIVERSITY OF THE IMMACULATE CONCEPTION-DAVAO,50.00%
UNIVERSITY OF THE PHILIPPINES- DILIMAN,100.00%
UNIVERSITY OF THE PHILIPPINES-LOS BAÑOS,100.00%
UNIVERSITY OF THE PHILIPPINES- MINDANAO,0.00%
UNIVERSITY OF THE VISAYAS-CEBU CITY,27.59%
VICTORINO SALCEDO POLYTECHNIC COLLEGE,0.00%
VIRGEN MILAGROSA UNIVERSITY FOUNDATION,0.00%
WEST NEGROS COLLEGE,28.57%
WESTERN INSTITUTE OF TECHNOLOGY,40.00%
WESTERN MINDANAO STATE U- ZAMBOANGA CITY,28.57%
WESTERN PHILIPPINES UNIV.(for.PALAWAN N.A.C)-ABORLAN,40.00%
WESTERN PHILIPPINES UNIVERSITY- PUERTO PRINCESA,0.00%
"WORLD CITI COLLEGES, QUEZON CITY(QUEZON CITY M.C.C)",100.00%
XAVIER UNIVERSITY,45.00%
