SCHOOL,% PASSED
NORTHERN ILOILO POLYTECHNIC STATE COLLEGE-LEMERY,50.00%
NORTHERN LEYTE COLLEGE,0.00%
NORTHERN LUZON ADVENTIST COLLEGE,29.41%
NORTHERN MINDANAO COLLEGE,14.29%
NORTHERN MINDANAO STATE INSTITUTE OF SCIENCE & TECHNOLOGY,19.47%
"NORTHERN QUEZON COOPERATIVE COLLEGE, INC.",16.05%
NORTHERN SAMAR ACADEMY,16.67%
NORTHERN ZAMBALES COLLEGE (for.VDRC)-MASINLOC,7.69%
NORTHWEST SAMAR STATE UNIVERSITY,11.04%
(FOR.TIBURCIO TANCINCO),
NORTHWESTERN AGUSAN COLLEGE,5.56%
NORTHWESTERN MINDANAO STATE COLLEGE OF SCIENCE & TECHNOLOGY,0.00%
NORTHWESTERN UNIVERSITY,5.88%
NORTHWESTERN VISAYAN COLLEGES,9.38%
NOTRE DAME HOSPITAL & SCHOOL OF MIDWIFERY,0.00%
NOTRE DAME OF DADIANGAS COLLEGE,50.00%
NOTRE DAME OF JOLO COLLEGE,1.64%
NOTRE DAME OF KIDAPAWAN COLLEGE,6.25%
NOTRE DAME OF MARBEL UNIVERSITY,31.82%
NOTRE DAME OF MIDSAYAP COLLEGE,8.33%
NOTRE DAME OF SALAMAN COLLEGE,6.90%
NOTRE DAME OF SIENA COLLEGE,0.00%
NOTRE DAME OF TACURONG COLLEGE,2.33%
NOTRE DAME RVM COLLEGE OF COTABATO-COTABATO CITY,25.00%
NOTRE DAME UNIVERSITY,10.95%
NUEVA ECIJA UNIVERSITY OF SCIENCE & TECHNOLOGY-CABANATUAN),27.78%
NUEVA ECIJA UNIVERSITY OF SCIENCE & TECHNOLOGY-GABALDON),0.00%
NUEVA ECIJA UNIVERSITY OF SCIENCE & TECHNOLOGY-SAN ISIDRO),19.44%
NUEVA VIZCAYA STATE UNIVERSITY (NVPC)-BAMBANG,30.30%
NUEVA VIZCAYA STATE UNIVERSITY (NVSIT)-BAYOMBONG,40.00%
OAS COMMUNITY COLLEGE-OAS,25.00%
"OB MONTESSORI CENTER, INC.",100.00%
OCCIDENTAL MINDORO COMMUNITY COLLEGE,11.54%
OCCIDENTAL MINDORO STATE COLLEGE,13.04%
OLIVAREZ COLLEGE-PARAÑAQUE,16.67%
OLIVAREZ COLLEGE-TAGAYTAY CITY,100.00%
OPOL COMMUNITY COLLEGE,44.44%
ORTANEZ UNIVERSITY,0.00%
OSIAS COLLEGES,0.00%
OSIAS EDUCATIONAL FOUNDATION,0.00%
OSMENA COLLEGE-MASBATE,3.00%
OUR LADY OF ASSUMPTION COLLEGE,0.00%
OUR LADY OF FATIMA UNIVERSITY-QC,50.00%
OUR LADY OF LOURDES COLLEGE,0.00%
OUR LADY OF LOURDES TECHNOLOGICAL COLLEGE,28.57%
OUR LADY OF MANAOAG COLLEGE,33.33%
OUR LADY OF PERPETUAL SUCCOR COLLEGE,80.00%
OUR LADY OF SALVACION COLLEGE,9.09%
OUR LADY OF THE PILLAR'S COLLEGE,11.11%
OVILLA TECHNICAL COLLEGE,5.88%
PACASUM COLLEGE,0.96%
PACIFICAN COLLEGE,0.00%
PAGADIAN COLLEGE OF CRIMINOLOGY & SCIENCES,4.76%
PALAWAN STATE UNIVERSITY-BROOKS POINT,0.00%
PALAWAN STATE UNIVERSITY-CORON,60.00%
PALAWAN STATE UNIVERSITY-CUYO,8.11%
PALAWAN STATE UNIVERSITY-NARRA,100.00%
PALAWAN STATE UNIVERSITY-P. PRINCESA,47.83%
PALAWAN STATE UNIVERSITY-QUEZON,0.00%
PALAWAN STATE UNIVERSITY-ROXAS,0.00%
PALOMPON INSTITUTE OF TECHNOLOGY-PALOMPON,10.00%
PALOMPON INSTITUTE OF TECHNOLOGY-TABANGO CAMPUS,18.18%
PAMANTASAN NG CABUYAO,18.18%
PAMANTASAN NG LUNGSOD NG MUNTINLUPA (MPC),18.46%
PAMANTASAN NG LUNGSOD NG PASAY,18.68%
PAMANTASAN NG LUNGSOD NG PASIG,55.56%
PAMANTASAN NG LUNGSOD NG VALENZUELA,50.00%
PAMANTASAN NG MONTALBAN- RODRIGUEZ(MONTALBAN),52.63%
PAMBAYANG KOLEHIYO NG MAUBAN,6.25%
PAMPANGA AGRICULTURAL COLLEGE,44.44%
PAMPANGA COLLEGES,2.44%
PANAON COLLEGE OF FISHERIES,14.29%
PANAY STATE POLYTECHNIC COLLEGE- PILAR,4.35%
PANAY STATE POLYTECHNIC COLLEGE- PONTEVEDRA,11.43%
PANAY STATE POLYTECHNIC COLLEGE- TAPAZ,5.45%
PANGASINAN MEMORIAL COLLEGE,4.55%
PANGASINAN STATE UNIVERSITY- ASINGAN,14.29%
PANGASINAN STATE UNIVERSITY- BAYAMBANG,18.71%
PANGASINAN STATE UNIVERSITY- BINMALEY,0.00%
PANGASINAN STATE UNIVERSITY- INFANTA,0.00%
PANGASINAN STATE UNIVERSITY- LINGAYEN,14.29%
PANGASINAN STATE UNIVERSITY-SAN CARLOS CITY,6.85%
PANGASINAN STATE UNIVERSITY-STA. MARIA,17.50%
PANGASINAN STATE UNIVERSITY- URDANETA,50.00%
PANPACIFIC UNIVERSITY NORTH PHILIPPINES (PANG.CST),16.67%
PARANG FOUNDATION COLLEGE,0.00%
PARTIDO COLLEGE,7.46%
PARTIDO STATE UNIVERSITY-(GOA)GAO,17.39%
PASIG CATHOLIC COLLEGE,0.00%
PASS COLLEGE (PHIL. ACCOUNTANCY & SCIENCE SCH.),33.33%
PASSI CITY COLLEGE,40.00%
PATRIA SABLE CORPUZ COLLEGE,0.00%
PATTS SCHOOL OF AERONAUTICS,0.00%
PERPETUAL HELP COLLEGE OF PANGASINAN,22.73%
"PHILIPPINE ADVENT COLLEGE, INC.",0.00%
"PHILIPPINE CENTRAL COLLEGE OF ARTS, SCIENCE & TECHNOLOGY",33.33%
PHILIPPINE CHRISTIAN UNIVERSITY- DASMARINAS,4.17%
PHILIPPINE CHRISTIAN UNIVERSITY- MANILA,18.92%
PHILIPPINE COLLEGE FOUNDATION,16.67%
PHILIPPINE HARVARDIAN COLLEGE,0.00%
PHILIPPINE MUSLIM COLLEGE,0.00%
PHILIPPINE MUSLIM TEACHER'S COLLEGE,2.47%
PHILIPPINE NORMAL UNIVERSITY- AGUSAN,21.68%
PHILIPPINE NORMAL UNIVERSITY-CADIZ CITY,38.46%
PHILIPPINE NORMAL UNIVERSITY- ISABELA,30.17%
PHILIPPINE NORMAL UNIVERSITY-LOPEZ,21.48%
PHILIPPINE NORMAL UNIVERSITY- MANILA,53.66%
PHILIPPINE UNION COLLEGE-NAGA CITY,25.00%
PHILIPPINE WOMEN'S UNIVERSITY- MANILA,85.71%
PHILIPPINE WOMEN'S UNIVERSITY- QUEZON CITY,66.67%
PILAR COLLEGE,0.00%
PILGRIM CHRISTIAN COLLEGE,21.43%
PILI CAPITAL EDUCATIONAL CENTER,0.00%
PIMSAT COLLEGES,33.33%
"PLT COLLEGE, INC",9.09%
POLYTECHNIC COLLEGE OF LA UNION,0.00%
POLYTECHNIC INSTITUTE OF TABACO,33.33%
POLYTECHNIC STATE COLLEGE OF ANTIQUE,26.00%
POLYTECHNIC STATE COLLEGE OF ANTIQUE-TARIO LIM RUIZ CAMPUS,16.13%
POLYTECHNIC UNIVERSITY OF THE PHILIPPINES-LOPEZ,0.00%
POLYTECHNIC UNIVERSITY OF THE PHILIPPINES-STA. ROSA,0.00%
PRESBYTERIAN THEOLOGICAL SEMINARY,46.67%
PRINCE OF PEACE MONTESSORI & COLLEGES,25.00%
QUEEN OF APOSTLES COLLEGE SEMINARY,0.00%
QUEZON COLLEGES OF SOUTHERN PHILLIPINES,7.97%
QUEZON INSTITUTE OF TECHNOLOGY,0.00%
QUEZON MEMORIAL COLLEGE,0.00%
QUEZON MEMORIAL INSTITUTE OF SIQUIJOR,11.11%
QUEZONIAN EDUCATIONAL COLLEGE,15.28%
QUIRINO POLYTECHNIC COLLEGE,30.00%
QUIRINO STATE COLLEGE,9.68%
R. G. DE CASTRO COLLEGES,3.13%
RAMON MAGSAYSAY MEMORIAL COLLEGES,20.00%
RAMON MAGSAYSAY TECHNOLOGICAL UNIVERSITY-BOTOLAN CAMPUS,0.00%
RAMON MAGSAYSAY TECHNOLOGICAL UNIVERSITY-CASTILLEJOS,50.00%
RAMON MAGSAYSAY TECHNOLOGICAL UNIVERSITY-IBA,18.75%
RAMON MAGSAYSAY TECHNOLOGICAL UNIVERSITY-SAN MARCELINO,23.08%
RAMON MAGSAYSAY TECHNOLOGICAL UNIVERSITY-STA. CRUZ,0.00%
RAPU-RAPU COMMUNITY COLLEGE,5.41%
REGIONAL MADRASAH GRADUATE ACADEMY,0.00%
REGIS MARIE COLLEGE,9.09%
REMEDIOS T. ROMUALDEZ MEDICAL FOUNDATION,100.00%
REPUBLIC CENTRAL COLLEGES,13.11%
REPUBLIC COLLEGES,7.58%
RIZAL COLLEGE OF TAAL,4.41%
"RIZAL MARINE & TECHNO-COMPUTER COLL-INFANTA, QUEZON",0.00%
RIZAL MEMORIAL COLLEGE,2.31%
RIZAL MEMORIAL INSTITUTE,15.38%
ROMAN C. VILLALON MEMORIAL COLLEGES FOUNDATION,16.67%
ROMBLON COLLEGE,0.00%
ROMBLON COLLEGE OF FISHERIES & FORESTRY-SAN ANDRES,16.67%
ROMBLON STATE COLLEGE-(SIBUYAN PC)-SAN FERNANDO,7.14%
ROMBLON STATE COLLEGE- CAJIDIONGAN,33.33%
ROMBLON STATE COLLEGE-CALATRAVA,20.00%
ROMBLON STATE COLLEGE-ODIONGAN,19.57%
ROMBLON STATE COLLEGE-SAN AGUSTIN,28.57%
ROMBLON STATE COLLEGE-SAWANG CAMPUS,18.00%
ROMBLON STATE COLLEGE-STA. FE,20.00%
ROMBLON STATE COLLEGE-STA. MARIA,5.26%
ROOSEVELT COLLEGE-CAINTA,27.27%
ROOSEVELT COLLEGE-MARIKINA,0.00%
ROXAS COLLEGE-ROXAS,6.25%
ROYAL CHRISTIAN COLLEGE,50.00%
"SACRED HEART COLLEGE OF LUCENA CITY, INC.",10.00%
SACRED HEART SCHOOL-MISAMIS OCCIDENTAL,20.00%
SAINT ANTHONY COLLEGE OF TECHNOLOGY,22.22%
SAINT ANTHONY'S COLLEGE-ANTIQUE,13.89%
SAINT ANTHONY'S COLLEGE-CAGAYAN,0.00%
SAINT ANTHONY'S COLLEGE-ROXAS CITY,0.00%
SAINT AUGUSTINE COLLEGE,0.00%
"SAINT AUGUSTINE COLLEGES FOUNDATION, INC",0.00%
SAINT BENEDICT COLLEGE-COTABATO CITY,0.00%
SAINT BERNADETTE COLLEGE OF ALABANG,0.00%
SAINT BRIDGET'S COLLEGE,20.00%
SAINT CATHERINE COLLEGE,25.00%
SAINT CATHERINE'S COLLEGE-CARCAR,16.00%
SAINT COLUMBAN COLLEGE-PAGADIAN CITY,6.99%
SAINT COLUMBAN'S COLLEGE- LINGAYEN,8.33%
SAINT DOMINIC COLLEGE OF BATANES,25.00%
SAINT FERDINAND COLLEGE-CABAGAN,10.00%
SAINT FERDINAND COLLEGE-ILAGAN,2.50%
SAINT FRANCIS COLLEGE-GUIHULNGAN,57.14%
SAINT FRANCIS DIVINE INSTITUTE- QUEZON CITY,50.00%
SAINT FRANCIS EDUCATIONAL INSTITUTE,5.26%
SAINT FRANCIS INSTITUTE OF TECHNOLOGY,0.00%
SAINT FRANCIS OF ASSISSI COLLEGE,14.29%
SAINT FRANCIS XAVIER COLLEGE,13.33%
SAINT JOHN COLLEGE-CALAMBA,16.67%
SAINT JOHN GENERAL HOSPITAL COLLEGE-BUUG,0.00%
SAINT JOSEPH ACADEMY-CANLAON,5.26%
SAINT JOSEPH COLLEGE OF BULACAN,7.69%
SAINT JOSEPH COLLEGE-CAGAYAN,27.27%
SAINT JOSEPH COLLEGE-ZAMBOANGA DEL NORTE,12.07%
SAINT JOSEPH INSTITUTE OF TECHNOLOGY,10.00%
SAINT JOSEPH'S COLLEGE OF QUEZON CITY,100.00%
SAINT JOSEPH'S COLLEGE-MAASIN,25.45%
SAINT JOSEPH'S JUNIOR COLLEGE,0.00%
SAINT JUDE THADDEUS INSTITUTE OF TECHNOLOGY,40.00%
"SAINT LOUIS ANNE COLLEGES OF SAN PEDRO, LAGUNA, INC",0.00%
SAINT LOUIS COLLEGE OF BULANAO,6.25%
SAINT LOUIS COLLEGE OF SAN FERNANDO,33.33%
SAINT LOUIS UNIVERSITY,65.79%
SAINT LOUISE DE MARILLAC COLLEGE OF BOGO,33.33%
SAINT LOUISE DE MARILLAC COLLEGE OF SORSOGON,10.53%
SAINT LUKES INSTITUTE,0.00%
SAINT MARY'S COLLEGE (ST. JOSEPH'S COLL.)-BORONGAN,0.00%
SAINT MARY'S COLLEGE OF CATBALOGAN (SACRED HEART COLL.),21.43%
SAINT MARY'S COLLEGE OF MEYCAUAYAN,33.33%
SAINT MARY'S COLLEGE-BOAC,38.46%
SAINT MARY'S COLLEGE-ILOCOS SUR,0.00%
SAINT MARY'S COLLEGE-LABASON,0.00%
SAINT MARY'S COLLEGE-Q.C.,100.00%
SAINT MARY'S COLLEGE-TAGUM,21.43%
SAINT MARY'S UNIVERSITY,46.15%
"SAINT MICHAEL COLLEGE  OF GUAGUA, INC.",21.43%
"SAINT MICHAEL COLLEGE OF CARAGA, INC",0.00%
"SAINT MICHAEL COLLEGE-HINDANG, LEYTE",18.75%
SAINT MICHAEL'S COLLEGE OF LAGUNA,0.00%
SAINT MICHAEL'S COLLEGE-ILIGAN CITY,12.82%
SAINT MICHAEL'S COLLEGE-SURIGAO DEL SUR,15.38%
SAINT PAUL BUSINESS SCHOOL OF TACLOBAN,33.33%
"SAINT PAUL COLLEGE FOUNDATION, INC (CEBU-ST PAUL COLL)",0.00%
SAINT PAUL COLLEGE OF SAN MIGUEL,36.36%
SAINT PAUL COLLEGE OF TECHNOLOGY-PANIQUI,25.00%
SAINT PAUL COLLEGE-BANTAY(ST.PAUL- VIGAN),14.29%
SAINT PAUL UNIVERSITY-DUMAGUETE,26.67%
SAINT PAUL UNIVERSITY-MANILA,100.00%
SAINT PAUL UNIVERSITY-QUEZON CITY,100.00%
SAINT PAUL UNIVERSITY-SURIGAO,2.86%
SAINT PAUL UNIVERSITY-TUGUEGARAO,9.23%
SAINT PAUL'S BUSINESS SCHOOL-PALO,100.00%
SAINT PEDRO POVEDA COLLEGE,100.00%
SAINT PETER BAPTIST COLLEGE,0.00%
SAINT PETER COLLEGE-BALINGASAG,5.63%
SAINT PETER'S COLLEGE OF ORMOC,14.29%
SAINT PETER'S COLLEGE OF TORIL,33.33%
SAINT PETER'S COLLEGE-ILIGAN CITY,2.08%
SAINT RITA COLLEGE-PARANAQUE,0.00%
SAINT RITA'S COLLEGE-BALINGASAG,31.58%
SAINT RITA'S COLLEGE-MANILA,33.33%
SAINT SCHOLASTICA'S COLLEGE,77.78%
SAINT THERESA COLLEGE-TANDAG,2.22%
SAINT THERESA'S COLLEGE-CEBU,100.00%
SAINT THERESA'S COLLEGE-MANILA,0.00%
SAINT THOMAS AQUINAS COLLEGE,100.00%
SAINT VINCENT COLLEGE-CEBU CITY,0.00%
SAINT VINCENT COLLEGE-DIPOLOG CITY,4.62%
SAINT VINCENT DE PAUL COLLEGE- BISLIG,9.09%
SALAZAR INSTITUTE OF TECHNOLOGY- CEBU CITY,11.11%
SALAZAR INSTITUTE OF TECHNOLOGY- MADRIDEJOS,0.00%
SAMAR AGRICULTURAL COLLEGE,0.00%
SAMAR COLLEGE,1.69%
SAMAR STATE UNIVERSITY (SAMAR S.P.C.),31.71%
SAN AGUSTIN INSTITUTE OF TECHNOLOGY,1.72%
SAN CARLOS COLLEGE,4.26%
SAN ESTANISLAO KOSTKA COLLEGE,0.00%
SAN FRANCISCO COLLEGE,0.00%
SAN FRANCISCO JAVIER COLLEGE,33.33%
SAN ILDEFONSO COLLEGE,18.18%
SAN ISIDRO COLLEGE,7.14%
SAN JACINTO COLLEGE,0.00%
SAN JOSE CHRISTIAN COLLEGES,5.26%
SAN JOSE COLLEGE-ILOILO CITY,0.00%
SAN JOSE COLLEGES-NUEVA ECIJA,0.00%
SAN JOSE COMMUNITY COLLEGE- MALILIPOT,16.46%
"SAN JOSE COMMUNITY COLLEGE-SAN JOSE, OCC. MINDORO",0.00%
SAN NICOLAS COLLEGE,0.00%
SAN PABLO COLLEGES,12.50%
SAN PEDRO COLLEGE OF BUSINESS ADMINISTRATION,33.33%
SANTA CATALINA COLLEGE,18.18%
SANTA ISABEL COLLEGE,20.00%
SANTA MONICA INSTITUTE OF TECHNOLOGY,0.00%
SANTA TERESA COLLEGE,28.57%
SANTO ROSARIO SAPANG PALAY COLLEGE,4.62%
SARIFF KABUNSUAN COLLEGE,0.00%
SENATOR NINOY AQUINO COLLEGE FOUNDATION,2.20%
SHARIFF KABUNSUAN COLLEGE,5.56%
SHEPHERDS COLLEGE,25.00%
SIARGAO ISLAND INSTITUTE OF TECHNOLOGY,3.03%
SIENA COLLEGE OF TAYTAY,40.00%
SIENA SCHOOL OF SAN JOSE,33.33%
SILAY INSTITUTE,37.50%
SILLIMAN UNIVERSITY,62.50%
SIQUIJOR STATE COLLEGE,5.00%
SOLIS INSTITUTE OF TECHNOLOGY,25.00%
SOLOMON MOLINA SCHOOL & DEVELOPMENT CENTER,14.29%
SORSOGON COLLEGE OF ARTS & TRADE,0.00%
SORSOGON STATE COLLEGE-BULAN CAMPUS,0.00%
SORSOGON STATE COLLEGE- MAGALLANES,50.00%
SORSOGON STATE COLLEGE- SORSOGON,34.15%
SOUTH PHILIPPINE ADVENTIST COLLEGE,0.00%
SOUTHEASTERN COLLEGE OF PADADA,0.00%
SOUTHEASTERN COLLEGE-PASAY,10.00%
SOUTHERN BAPTIST COLLEGE,9.09%
SOUTHERN BICOL COLLEGES,0.00%
SOUTHERN CAPITAL COLLEGE,0.00%
SOUTHERN CHRISTIAN COLLEGE,7.04%
SOUTHERN CITY COLLEGES,6.25%
SOUTHERN DE ORO PHILIPPINE COLLEGE,14.29%
SOUTHERN LEYTE STATE COLLEGE OF SCIENCE & TECH.-BONTOC,0.00%
SOUTHERN LEYTE STATE COLLEGE OF SCIENCE & TECH.-SAN JUAN,7.14%
SOUTHERN LEYTE STATE UNIVERSITY (SLSCST)-SOGOD,4.55%
SOUTHERN LEYTE STATE UNIVERSITY- T.OPPUS,17.92%
SOUTHERN LUZON INSTITUTE,6.90%
SOUTHERN LUZON STATE UNIVERSITY- LUCBAN (SLPC),33.82%
SOUTHERN LUZON STATE UNIVERSITY- POLILLO (SLPC),33.33%
SOUTHERN MASBATE ROOSEVELT INSTITUTE,5.62%
SOUTHERN MINDANAO COLLEGES,2.68%
SOUTHERN MINDANAO INSTITUTE OF TECHNOLOGY,3.57%
SOUTHERN PENINSULA COLLEGE,0.00%
SOUTHERN PHILIPPINE ACADEMY,16.67%
"SOUTHERN PHILIPPINE ACADEMY COLLEGE, INC",13.33%
SOUTHERN PHILIPPINE COLLEGE,23.08%
SOUTHERN PHILIPPINE METHODIST COLLEGE,10.00%
SOUTHVILLE INTERNATIONAL SCHOOL AND COLLEGES,100.00%
SOUTHWESTERN MINDANAO ISLAMIC INSTITUTE,0.00%
SOUTHWESTERN PHILIPPINES FOUNDATION COLLEGE,0.00%
SOUTHWESTERN UNIVERSITY,14.29%
SOUTHWESTERN UNIVERSITY-COLLEGE OF MEDICINE,33.33%
"SPA COLLEGE, INC.",0.00%
ST. CAMILLUS COLLEGE OF MANAOAG,20.00%
ST. CLAIRE COLLEGE,100.00%
ST. CLARE COLLEGE OF CALOOCAN,20.75%
ST. DOMINIC COLLEGE OF ARTS AND SCIENCES,0.00%
ST. JOSEPH COLLEGE-CAVITE CITY,0.00%
ST. JOSEPH COLLEGE-OLONGAPO CITY,0.00%
ST. MARY'S ANGELS COLLEGE OF PAMPANGA,0.00%
ST. MATTHEW COLLEGE,100.00%
"ST. ROSE COLLEGE EDUCATIONAL FOUNDATION, INC",25.00%
STA. ELENA (CAMARINES NORTE) COLLEGE INC.,25.00%
STELLA MARIS COLLEGE-OROQUIETA CITY,13.04%
STO. NIÑO COLLEGE OF ORMOC,0.00%
SULTAN KUDARAT EDUCATIONAL INSTITUTION,0.00%
SULTAN KUDARAT ISLAMIC ACADEMY,8.33%
SULTAN KUDARAT POLYTECHNIC STATE COLLEGE-TACURONG,13.56%
SULU STATE COLLEGE,0.84%
SUNRISE CHRISTIAN COLLEGE FOUNDATION OF THE PHILIPPINES,12.50%
SURIGAO DEL NORTE COLLEGE OF AGRICULTURE & TECHNOLOGY,0.00%
SURIGAO DEL NORTE SCHOOL OF ARTS & TRADES,0.00%
SURIGAO DEL SUR POLYTECHNIC COLLEGE-LIANGA,11.76%
SURIGAO DEL SUR POLYTECHNIC COLLEGE-TANDAG,14.29%
SURIGAO DEL SUR POLYTECHNIC STATE COLLEGE-CANTILAN,0.00%
SURIGAO DEL SUR POLYTECHNIC STATE COLLEGE-SAN MIGUEL,0.00%
SURIGAO DEL SUR POLYTECHNIC STATE COLLEGE-TAGBINA,33.33%
SURIGAO EDUCATION CENTER,0.00%
SURIGAO STATE COLLEGE OF TECHNOLOGY,17.14%
SURIGAO SUR COLLEGE,10.00%
"SYSTEMS PLUS COLLEGE FOUNDATION,INC-ANGELES CITY(SPCCF)",100.00%
TABACO COLLEGE,0.00%
TAGOLOAN COMMUNITY COLLEGE,19.23%
TALISAY CITY COLLEGE,76.39%
TANAUAN INSTITUTE,8.82%
TANGUB CITY COLLEGES,0.00%
TARLAC COLLEGE OF AGRICULTURE,20.00%
TARLAC STATE UNIVERSITY  (TARLAC COLLEGE OF TECH.),18.03%
TAWI-TAWI REGIONAL AGRICULTURAL COLLEGE,0.00%
TAYABAS WESTERN ACADEMY,15.79%
TAÑON COLLEGE,0.00%
TECHNOLOGICAL INSTITUTE OF THE PHILIPPINES-QUEZON CITY,0.00%
TEODORO M. LUANSING COLLEGE OF ROSARIO,0.00%
THE COLLEGES OF THE REPUBLIC,0.00%
THE FISHER VALLEY COLLEGE,45.45%
THE GOOD SAMARITAN COLLEGES- CABANATUAN CITY,100.00%
TIWI COMMUNITY COLLEGE,10.87%
TOLEDO GULLAS COLLEGE,18.92%
TOMAS CLAUDIO MEMORIAL COLLEGE,0.00%
TOMAS DEL ROSARIO ACADEMY,12.00%
TRINIDAD MUNICIPAL COLLEGE,0.00%
TRINITAS COLLEGE-MEYCAUAYAN,33.33%
TRINITY UNIVERSITY OF ASIA (TRINITY- QC),25.00%
U. V. GULLAS COLLEGE-DANAO CITY,0.00%
UNION CHRISTIAN COLLEGE,11.76%
UNION COLLEGE,7.59%
UNIVERSIDAD DE SANTA ISABEL (COL DE STA ISABEL),0.00%
UNIVERSIDAD DE ZAMBOANGA (for.ZAEC),8.64%
UNIVERSITY OF ASIA & THE PACIFIC- PASIG,100.00%
UNIVERSITY OF BAGUIO,34.62%
UNIVERSITY OF BATANGAS,17.07%
UNIVERSITY OF BOHOL,18.37%
UNIVERSITY OF CAGAYAN VALLEY(for.CAGAYAN COLL OF TUG.),2.68%
UNIVERSITY OF CALOOCAN CITY(for.CALOOCAN CITY P.C.),34.65%
UNIVERSITY OF CEBU,23.24%
UNIVERSITY OF CEBU IN LAPULAPU & MANDAUE,28.00%
UNIVERSITY OF CEBU-BANILAD,0.00%
UNIVERSITY OF EASTERN PHILIPPINES- CATARMAN,17.50%
UNIVERSITY OF EASTERN PHILIPPINES- CATUBIG CAMPUS,9.62%
UNIVERSITY OF EASTERN PHILIPPINES- LAOANG CAMPUS,12.24%
UNIVERSITY OF ILOILO,13.95%
UNIVERSITY OF LA SALETTE-SANTIAGO,19.51%
UNIVERSITY OF LUZON (LUZON COLL.),11.54%
UNIVERSITY OF MAKATI,60.00%
UNIVERSITY OF MANILA,30.77%
UNIVERSITY OF MINDANAO-COTABATO COLLEGE,11.11%
UNIVERSITY OF MINDANAO-DAVAO CITY,30.36%
UNIVERSITY OF MINDANAO-DIGOS COLLEGE,10.42%
UNIVERSITY OF MINDANAO-PANABO,10.00%
UNIVERSITY OF MINDANAO-PENAPLATA,0.00%
UNIVERSITY OF MINDANAO-TAGUM,16.36%
UNIVERSITY OF NEGROS OCCIDENTAL- RECOLETOS,20.69%
UNIVERSITY OF NORTHEASTERN PHILIPPINES,10.53%
UNIVERSITY OF NORTHERN PHILIPPINES-CANDON,21.43%
UNIVERSITY OF NORTHERN PHILIPPINES-VIGAN,23.53%
UNIVERSITY OF NUEVA CACERES,15.87%
UNIVERSITY OF PANGASINAN,22.37%
UNIVERSITY OF PERPETUAL HELP RIZAL-CALAMBA CAMPUS,0.00%
UNIVERSITY OF PERPETUAL HELP RIZAL-MOLINO,25.00%
UNIVERSITY OF PERPETUAL HELP SYSTEM DALTA-LAS PINAS,7.14%
UNIVERSITY OF PERPETUAL HELP SYSTEM-GMA,0.00%
UNIVERSITY OF PERPETUAL HELP SYSTEM-LAGUNA,12.50%
UNIVERSITY OF REGINA CARMELI (for.REGINA CARMELI COLL),16.67%
UNIVERSITY OF RIZAL SYSTEM-ANGONO,33.33%
UNIVERSITY OF RIZAL SYSTEM- ANTIPOLO,25.00%
UNIVERSITY OF RIZAL SYSTEM-CAINTA,6.25%
UNIVERSITY OF RIZAL SYSTEM- MORONG,9.40%
UNIVERSITY OF RIZAL SYSTEM-PILILLA,17.65%
UNIVERSITY OF RIZAL SYSTEM- RODRIGUEZ,28.57%
UNIVERSITY OF RIZAL SYSTEM-TANAY,33.33%
UNIVERSITY OF SAINT ANTHONY,13.95%
UNIVERSITY OF SAINT LA SALLE,76.47%
UNIVERSITY OF SAINT LOUIS- TUGUEGARAO,18.18%
UNIVERSITY OF SAN AGUSTIN,25.58%
UNIVERSITY OF SAN CARLOS,50.00%
UNIVERSITY OF SAN JOSE-RECOLETOS,28.81%
UNIVERSITY OF SANTO TOMAS,80.00%
UNIVERSITY OF SOUTHEASTERN PHILIPPINES-BAGANGA,0.00%
UNIVERSITY OF SOUTHEASTERN PHILIPPINES-BISLIG CAMPUS,0.00%
UNIVERSITY OF SOUTHEASTERN PHILIPPINES-DAVAO CITY,37.84%
UNIVERSITY OF SOUTHEASTERN PHILIPPINES-KAPALONG,0.00%
UNIVERSITY OF SOUTHEASTERN PHILIPPINES-MABINI,0.00%
UNIVERSITY OF SOUTHEASTERN PHILIPPINES-TAGUM,52.00%
UNIVERSITY OF SOUTHERN MINDANAO- KABACAN,14.34%
UNIVERSITY OF SOUTHERN MINDANAO- KIDAPAWAN,8.33%
UNIVERSITY OF SOUTHERN PHILIPPINES,21.43%
UNIVERSITY OF THE ASSUMPTION,22.22%
UNIVERSITY OF THE CORDILLERAS (for.BAGUIO C.F.),41.67%
UNIVERSITY OF THE EAST-CALOOCAN,0.00%
UNIVERSITY OF THE EAST-MANILA,33.33%
UNIVERSITY OF THE IMMACULATE CONCEPTION-DAVAO,40.00%
UNIVERSITY OF THE PHILIPPINES- DILIMAN,100.00%
UNIVERSITY OF THE PHILIPPINES- VISAYAS-CEBU CITY,0.00%
UNIVERSITY OF THE VISAYAS-CEBU CITY,7.74%
UNIVERSITY OF THE VISAYAS-DANAO CITY,27.27%
UNIVERSITY OF THE VISAYAS-MANDAUE CITY,7.69%
"UPI AGRICULTURAL SCHOOL-UPI, MAGUINDANAO",35.48%
URDANETA CITY UNIVERSITY (CCU),11.32%
URDANETA COLLEGE OF TECHNOLOGY,0.00%
VALENCIA COLLEGES,3.57%
VELEZ COLLEGE,0.00%
VERITAS COLLEGE OF IROSIN,22.73%
VICENTE A. JAVIER MEMORIAL COMMUNITY COLLEGE,100.00%
VILLAFLORES COLLEGE,4.26%
VIRGEN DELOS REMEDIOS COLLEGE- OLONGAPO CITY,0.00%
VIRGEN MILAGROSA UNIVERSITY FOUNDATION,15.79%
VISAYAN NAZARENE BIBLE COLLEGE,33.33%
VISAYAS STATE COLLEGE OF AGRICULTURE-ISABEL,29.17%
"VISAYAS STATE UNIVERSITY (for.VISCA,LSU.)-BAYBAY",32.91%
WESLEYAN COLLEGE OF MANILA,100.00%
WESLEYAN UNIVERSITY-PHILIPPINES- CABANATUAN CITY,2.94%
WESLEYAN UNIVERSITY-PHILIPPINES- MARIA AURORA,38.89%
WEST COAST COLLEGE-PIODURAN,0.00%
WEST NEGROS COLLEGE,24.68%
WEST VISAYAS STATE UNIVERSITY- CALINOG,30.77%
"WEST VISAYAS STATE UNIVERSITY- HIMAMAYLAN, NEGROS OCCIDENTAL",44.44%
WEST VISAYAS STATE UNIVERSITY- JANIUAY,28.57%
WEST VISAYAS STATE UNIVERSITY-LA PAZ,62.86%
WEST VISAYAS STATE UNIVERSITY- LAMBUNAO,17.24%
WEST VISAYAS STATE UNIVERSITY- POTOTAN,31.91%
WESTERN COLLEGES-CAVITE,9.52%
WESTERN LEYTE COLLEGE-ORMOC,6.90%
WESTERN MINDANAO COOPERATIVE COLLEGE-ZAMBOANGA CITY,11.11%
WESTERN MINDANAO STATE U-(for. ZNAC)TAMPILISAN,0.00%
WESTERN MINDANAO STATE U-ALICIA,0.00%
WESTERN MINDANAO STATE U-AURORA,0.00%
WESTERN MINDANAO STATE U-IMELDA,0.00%
WESTERN MINDANAO STATE U-IPIL,14.29%
WESTERN MINDANAO STATE U- MABUHAY,28.57%
WESTERN MINDANAO STATE U- MALANGAS,0.00%
WESTERN MINDANAO STATE U- OLUTANGA,9.09%
WESTERN MINDANAO STATE U- PAGADIAN CITY,100.00%
WESTERN MINDANAO STATE U-SIAY,25.00%
WESTERN MINDANAO STATE U- TUNGAWAN,9.09%
WESTERN MINDANAO STATE U- ZAMBOANGA CITY,18.24%
"WESTERN MINDANAO STATE
UNIVERSITY-MOLAVE, ZAMBOANGA DEL SU",0.00%
WESTERN PHILIPPINE COLLEGES,0.00%
WESTERN PHILIPPINES UNIV.(for.PALAWAN N.A.C)-ABORLAN,0.00%
WESTERN VISAYAS COLLEGE OF SCIENCE & TECHNOLOGY-B. NUEVO,0.00%
WESTERN VISAYAS COLLEGE OF SCIENCE & TECHNOLOGY-LA PAZ,33.33%
"WORLD CITI COLLEGES-ANTIPOLO, INC.",100.00%
XAVIER UNIVERSITY,60.87%
ZAMBOANGA CITY STATE POLYTECHNIC COLLEGE,0.00%
ZAMBOANGA DEL NORTE AGRICULTURAL COLLEGE,0.00%
ZAMBOANGA DEL SUR AGRICULTURAL COLLEGE-DUMINGAG,9.09%
ZAMBOANGA STATE COLLEGE OF MARINE SCIENCES & TECHNOLOGY,0.00%
ZAMORA MEMORIAL COLLEGE,0.00%
ZARAGOSA COLLEGE,0.00%
