SCHOOL,% PASSED
ABADA COLLEGE,10.17%
ABRA STATE INST. OF SCIENCE & TECH.(ABRA IST)-BANGUED,7.14%
ABRA STATE INST. OF SCIENCE & TECH.(ABRA IST)-LAGANGILANG,4.55%
ABRA VALLEY COLLEGE,0.00%
ABUBAKAR COMPUTER LEARNING CENTER,0.00%
ABUYOG COMMUNITY COLLEGE,21.28%
ACADEMIA DE SAN LORENZO DEMA-ALA,100.00%
ACES TAGUM COLLEGE,0.00%
ADAMSON UNIVERSITY,37.50%
ADELPHI COLLEGE,0.00%
ADIONG MEMORIAL POLYTECHNIC STATE COLLEGE,0.00%
ADVENTIST UNIVERSITY OF THE PHILIPPINES,38.46%
AEMILIANUM INSTITUTE,0.00%
AGRO-INDUSTRIAL FOUNDATION COLLEGES OF THE PHILIPPINES,6.67%
AGUSAN COLLEGES,7.55%
AGUSAN DEL SUR COLLEGE,7.89%
AGUSAN DEL SUR STATE COLLEGE OF AGRICULTURE & TECHNOLOGY,7.41%
AGUSAN INSTITUTE OF TECHNOLOGY,12.50%
AKLAN CATHOLIC COLLEGE-KALIBO,30.00%
AKLAN COLLEGE,0.00%
AKLAN STATE UNIVERSITY(AKLAN S.C.A.)-BANGA,100.00%
AKLAN STATE UNIVERSITY-IBAJAY,53.33%
AKLAN STATE UNIVERSITY-NATIONAL COLLEGE OF FISHERIES,0.00%
AKLAN STATE UNIVERSITY-NEW WASHINGTON,42.86%
ALDERSGATE COLLEGE,55.56%
ALEJANDRO COLLEGE,0.00%
"ALEMARZ SCH. OF SCIENCE & TECH FOUND INC.-VALENCIA,BUKIDNON",0.00%
ALFELOR SR. MEMORIAL COLLEGE,8.33%
ALITAGTAG COLLEGE,100.00%
ALTAVAS COLLEGE,33.33%
"AMA COMPUTER UNIVERSITY-PROJ. 8, QC",50.00%
ANDRES BONIFACIO COLLEGE,4.76%
ANDRES SORIANO COLLEGE,7.89%
ANDRES SORIANO MEMORIAL COLLEGE,17.65%
ANGELES UNIVERSITY FOUNDATION,25.00%
ANNUNCIATION COLLEGE,0.00%
"ANTONIO R. PACHECO COLLEGE, INC",7.69%
APAYAO STATE COLLEGE-CONNER,0.00%
APAYAO STATE COLLEGE-LUNA CAMPUS,16.67%
AQUINAS UNIVERSITY,9.09%
ARAULLO UNIVERSITY,2.52%
ARELLANO UNIVERSITY-MALABON,25.00%
ARELLANO UNIVERSITY-MANILA,18.75%
ARELLANO UNIVERSITY-PASAY,16.67%
ARELLANO UNIVERSITY-PASIG,5.88%
"ARRIESGADO COLLEGE FOUNDATION, INC.",0.00%
ASBURRY COLLEGE,66.67%
"ASIA COLLEGE OF ADVANCE STUDIES IN ARTS, SCIENCES & TECH.",0.00%
ASIA SCHOOL OF ARTS & SCIENCES,25.00%
ASIAN DEVELOPMENT FOUNDATION COLLEGE,4.00%
ASIAN SEMINARY OF CHRISTIAN MINISTRIES,100.00%
ASSUMPTION COLLEGE OF DAVAO,40.00%
ASSUMPTION COLLEGE OF NABUNTURAN,15.38%
ATENEO DE DAVAO UNIVERSITY,50.00%
ATENEO DE NAGA,44.44%
ATENEO DE TUGUEGARAO,100.00%
ATENEO DE ZAMBOANGA,0.00%
AURORA PIONEERS MEMORIAL COLLEGE,0.00%
AURORA PROSPERIDAD MEMORIAL COLLEGE,0.00%
AURORA STATE COLLEGE OF TECHNOLOGY,40.00%
BACOLOD CITY COLLEGE,50.00%
BAGO CITY COLLEGE,24.44%
BAGUIO CENTRAL UNIVERSITY,11.86%
BALAYAN COLLEGES,0.00%
BALETE COMMUNITY COLLEGE,0.00%
BALITE INSTITUTE OF TECHNOLOGY,20.00%
BALIUAG UNIVERSITY (BALIUAG COLLEGES),6.00%
BANTAYAN SOUTHERN INSTITUTE,14.29%
BASILAN STATE COLLEGE,2.69%
BATAAN PENINSULA STATE UNIVERSITY- BALANGA (for.BATAAN P.S),18.33%
BATAAN POLYTECHNIC STATE COLLEGE-ORANI,15.38%
BATAAN STATE COLLEGE,7.69%
BATAAN TEACHERS COLLEGE,0.00%
BATANES POLYTECHNIC COLLEGE,66.67%
BATANGAS EASTERN ACADEMY,0.00%
BATANGAS STATE UNIVERSITY-ARASOF- NASUGBU,4.62%
BATANGAS STATE UNIVERSITY- BATANGAS CITY,11.11%
BATO INSTITUTE OF SCIENCE & TECHNOLOGY,16.00%
BATUAN COLLEGES INC.,14.29%
BAYAWAN COLLEGE,4.17%
BENGUET STATE UNIVERSITY-BOKOD,75.00%
BENGUET STATE UNIVERSITY-BUGUIAS- LOO,50.00%
BENGUET STATE UNIVERSITY-LA TRINIDAD,50.00%
BERNARDO COLLEGE,25.00%
BICOL COLLEGE,11.54%
BICOL INSTITUTE OF SCIENCE & TECHNOLOGY,50.00%
BICOL UNIVERSITY-GUBAT,31.58%
BICOL UNIVERSITY-LEGAZPI,29.94%
BICOL UNIVERSITY-POLANGUI,21.82%
BICOL UNIVERSITY-TABACO,20.00%
BINALBAGAN CATHOLIC COLLEGE,18.75%
"BLANCIA CARREON COLLEGE FOUNDATION, INC.",9.09%
BLESSED TRINITY COLLEGE,14.29%
BOHOL INSTITUTE OF TECHNOLOGY- CARMEN,0.00%
BOHOL INSTITUTE OF TECHNOLOGY- JAGNA,0.00%
BOHOL INSTITUTE OF TECHNOLOGY- TAGBILARAN CITY,28.57%
BOHOL INSTITUTE OF TECHNOLOGY- TALIBON,9.09%
BOHOL ISLAND STATE UNIVERSITY (FOR.CVSCAFT)-BILAR,33.33%
BOHOL ISLAND STATE UNIVERSITY (FOR.CVSCAFT)-CALAPE,17.39%
BOHOL ISLAND STATE UNIVERSITY (FOR.CVSCAFT)-CANDIJAY,30.77%
BOHOL ISLAND STATE UNIVERSITY (FOR.CVSCAFT)-CLARIN,9.09%
BOHOL ISLAND STATE UNIVERSITY (FOR.CVSCAFT)-TAGBILARAN,53.33%
BOHOL NORTHEASTERN COLLEGE,11.11%
BOHOL NORTHWESTERN COLLEGE,66.67%
BRENTWOOD COLLEGE OF ASIA INTERNATIONAL SCHOOL,100.00%
BROKENSHIRE COLLEGE,37.50%
BUBONG MARZOK MEMORIAL COLLEGE FOUNDATION,0.00%
BUCAS GRANDE FOUNDATION COLLEGE,38.46%
BUENAVISTA COMMUNITY COLLEGE,25.00%
BUKIDNON STATE COLLEGE (EXTERNAL STUDIES) TANDAG,20.29%
BUKIDNON STATE COLLEGE- MALAYBALAY,19.90%
BULACAN NATIONAL AGRICULTURAL STATE COLLEGE,20.45%
BULACAN STATE UNIVERSITY (for.BCAT)- MALOLOS,22.83%
BULACAN STATE UNIVERSITY-BUSTOS,19.35%
BUTUAN CITY COLLEGES,25.00%
"C.V.E. COLLEGES INC. - PAGBILAO, QUEZON",0.00%
CABANATUAN CITY COLLEGES,0.00%
CABARRUS CATHOLIC COLLEGE,23.53%
CAGAYAN DE ORO COLLEGE,5.13%
CAGAYAN STATE UNIVERSITY-APARRI,10.00%
CAGAYAN STATE UNIVERSITY-CARITAN,15.29%
CAGAYAN STATE UNIVERSITY-GONZAGA,10.00%
CAGAYAN STATE UNIVERSITY-LAL-LO,20.00%
CAGAYAN STATE UNIVERSITY-LASAM,18.18%
CAGAYAN STATE UNIVERSITY-PIAT,15.38%
CAGAYAN STATE UNIVERSITY-SANCHEZ MIRA,29.55%
CAGAYAN STATE UNIVERSITY- TUGUEGARAO,17.14%
CAGAYAN VALLEY COLLEGES OF TUGUEGARAO,0.00%
CAINTA CATHOLIC COLLEGE,0.00%
CALABANGA POLYTECHNIC COLLEGE,0.00%
CALAUAG CENTRAL COLLEGE,2.20%
CALI PARAMEDICAL COLLEGE FOUNDATION,0.00%
CAMARINES NORTE COLLEGE,8.33%
CAMARINES NORTE STATE COLLEGE- DAET,23.53%
CAMARINES SUR COLLEGE OF ARTS & TRADES,0.00%
CAMARINES SUR POLYTECHNIC COLLEGES(BICAT)-NAGA,28.57%
CAMARINES SUR STATE AGRICULTURAL COLLEGE-PASACAO,40.00%
CAMIGUIN POLYTECHNIC STATE COLLEGE,33.33%
CAMILING COLLEGES,0.00%
CAN-AVID NATIONAL AGRICULTURAL COLLEGE,0.00%
CANOSSA COLLEGE,16.67%
CAPALONGA COLLEGE,25.00%
CAPITOL UNIVERSITY (for.CAGAYAN CAPITOL COLL.),18.75%
CAPIZ COLLEGES,0.00%
CAPIZ STATE UNIVERSITY (CIT)(PSPC)- MAIN CAMPUS,0.00%
CAPIZ STATE UNIVERSITY (PANAY SPC)- DAYAO CAMPUS,25.00%
CAPIZ STATE UNIVERSITY (PANAY SPC)- DUMARAO,8.33%
CAPIZ STATE UNIVERSITY (PANAY SPC)- MAMBUSAO,11.76%
CARAGA INSTITUTE OF TECHNOLOGY,14.29%
"CARAGA STATE UNIVERSITY- CABADBARAN, AGUSAN DEL SUR",100.00%
CARAMOAN COMMUNITY COLLEGE,3.23%
CARLOS A. HILADO MEMORIAL STATE COLLEGE-ESCALANTE,100.00%
CARLOS C. HILADO MEMORIAL STATE COLLEGE-TALISAY,47.31%
"CARTHEL SCIENCE EDUCATIONAL FOUNDATION,INC. (for.OLRA)",0.00%
CATAINGAN MUNICIPAL COLLEGE,7.50%
CATANDUANES AGRICULTURAL & INDUSTRIAL COLLEGE,33.33%
CATANDUANES COLLEGE,14.84%
CATANDUANES STATE COLLEGE- MASBATE,0.00%
CATANDUANES STATE COLLEGES- VIRAC,19.85%
CAVITE STATE UNIVERSITY (CAVITE COLL. OF FISHERIES)-NAIC,20.00%
CAVITE STATE UNIVERSITY (DON SEVERINO AGR'L. COLL.),16.67%
CAVITE STATE UNIVERSITY-CARMONA,0.00%
CAVITE STATE UNIVERSITY-CAVITE CITY,100.00%
CAVITE STATE UNIVERSITY-TRECE MARTIRES CAMPUS,0.00%
CAVITE WEST POINT COLLEGE,0.00%
CBD INSTITUTE OF LEARNING,0.00%
CEBU EASTERN COLLEGE,13.33%
CEBU INSTITUTE OF TECHNOLOGY,44.44%
CEBU MARY IMMACULATE COLLEGE,100.00%
CEBU NORMAL UNIVERSITY (CEBU STATE COLLEGE),44.27%
CEBU ROOSEVELT MEMORIAL COLLEGES,8.62%
CEBU STATE COLLEGE OF SCIENCE & TECHNOLOGY SYSTEM(for.CSAT),26.83%
CEBU STATE COLLEGE OF SCIENCE & TECHNOLOGY-LAHUG,50.00%
CEBU STATE COLLEGE OF SCIENCE & TECHNOLOGY-OSMENA,0.00%
CEBU TECHNICAL SCHOOL,0.00%
CEBU TECHNOLOGICAL UNIVERSITY- ARGAO (for.CSCST),52.63%
CEBU TECHNOLOGICAL UNIVERSITY- BARILI (for.CSCST),0.00%
CEBU TECHNOLOGICAL UNIVERSITY- CARMEN (for.CSCST),31.25%
CEBU TECHNOLOGICAL UNIVERSITY- DAANBATAYAN (for.CSCST),23.40%
CEBU TECHNOLOGICAL UNIVERSITY- DANAO (for.CSCST),58.33%
CEBU TECHNOLOGICAL UNIVERSITY- MAIN (for.CSCST),27.59%
CEBU TECHNOLOGICAL UNIVERSITY- MOALBOAL (for.CSCST),19.74%
CEBU TECHNOLOGICAL UNIVERSITY- SAN FRANCISCO (for.CSCST),17.65%
CEBU TECHNOLOGICAL UNIVERSITY- TUBURAN (for.CSCST),25.00%
CENTRAL BICOL STATE UNIV. OF AGRICULTURE-(for.CSSAC)-PILI,34.62%
CENTRAL BICOL STATE UNIV. OF AGRICULTURE-(for.CSSAC)-SIPOCOT,21.62%
CENTRAL COLLEGES OF THE PHILIPPINES,0.00%
CENTRAL ILOCANDIA COLLEGE OF SCIENCE & TECHNOLOGY,100.00%
CENTRAL INSTITUTE OF TECHNOLOGY- PANIQUI,13.95%
CENTRAL LUZON DOCTOR'S HOSPITAL EDUCATIONAL INSTITUTION,0.00%
CENTRAL LUZON STATE UNIVERSITY,47.06%
CENTRAL MINDANAO ACADEMY OF ARTS FOUNDATION,0.00%
CENTRAL MINDANAO COLLEGES,3.95%
CENTRAL MINDANAO UNIVERSITY,56.41%
CENTRAL NEGROS COLLEGE,7.34%
CENTRAL PHILIPPINE ADVENTIST COLLEGE,40.00%
CENTRAL PHILIPPINE UNIVERSITY,31.25%
CENTRAL SULU COLLEGE,0.00%
CENTRAL VISAYAS STATE C.A.F.T.- BAYAWAN,0.00%
CENTRO ESCOLAR UNIVERSITY- MALOLOS,16.67%
CENTRO ESCOLAR UNIVERSITY-MANILA,37.50%
CHILD JESUS COLLEGES,22.22%
CHILDREN OF MARY IMMACULATE COLLEGE,0.00%
CHRIST THE KING COLLEGE OF MARANDING,17.65%
CHRIST THE KING COLLEGE-GINGOOG CITY,50.00%
CHRIST THE KING OF CALBAYOG,9.76%
CHRISTIAN COLLEGE OF TANAUAN,23.08%
CITY OF MALABON UNIVERSITY (for.MALABON COM. COLL.),20.48%
CLARENDON COLLEGE,33.33%
CLARET COLLEGE OF ISABELA,0.90%
COLEGIO DE DAGUPAN (for.COMPUTRONIX COLL),0.00%
COLEGIO DE KIDAPAWAN(for N.COTABATO IT),8.33%
COLEGIO DE LA PURISIMA CONCEPCION,5.88%
COLEGIO DE LAS NAVAS,40.00%
COLEGIO DE LOS BANOS,26.67%
COLEGIO DE SAN AGUSTIN-BACOLOD CITY,17.65%
COLEGIO DE SAN ANTONIO,0.00%
COLEGIO DE SAN ANTONIO DE PADUA,20.00%
COLEGIO DE SAN FRANCISCO JAVIER,20.00%
COLEGIO DE SAN GABRIEL ARCANGEL,26.32%
COLEGIO DE SAN JOSE,0.00%
COLEGIO DE SAN JUAN DE LETRAN- CALAMBA,0.00%
"COLEGIO DE SAN JUAN, INC.",25.00%
"COLEGIO DE SAN LORENZO RUIZ DE MANILA, INC.",8.33%
COLEGIO DE SAN PASCUAL BAYLON,33.33%
COLEGIO DE SAN SEBASTIAN-MINDORO,10.00%
COLEGIO DE STA. CATALINA DE ALEJANDRIA,0.00%
COLEGIO DE STA. RITA,15.00%
COLEGIO DE STO. NIÑO DE CABUYAO,0.00%
COLEGIO DE STO. NIÑO DE JASAAN,10.00%
COLEGIO DEL SAGRADO CORAZON DE JESUS,12.50%
COLEGIO DELA MILAGROSA,0.00%
COLEGIO NG LUNGSOD NG BATANGAS- BATANGAS CITY,38.10%
COLEGIO SAN JOSE DE ALAMINOS,14.29%
COLLEGE OF MAASIN,0.00%
COLLEGE OF MARY IMMACULATE,0.00%
COLLEGE OF THE HOLY SPIRIT OF MANILA,100.00%
COLLEGE OF THE HOLY SPIRIT OF TARLAC,0.00%
COLLEGE OF THE IMMACULATE CONCEPTION-CABANATUAN,2.00%
COLUMBAN COLLEGE-OLONGAPO CITY,14.29%
COLUMBAN COLLEGE-ZAMBALES,0.00%
CONCEPCION HOLY CROSS COLLEGE,0.00%
CONCORDIA COLLEGE,0.00%
CONGRESS COLLEGE,0.00%
CONSOLATRIX COLLEGE OF TOLEDO CITY,11.11%
COR JESU COLLEGE (HOLY CROSS OF DIGOS),6.67%
CORDILLERA CAREER DEVELOPMENT COLLEGE,16.67%
CORE GATEWAY COLLEGE (for.THE COLL.OF THE REP),5.77%
COTABATO CITY STATE POLYTECHNIC COLLEGE,0.00%
COTABATO COLLEGE OF ARTS & TECHNOLOGY,0.00%
COTABATO FOUNDATION COLLEGE OF SCIENCE & TECHNOLOGY,14.12%
CRISTAL e-COLLEGE-PANGLAO CAMPUS,50.00%
DAGUPAN COLLEGES FOUNDATION (DAGUPAN C.C.S.T.),0.00%
DALUBHASAAN NG LUNGSOD NG SAN PABLO,28.57%
DALUBHASAANG EPIFANIO DELOS SANTOS,0.00%
DANIEL B. PENA MEMORIAL COLLEGE FOUNDATION,17.07%
DANIEL Z ROMUALDEZ MEMORIAL SCHOOL OF FISHERIES,100.00%
DANSALAN POLYTECHNIC COLLEGE,0.00%
DARAGA COMMUNITY COLLEGE,17.70%
DATA CENTER COLLEGE OF THE PHILIPPINES-LAOAG CITY,0.00%
DATU IBRAHIM PAGLAS MEMORIAL,0.00%
COLLEGE,
DATU MALA MUSLIM MINDANAO ISLAMIC COLLEGE FOUNDATION INC,0.00%
DAVAO CENTRAL COLLEGE,22.22%
"DAVAO DOCTORS COLLEGE, INC.",0.00%
DAVAO ORIENTAL STATE COLLEGE OF SCIENCE & TECHNOLOGY,40.00%
DAVAO WINCHESTER COLLEGES,0.00%
DE LA SALLE UNIVERSITY-DASMARIÑAS,30.77%
DE LA SALLE UNIVERSITY-LIPA,60.00%
DE LA SALLE UNIVERSITY-MANILA,100.00%
"DE LA SALLE-ARANETA UNIVERSITY,INC (GAUF)",0.00%
DE LA VIDA COLLEGE,0.00%
DE PAUL COLLEGE,25.00%
DEAF EVANGELISTIC ALLIANCE FOUNDATION SCHOOL,30.00%
DEE HWA LIONG COLLEGE FOUNDATION,100.00%
DEL SUR GOOD SHEPHERD COLLEGE,0.00%
DIAZ COLLEGE,0.00%
DIPOLOG CITY INSTITUTE OF TECHNOLOGY,0.00%
DIVINA PASTORA COLLEGE,4.88%
"DIVINE MERCY COLLEGE FOUNDATION, INC",25.00%
DIVINE WORD COLLEGE OF BANGUED,15.00%
DIVINE WORD COLLEGE OF CALAPAN,16.67%
DIVINE WORD COLLEGE OF LAOAG,19.35%
DIVINE WORD COLLEGE OF LEGAZPI,15.25%
DIVINE WORD COLLEGE OF SAN JOSE,5.88%
DIVINE WORD COLLEGE OF VIGAN,15.79%
DIVINE WORD UNIVERSITY-TACLOBAN,50.00%
DMMA COLLEGE OF SOUTHERN PHILIPPINES (for.DAVAO MERCHANT MA),0.00%
"DMMC INSTITUTE OF HEALTH SCIENCES, INC",50.00%
DOMINICAM COLLEGE OF TARLAC,21.05%
DOMINICAN COLLEGE OF ILOILO,0.00%
DON HONORIO VENTURA TECHNOLOGICAL STATE UNIVERSITY,23.68%
DON JOSE ECLEO MEMORIAL EDUCATIONAL FOUNDATION,0.00%
DON MARIANO MARCOS MEMORIAL STATE UNIVERSITY-AGOO,32.63%
DON MARIANO MARCOS MEMORIAL STATE UNIVERSITY-BACNOTAN,19.05%
DON MARIANO MARCOS MEMORIAL STATE UNIVERSITY-SAN FERNANDO,28.13%
"DOÑA JACINTA L. ESTEVES MEMORIAL COLLEGE-BAGANGA, DAVAO OR.",0.00%
DR. AURELIO MENDOZA MEMORIAL COLLEGES,3.77%
DR. CARLOS S. LANTING COLLEGE-Q. C.,6.67%
DR. EMILIO B. ESPINOSA SR. MEMORIAL AGRICULTURAL COLLEGE,10.71%
DR. GLORIA D. LACSON COLLEGES,0.00%
DR. NICANOR REYES MEMORIAL COLLEGES,0.00%
DR. P. OCAMPO COLLEGES,0.00%
DR. YANGA'S FRANCISCO BALAGTAS COLLEGE,13.33%
DUMAGUETE CATHEDRAL COLLEGE,0.00%
E. L. JOSON MEMORIAL COLLEGE,42.11%
"EAST COAST COLLEGE, INC",20.00%
EAST NEGROS INSTITUTE,0.00%
EASTER COLLEGE INC,20.00%
EASTERN LAGUNA COLLEGES,10.00%
EASTERN LUZON COLLEGES-LA TRINIDAD,100.00%
EASTERN MINDORO COLLEGE,9.52%
EASTERN MINDORO INSTITUTE OF TECHNOLOGY & SCIENCES,0.00%
EASTERN QUEZON COLLEGE,8.00%
EASTERN SAMAR STATE COLLEGE- BORONGAN,16.97%
EASTERN SAMAR STATE COLLEGE-CAN- AVID CAMPUS,4.65%
EASTERN SAMAR STATE COLLEGE- GUIUAN CAMPUS,14.29%
EASTERN SAMAR STATE COLLEGE- SALCEDO CAMPUS,29.82%
EASTERN VISAYAS CENTRAL COLLEGE,0.00%
EASTERN VISAYAS STATE UNIVERSITY (for.LIT)TACLOBAN,18.92%
ECUMENICAL CHRISTIAN COLLEGE,44.44%
ECUMENICAL THEOLOGICAL SEMINARY,0.00%
EDENTON MISSION COLLEGE,5.13%
EDNOR COLLEGE OF TECHNOLOGY,12.50%
EMILIO AGUINALDO COLLEGE- DASMARINAS,100.00%
EMILIO AGUINALDO COLLEGE-MANILA,0.00%
EULOGIO R. DIZON COLLEGE OF NUEVA ECIJA (CORREGIDOR COLL),1.92%
F. L. VARGAS COLLEGE-ABULUG,0.00%
FAR EASTERN UNIVERSITY-MANILA,22.22%
FATHER SATURNINO URIOS UNIVERSITY (URIOS COLL),10.34%
FATIMA COLLEGE OF CAMIGUIN,13.64%
FELIPE R. VERALLO MEMORIAL FOUNDATION,16.67%
FELIX O. ALFELOR SR. FOUNDATION COLLEGE,7.41%
FELLOWSHIP BAPTIST COLLEGE,25.00%
FERNANDEZ COLLEGE OF ARTS & TECHNOLOGY,50.00%
FILAMER CHRISTIAN COLLEGE,11.11%
FIRST ASIA INSTITUTE OF TECHNOLOGY & HUMANITIES,36.36%
FIRST CITY PROVIDENTIAL COLLEGE (for.FRANCISCO H.C.),0.00%
FLORENCIO L. VARGAS COLLEGE- TUGUEGARAO,0.00%
FOUNDATION UNIVERSITY,15.00%
FRANCISCAN COLLEGE OF THE IMMACULATE CONCEPTION-ALLEN,0.00%
FRANCISCAN COLLEGE OF THE IMMACULATE CONCEPTION-BAYBAY,25.00%
FRANCISCO HOMES COLLEGE,100.00%
FULLBRIGHT COLLEGE,50.00%
FUNDAMENTAL BAPTIST COLLEGE FOR ASIANS,37.50%
"GANI L. ABPI COLLEGES, INC.",15.38%
GENARO GONI MEMORIAL COLLEGE,0.00%
GENERAL DE JESUS COLLEGE,27.66%
GINGOOG INSTITUTE,14.29%
GLAN SCHOOL OF ARTS & TRADE,0.00%
GOLDEN GATE COLLEGES,6.67%
GOLDEN HERITAGE POLYTECHNIC COLLEGE (for.NMPS)-CDO,0.00%
GOLDEN HERITAGE POLYTECHNIC COLLEGE-CARMEN,0.00%
GOLDEN WEST COLLEGES,0.00%
GOV. ALFONSO D. TAN MEMORIAL COLLEGE,7.46%
GOV. ANDRES PASCUAL COLLEGE,12.50%
"GOV. BADO DANGWA AGRO-INDUSTRIAL SCHOOL-KAPANGAN, BENGUET",0.00%
GREAT PLEBIAN COLLEGE,0.00%
GREENVILLE COLLEGE,0.00%
GUAGUA NATIONAL COLLEGES,9.09%
GUIHULNGAN VOCATIONAL SCHOOL,0.00%
GUIMARAS STATE COLLEGE (GUIMARAS POLY. COLL.),33.33%
H. G. BAQUIRAN COLLEGE,0.00%
HARRIS MEMORIAL COLLEGE-MANILA,50.00%
HARRIS MEMORIAL COLLEGE-TAYTAY,35.29%
HARVARDIAN COLLEGE-PAMPANGA,5.00%
HEADSTART COLLEGE OF COTABATO,0.00%
HEROES MEMORIAL COLLEGES,25.00%
"HINATUAN SOUTHERN COLLEGE
(for.USP)",9.52%
HMIJ-FOUNDATION PHILIPPINE ISLAMIC COLLEGE,3.57%
HOLY ANGEL UNIVERSITY,61.29%
HOLY CHILD COLLEGE OF BUTUAN,3.57%
HOLY CHILD JESUS COLLEGE,8.33%
HOLY CROSS COLLEGE OF CARIGARA,15.38%
HOLY CROSS COLLEGE-PAMPANGA,5.26%
HOLY CROSS COLLEGE-STA. ROSA,5.88%
HOLY CROSS OF BANSALAN JUNIOR COLLEGE,13.79%
HOLY CROSS OF DAVAO COLLEGE,32.93%
HOLY INFANT COLLEGE,10.00%
HOLY INFANT JESUS COLLEGE,0.00%
HOLY NAME COLLEGE,0.00%
HOLY NAME UNIVERSITY (for.DIVINE WORD-TAGBILARAN),36.46%
HOLY TRINITY COLLEGE OF GENERAL SANTOS CITY,22.50%
HOLY TRINITY COLLEGE OF PUERTO PRINCESA,0.00%
HOLY TRINITY COLLEGE-BATO,21.43%
HOLY TRINITY JUNIOR COLLEGE,0.00%
"ICCT COLLEGES FOUNDATION,INC(INST.OF CREATIVE
COMP TECH INC)",22.73%
IETI-COLLEGE,0.00%
IFUGAO STATE COLLEGE OF AGRICULTURE & FORESTRY-LAGAWE,100.00%
IFUGAO STATE COLLEGE OF AGRICULTURE & FORESTRY-LAMUT,22.22%
IFUGAO STATE COLLEGE OF AGRICULTURE & FORESTRY-POTIA,66.67%
"IFUGAO STATE COLLEGE OF
AGRICULTURE & FORESTRY-TINOC CAMPUS",14.29%
IGNATIAN COLLEGE,33.33%
ILIGAN CAPITOL COLLEGE,4.00%
"ILIGAN MEDICAL CENTER COLLEGE, INC.",23.08%
ILOCOS SUR POLYTECHNIC STATE COLLEGE-CERVANTES,66.67%
ILOCOS SUR POLYTECHNIC STATE COLLEGE-STA MARIA,12.50%
ILOCOS SUR POLYTECHNIC STATE COLLEGE-TAGUDIN,37.50%
ILOILO STATE COLLEGE OF FISHERIES- B.NUEVO,100.00%
ILOILO STATE COLLEGE OF FISHERIES- DINGLE,20.00%
ILOILO STATE COLLEGE OF FISHERIES- DUMANGAS,16.28%
ILOILO STATE COLLEGE OF FISHERIES- SAN ENRIQUE,29.41%
IMMACULADA CONCEPCION COLLEGES,21.43%
IMMACULADA CONCEPCION-SOLDIERS HILLS COLL.-BACOOR,0.00%
IMMACULATE CONCEPTION COLLEGE- BALAYAN,5.63%
IMMACULATE CONCEPTION COLLEGE- BOAC,16.67%
IMMACULATE HEART OF MARY COLLEGE,0.00%
IMUS INSTITUTE,23.08%
INDIANA AEROSPACE UNIVERSITY,0.00%
INFANT JESUS MONTESSORI SCHOOL,0.00%
INITAO COLLEGE,50.00%
INNOVATIVE COLLEGE OF SCIENCE & TECHNOLOGY,0.00%
INTERNATIONAL CHRISTIAN COLLEGES- (for.BAGUIO-BENGUET CC),100.00%
INTERWORLD COLLEGE OF SCIENCE & TECHNOLOGY,66.67%
INTERWORLD COLLEGES FOUNDATION- PANIQUI (ICT),4.76%
INTERWORLD COLLEGES FOUNDATION-,0.00%
TARLAC CITY (ICT),
ISABELA COLLEGES (for.ISABELA C.F),7.14%
ISABELA STATE UNIVERSITY- ANGADANAN (for.A AGRO-IND COL.),8.33%
ISABELA STATE UNIVERSITY-CABAGAN,7.84%
ISABELA STATE UNIVERSITY-CAUAYAN (for.C.POLY.COLL.),9.76%
ISABELA STATE UNIVERSITY-ECHAGUE,25.00%
ISABELA STATE UNIVERSITY-ILAGAN,6.45%
ISABELA STATE UNIVERSITY-JONES CAMPUS,0.00%
ISABELA STATE UNIVERSITY-PALANAN,0.00%
ISABELO B. CALINGASAN MEMORIAL INSTITUTE,4.55%
JAMIATU MARAWI AL-ISLAMIA FOUNDATION,0.00%
JAMIATU MUSLIM MINDANAO,0.00%
JAMIATUL PHILIPPINE AL-ISLAMIC,0.77%
JOHN BOSCO COLLEGE,50.00%
JOHN PAUL COLLEGE,7.14%
JOSE MARIA COLLEGE,0.00%
JOSE NAVARRO POLYTECHNIC COLLEGE,50.00%
JOSE P. LAUREL POLYTECHNIC COLLEGE,0.00%
JOSE RIZAL MEMORIAL STATE COLLEGE-DIPOLOG,33.33%
"JOSE RIZAL MEMORIAL STATE COLLEGE-KATIPUNAN, ZAMBOANGA DS.",0.00%
JOSE RIZAL MEMORIAL STATE COLLEGE-SIOCON,11.11%
JOSE RIZAL MEMORIAL STATE COLLEGE-TAMPILISAN,20.00%
JOSE RIZAL MEMORIAL STATE UNIVERSITY-DAPITAN,15.38%
JOSE RIZAL UNIVERSITY (for.JRC),4.17%
JOSEFINA H. CERILLES POLYTECHNIC COLLEGE,19.13%
JOSEPH H. CERILLES POLYTECHNIC COLLEGE,0.00%
KABANKALAN CATHOLIC COLLEGE,11.43%
KABASALAN NATIONAL VOCATIONAL SCHOOL,0.00%
KALINGA APAYAO STATE COLLEGE (KALINGA COMM. COLL.),16.04%
KALOS MISSION ARTS COLLEGE,0.00%
"KAPALONG COLLEGES OF ARTS, SCIENCES & TECHNOLOGY",33.33%
KATIPUNAN NATIONAL AGRICULTURAL SCHOOL-KATIPUNAN,0.00%
"KING'S COLLEGE OF ISULAN, INC.",0.00%
KOLEHIYO NG SUBIC,31.25%
KUTAWATO DARUSSALAM COLLEGE,20.00%
LA CARLOTA CITY COMMUNITY COLLEGE,16.67%
LA CONCEPCION COLLEGE-BULACAN,25.00%
LA CONSOLACION COLLEGE-BACOLOD,16.67%
CITY,
LA CONSOLACION COLLEGE-CALOOKAN,0.00%
LA CONSOLACION COLLEGE-DAET,0.00%
LA CONSOLACION COLLEGE-IRIGA CITY,16.67%
LA CONSOLACION COLLEGE-LA CARLOTA CITY,0.00%
"LA CONSOLACION COLLEGE-LILOAN, CEBU CITY",100.00%
LA CONSOLACION COLLEGE-MANILA,28.57%
LA CONSOLACION COLLEGE-TANAUAN,100.00%
LA FORTUNA COLLEGE,0.00%
LA SALLE COLLEGE-ANTIPOLO(LA SALLE SCHOOL),50.00%
LA SALLE UNIVERSITY (for.IMMA.CONCEPCION-LA SALLE),33.93%
LA UNION SCHOOL OF ARTS & TRADES,0.00%
LAGUNA CHRISTIAN COLLEGE FOR THE DEAF,0.00%
LAGUNA COLLEGE,6.45%
LAGUNA COLLEGE OF BUSINESS & ARTS,16.00%
LAGUNA NORTHWESTERN COLLEGE,0.00%
LAGUNA STATE POLYTECHNIC COLLEGE-SAN PABLO (SPCSAT),15.91%
LAGUNA STATE POLYTECHNIC COLLEGE-STA. CRUZ (LCAT),0.00%
LAGUNA STATE POLYTECHNIC UNIVERSITY-LOS BAÑOS,29.17%
LAGUNA STATE POLYTECHNIC UNIVERSITY-SINILOAN,18.60%
"LAGUNA UNIVERSITY-STA CRUZ, LAGUNA",100.00%
"LAKE LANAO COLLEGE, INC.",4.26%
LANAO DEL NORTE AGRICULTURAL COLLEGE,21.43%
LANAO EDUCATIONAL INSTITUTE,0.00%
LANAO NATIONAL COLLEGE OF ARTS & TRADES,0.00%
LANAO SCHOOL OF SCIENCE & TECHNOLOGY,0.00%
LAPAK AGRICULTURAL COLLEGE-SIASI,0.00%
LARMEN DE GUIA MEMORIAL COLLEGE,66.67%
LEGACY COLLEGE OF COMPOSTELA,30.00%
LEGASPI COLLEGE,0.00%
LEON GUINTO MEMORIAL COLLEGE,22.22%
LEWIS COLLEGE,36.36%
LEYTE COLLEGE OF ARTS & TRADES,0.00%
LEYTE COLLEGES,25.00%
LEYTE INSTITUTE OF TECHNOLOGY- BURAUEN CAMPUS,16.67%
LEYTE INSTITUTE OF TECHNOLOGY- ORMOC CAMPUS,16.00%
LEYTE NORMAL UNIVERSITY,17.22%
LEYTE STATE COLLEGE,0.00%
LEYTE STATE SCHOOL OF FISHERIES,0.00%
LEYTE STATE UNIVERSITY-ALANG- ALANG CAMPUS,5.56%
LEYTE STATE UNIVERSITY-ISABEL CAMPUS,0.00%
LEYTE STATE UNIVERSITY-TOLOSA CAMPUS,25.00%
LEYTE STATE UNIVERSITY-VILLABA CAMPUS,26.09%
LIBON COMMUNITY COLLEGE,16.25%
LICEO DE CAGAYAN UNIVERSITY,7.41%
LICEO DE DAVAO,0.00%
LICEO DE MASBATE COLLEGE,8.70%
LICEO DE SAN JACINTO,6.60%
LIGAO COMMUNITY COLLEGE,50.00%
LIMAY POLYTECHNIC COLLEGE,25.00%
LIPA CITY COLLEGES,5.36%
LIPA CITY PUBLIC COLLEGE,19.33%
LISUN INSTITUTE,0.00%
LITO LAPID COLLEGE FOUNDATION,0.00%
LOURDES COLLEGE,15.38%
LOURDES COLLEGE OF BULACAN,8.00%
LUCAN POLYTECHNIC COLLEGE,50.00%
LUNA COLLEGES,10.00%
"LUNA GOCO COLLEGES, INC (for.LUNA GOCO MCCI)",0.00%
LUZON COLLEGE OF SCIENCE & TECHNOLOGY,0.00%
LUZON NAZARENE BIBLE COLLEGE,0.00%
LYCEUM NORTHWESTERN-DAGUPAN CITY,14.29%
LYCEUM NORTHWESTERN-F.T. DUQUE COLLEGE-URDANETA,11.11%
LYCEUM OF APARRI,0.00%
LYCEUM OF CABAGAN,0.00%
LYCEUM OF CEBU- CEBU CITY,0.00%
LYCEUM OF ILIGAN FOUNDATION,0.00%
LYCEUM OF NORTHERN LUZON,14.29%
"LYCEUM OF THE PHILIPPINES UNIVERSITY-BATANGAS,INC",33.33%
LYCEUM OF THE PHILIPPINES UNIVERSITY-MANILA,0.00%
LYCEUM OF TUAO,20.00%
MABINI COLLEGE OF BATANGAS,0.00%
MABINI COLLEGE-DAET,6.67%
"MADRIDEJOS COMMUNITY COLLEGE- MADRIDEJOS, CEBU CITY",33.33%
MAGSAYSAY MEMORIAL COLLEGE OF ZAMBALES,6.52%
MAGSAYSAY MEMORIAL COLLEGE- ISULAN,0.00%
MAHARDIKA INSTITUTE OF TECHNOLOGY,0.00%
MALASIQUI AGNO VALLEY COLLEGE (for.AGNO VC),18.18%
MALLIG PLAINS COLLEGES(for.W.ISABELA PC),0.00%
"MANDAUE CITY COLLEGE- MANDAUE CITY, CEBU",50.00%
MANTO MEMORIAL FOUNDATION COLLEGE,0.00%
MANUEL L. QUEZON UNIVERSITY,11.11%
MANUEL S. ENVERGA UNIV. FOUNDATION-CANDELARIA,4.26%
MANUEL S. ENVERGA UNIV. FOUNDATION-CATANAUAN,8.33%
MANUEL S. ENVERGA UNIV. FOUNDATION-LUCENA CITY,11.82%
MANUEL S. ENVERGA UNIV. FOUNDATION-SAN ANTONIO,50.00%
MAPANDI MEMORIAL COLLEGE,0.00%
MARAWI CAPITOL FOUNDATION COLLEGE,0.00%
MARAWI ISLAMIC COLLEGE,0.00%
MARCELINO FULE MEMORIAL ACADEMY,5.56%
MARCELINO R. VELOSO NATIONAL POLYTECHNIC COLLEGE,0.00%
MARIAN COLLEGE,5.66%
MARIANO MARCOS STATE UNIVERSITY- BATAC,50.00%
MARIANO MARCOS STATE UNIVERSITY- LAOAG-COLL. OF EDUCATION,55.93%
MARINDUQUE INSTITUTE OF SCIENCE & TECHNOLOGY-BOAC,0.00%
MARINDUQUE MIDWEST COLLEGE,15.00%
MARINDUQUE STATE COLLEGE-STA. CRUZ,7.64%
MARYHILL COLLEGE,0.00%
MASBATE COLLEGES,4.97%
MATER DEI COLLEGE-BOHOL,35.29%
MATER DIVINAE GRATIAE COLLEGE,10.00%
MATI COMMUNITY COLLEGE,0.00%
MATI DOCTORS COLLEGE,0.00%
MATI POLYTECHNIC INSTITUTE,5.00%
MATS COLLEGE OF TECHNOLOGY,0.00%
MATUTUM VIEW CHRISTIAN COLLEGE,0.00%
MEDINA COLLEGE-IPIL,0.00%
MEDINA COLLEGE-OZAMIS CITY,0.00%
MEDINA FOUNDATION COLLEGE,0.00%
MEGABYTE COLLEGE OF SCIENCE & TECHNOLOGY,50.00%
METRO DAGUPAN COLLEGES,33.33%
METRO MANILA COLLEGE,9.09%
METRO POLYTECHNIC COLLEGE,50.00%
MEYCAUAYAN COLLEGE,17.50%
"MINDANAO AUTONOMOUS COLLEGE, FOUNDATION INC.",0.00%
MINDANAO CAPITOL COLLEGE,3.13%
MINDANAO INSTITUTE OF TECHNOLOGY,0.00%
MINDANAO ISLAMIC COMPUTER,3.95%
COLLEGE,
MINDANAO POLYTECHNIC COLLEGE,100.00%
MINDANAO POLYTECHNIC STATE COLLEGE (DMMMPSC),32.65%
MINDANAO SANITARIUM & HOSPITAL COLLEGE OF MEDICAL ARTS FNDTN,0.00%
MINDANAO STATE UNIVERSITY-(MAIGO SAT),50.00%
MINDANAO STATE UNIVERSITY-GEN. SANTOS CITY,27.85%
MINDANAO STATE UNIVERSITY-ILIGAN INSTITUTE OF TECHNOLOGY,18.45%
MINDANAO STATE UNIVERSITY- MAGUINDANAO,12.50%
MINDANAO STATE UNIVERSITY-MARAWI CITY,26.88%
MINDANAO STATE UNIVERSITY-SDTC- JOLO,1.10%
MINDANAO STATE UNIVERSITY-TAWI- TAWI,4.78%
MINDANAO UNIVERSITY OF SCIENCE & TECHNOLOGY,12.50%
MINDORO STATE COLLEGE OF AGRICULTURE & TECHNOLOGY- BONGABONG,25.00%
"MIRIAM COLLEGE (for.MARYKNOLL COLL.FDTN,INC)",100.00%
MISAMIS ORIENTAL STATE COLLEGE OF AGRICULTURE & TECHNOLOGY,66.67%
MISAMIS UNIVERSITY-OROQUIETA UNIT,0.00%
MISAMIS UNIVERSITY-OZAMIS CITY,15.79%
MLG INSTITUTE OF LEARNING,50.00%
MN INSTITUTE OF TECHNOLOGY,0.00%
MONCAYO EXTERNAL STUDIES,0.00%
MONDRIAAN AURA COLLEGE,0.00%
MONTESSORI PROFESSIONAL COLLEGE,0.00%
MOUNT CARMEL COLLEGE OF CASIGURAN,16.67%
MOUNT CARMEL COLLEGE-AGUSAN DEL SUR,0.00%
MOUNT CARMEL COLLEGE-BALER,42.86%
MOUNT CARMEL COLLEGE-ESCALANTE,9.76%
MOUNT MORIAH COLLEGE-CAMOTES,0.00%
MOUNTAIN PROV. STATE POLYTECHNIC COLLEGE-BONTOC,9.09%
MOUNTAIN PROV. STATE POLYTECHNIC COLLEGE-TADIAN,44.44%
MOUNTAIN VIEW COLLEGE,23.81%
MYSTICAL ROSE COLLEGE OF SCIENCE & TECHNOLOGY,16.67%
NAGA COLLEGE FOUNDATION,3.28%
"NAGA VIEW ADVENTIST COLLEGE-NAGA, CAMARINES SUR",100.00%
NATIONAL CHRISTIAN LIFE COLLEGE,33.33%
NATIONAL COLLEGE OF BUSINESS & ARTS-CUBAO,0.00%
NATIONAL COLLEGE OF BUSINESS & ARTS-FAIRVIEW,33.33%
NATIONAL COLLEGE OF SCIENCE & TECHNOLOGY-SAN FERNANDO,0.00%
NATIONAL POLYTECHNIC COLLEGE OF SCIENCE & TECHNOLOGY,0.00%
NATIONAL TEACHER'S COLLEGE,24.82%
NATIONAL UNIVERSITY-MANILA,20.00%
NAVAL STATE UNIVERSITY (for.NAVAL INST) BILIRAN,33.33%
NAVAL STATE UNIVERSITY (for.NAVAL INST)-NAVAL,16.00%
NAVOTAS POLYTECHNIC COLLEGE,16.67%
NAZARENUS COLLEGE FOUNDATION,20.00%
NEGROS COLLEGE,12.70%
NEGROS ORIENTAL STATE UNIVERSITY (CVPC)-BAIS CAMPUS,7.69%
NEGROS ORIENTAL STATE UNIVERSITY (CVPC)-BAYAWAN,35.90%
NEGROS ORIENTAL STATE UNIVERSITY (CVPC)-DUMAGUETE,31.03%
NEGROS ORIENTAL STATE UNIVERSITY (CVPC)-GUIHULNGAN,12.90%
NEGROS ORIENTAL STATE UNIVERSITY- SIATON,13.11%
NEGROS STATE COLLEGE OF AGRICULTURE (OCC. AGR'L COLL),43.75%
NEW ERA UNIVERSITY,45.16%
NORTH CENTRAL MINDANAO COLLEGES (CMTI),8.79%
NORTH DAVAO COLLEGES-PANABO,16.13%
NORTHEASTERN CEBU COLLEGES,25.00%
NORTHEASTERN COLLEGE,3.70%
NORTHEASTERN MINDANAO COLL.,1.44%
NORTHERN BATAAN INSTITUTE,0.00%
"NORTHERN BUKIDNON COMM. COLL.(FRLY MANOLO FORT. COMM.
COLL)",100.00%
NORTHERN CAGAYAN COLLEGES,0.00%
NORTHERN CHRISTIAN COLLEGE,20.00%
NORTHERN COLLEGE,0.00%
NORTHERN ILOILO POLYTECHNIC STATE COLLEGE-BAROTAC VIEJO,7.69%
NORTHERN ILOILO POLYTECHNIC STATE COLLEGE-ESTANCIA,28.13%
