SCHOOL,% PASSED
TECHNOLOGICAL UNIVERSITY OF THE PHILIPPINES-CAVITE,54.29%
TECHNOLOGICAL UNIVERSITY OF THE PHILIPPINES-MANILA,36.46%
TECHNOLOGICAL UNIVERSITY OF THE PHILIPPINES-VISAYAS,75.00%
THE COLLEGES OF THE REPUBLIC,0.00%
THE FISHER VALLEY COLLEGE,0.00%
TIWI COMMUNITY COLLEGE,16.67%
TOLEDO GULLAS COLLEGE,11.43%
TOMAS CLAUDIO MEMORIAL COLLEGE,4.26%
TOMAS DEL ROSARIO ACADEMY,14.29%
TRACE COMPUTER COLLEGE,0.00%
TRINIDAD MUNICIPAL COLLEGE,0.00%
TRINITAS COLLEGE-MEYCAUAYAN,0.00%
TRINITY UNIVERSITY OF ASIA (TRINITY- QC),52.63%
TUBLAY SCHOOL OF HOME INDUSTRIES,33.33%
UNCIANO COLLEGES & MEDICAL CENTER-ANTIPOLO,50.00%
UNIDA EVANGELICAL COLLEGES,0.00%
UNION CHRISTIAN COLLEGE,24.00%
UNION COLLEGE,11.11%
UNITED SCHOOL OF SCIENCE & TECHNOLOGY,20.00%
UNIVERSIDAD DE MANILA (CITY COLL. OF MANILA),36.36%
UNIVERSIDAD DE SANTA ISABEL (COL DE STA ISABEL),18.18%
UNIVERSIDAD DE ZAMBOANGA (for.ZAEC),10.24%
UNIVERSITY OF ASIA & THE PACIFIC- PASIG,100.00%
UNIVERSITY OF BAGUIO,59.46%
UNIVERSITY OF BATANGAS,26.83%
UNIVERSITY OF BOHOL,22.37%
UNIVERSITY OF CAGAYAN VALLEY(for.CAGAYAN COLL OF TUG.),7.69%
UNIVERSITY OF CALOOCAN CITY(for.CALOOCAN CITY P.C.),31.17%
UNIVERSITY OF CEBU,34.50%
UNIVERSITY OF CEBU IN LAPULAPU & MANDAUE,47.83%
UNIVERSITY OF CEBU-BANILAD,100.00%
UNIVERSITY OF EASTERN PHILIPPINES- CATARMAN,16.82%
UNIVERSITY OF EASTERN PHILIPPINES- CATUBIG CAMPUS,9.68%
UNIVERSITY OF EASTERN PHILIPPINES- LAOANG CAMPUS,12.24%
UNIVERSITY OF ILOILO,27.78%
UNIVERSITY OF LA SALETTE-SANTIAGO,26.67%
UNIVERSITY OF LUZON (LUZON COLL.),23.81%
UNIVERSITY OF MAKATI,28.81%
UNIVERSITY OF MANILA,22.22%
UNIVERSITY OF MINDANAO-BANSALAN,11.11%
UNIVERSITY OF MINDANAO-COTABATO COLLEGE,0.00%
UNIVERSITY OF MINDANAO-DAVAO CITY,30.47%
UNIVERSITY OF MINDANAO-DIGOS COLLEGE,25.00%
UNIVERSITY OF MINDANAO-GUIANGA JUNIOR COLLEGE,100.00%
UNIVERSITY OF MINDANAO-PANABO,29.41%
UNIVERSITY OF MINDANAO-PENAPLATA,0.00%
UNIVERSITY OF MINDANAO-TAGUM,21.92%
UNIVERSITY OF NEGROS OCCIDENTAL- RECOLETOS,37.84%
UNIVERSITY OF NORTHEASTERN PHILIPPINES,8.70%
UNIVERSITY OF NORTHERN PHILIPPINES-CANDON,33.33%
UNIVERSITY OF NORTHERN PHILIPPINES-VIGAN,18.60%
UNIVERSITY OF NUEVA CACERES,28.85%
UNIVERSITY OF PANGASINAN,28.57%
UNIVERSITY OF PERPETUAL HELP RIZAL-CALAMBA CAMPUS,25.00%
UNIVERSITY OF PERPETUAL HELP RIZAL-MOLINO,20.00%
UNIVERSITY OF PERPETUAL HELP SYSTEM DALTA-LAS PINAS,29.17%
UNIVERSITY OF PERPETUAL HELP SYSTEM-GMA,50.00%
UNIVERSITY OF PERPETUAL HELP SYSTEM-LAGUNA,27.27%
UNIVERSITY OF REGINA CARMELI (for.REGINA CARMELI COLL),20.00%
UNIVERSITY OF RIZAL SYSTEM-ANGONO,12.50%
UNIVERSITY OF RIZAL SYSTEM- ANTIPOLO,39.29%
UNIVERSITY OF RIZAL SYSTEM- BINANGONAN,66.67%
UNIVERSITY OF RIZAL SYSTEM-CAINTA,25.93%
UNIVERSITY OF RIZAL SYSTEM- MORONG,20.96%
UNIVERSITY OF RIZAL SYSTEM-PILILLA,30.61%
UNIVERSITY OF RIZAL SYSTEM- RODRIGUEZ,27.91%
UNIVERSITY OF RIZAL SYSTEM-TANAY,44.44%
UNIVERSITY OF RIZAL SYSTEM-TAYTAY,100.00%
UNIVERSITY OF SAINT ANTHONY,25.00%
UNIVERSITY OF SAINT LA SALLE,57.14%
UNIVERSITY OF SAINT LOUIS- TUGUEGARAO,30.61%
UNIVERSITY OF SAN AGUSTIN,25.64%
UNIVERSITY OF SAN CARLOS,81.03%
UNIVERSITY OF SAN JOSE-RECOLETOS,37.65%
UNIVERSITY OF SANTO TOMAS,78.57%
UNIVERSITY OF SOUTHEASTERN PHILIPPINES-BAGANGA,0.00%
UNIVERSITY OF SOUTHEASTERN PHILIPPINES-DAVAO CITY,50.70%
UNIVERSITY OF SOUTHEASTERN PHILIPPINES-KAPALONG,14.29%
UNIVERSITY OF SOUTHEASTERN PHILIPPINES-MABINI,7.41%
UNIVERSITY OF SOUTHEASTERN PHILIPPINES-PANTUKAN,25.00%
UNIVERSITY OF SOUTHEASTERN PHILIPPINES-TAGUM,26.67%
UNIVERSITY OF SOUTHERN MINDANAO- KABACAN,17.99%
UNIVERSITY OF SOUTHERN MINDANAO- KIDAPAWAN,22.58%
UNIVERSITY OF SOUTHERN MINDANAO- SULTAN KUDARAT,50.00%
UNIVERSITY OF SOUTHERN PHILIPPINES,30.00%
UNIVERSITY OF SOUTHWESTERN MINDANAO,0.00%
UNIVERSITY OF THE ASSUMPTION,36.67%
UNIVERSITY OF THE CORDILLERAS (for.BAGUIO C.F.),51.26%
UNIVERSITY OF THE EAST RAMON MAGSAYSAY MEM MEDICAL CTR,0.00%
UNIVERSITY OF THE EAST-CALOOCAN,8.33%
UNIVERSITY OF THE EAST-MANILA,41.54%
UNIVERSITY OF THE IMMACULATE CONCEPTION-DAVAO,33.33%
UNIVERSITY OF THE PHILIPPINES- BAGUIO CITY,100.00%
UNIVERSITY OF THE PHILIPPINES- DILIMAN,97.18%
UNIVERSITY OF THE PHILIPPINES-LOS BA헲S,96.55%
UNIVERSITY OF THE PHILIPPINES- MABINI CAMPUS,0.00%
UNIVERSITY OF THE PHILIPPINES- MANILA,100.00%
UNIVERSITY OF THE PHILIPPINES- VISAYAS-CEBU CITY,60.00%
UNIVERSITY OF THE PHILIPPINES- VISAYAS-ILOILO CITY,100.00%
UNIVERSITY OF THE PHILIPPINES- VISAYAS-TACLOBAN CITY,100.00%
UNIVERSITY OF THE VISAYAS-CEBU CITY,14.97%
UNIVERSITY OF THE VISAYAS-DANAO CITY,16.67%
UNIVERSITY OF THE VISAYAS-MANDAUE CITY,21.43%
"UPI AGRICULTURAL SCHOOL-UPI, MAGUINDANAO",33.33%
URDANETA CITY UNIVERSITY (CCU),28.57%
VALENCIA COLLEGES,33.33%
VALENZUELA CITY POLYTECHNIC COLLEGE,33.33%
VELEZ COLLEGE,100.00%
VERITAS COLLEGE OF IROSIN,36.36%
VICTORINO SALCEDO POLYTECHNIC COLLEGE,0.00%
VILLAFLORES COLLEGE,5.56%
VIRGEN DELOS REMEDIOS COLLEGE- OLONGAPO CITY,0.00%
VIRGEN MILAGROSA UNIVERSITY FOUNDATION,33.33%
VISAYAN DATACOMPUTER CENTER- BACOLOD CITY,0.00%
VISAYAN NAZARENE BIBLE COLLEGE,50.00%
"VISAYAS STATE UNIVERSITY (for.VISCA,LSU.)-BAYBAY",60.71%
WESLEYAN UNIVERSITY-PHILIPPINES- CABANATUAN CITY,10.20%
WESLEYAN UNIVERSITY-PHILIPPINES-,0.00%
WEST BAY COLLEGE,100.00%
WEST NEGROS COLLEGE,25.00%
WEST VISAYAS STATE UNIVERSITY- CALINOG,15.63%
"WEST VISAYAS STATE UNIVERSITY- HIMAMAYLAN, NEGROS OCCIDENTAL",61.54%
WEST VISAYAS STATE UNIVERSITY- JANIUAY,28.57%
WEST VISAYAS STATE UNIVERSITY-LA PAZ,48.65%
WEST VISAYAS STATE UNIVERSITY- LAMBUNAO,16.67%
WEST VISAYAS STATE UNIVERSITY- POTOTAN,15.63%
WESTERN COLLEGES-CAVITE,0.00%
WESTERN INSTITUTE OF TECHNOLOGY,13.33%
WESTERN LEYTE COLLEGE-ORMOC,0.00%
WESTERN LUZON AGRICULTURAL COLLEGE,0.00%
WESTERN MINDANAO COOPERATIVE COLLEGE-ZAMBOANGA CITY,0.00%
WESTERN MINDANAO STATE U-(for. ZNAC)TAMPILISAN,0.00%
WESTERN MINDANAO STATE U-ALICIA,0.00%
WESTERN MINDANAO STATE U-AURORA,0.00%
WESTERN MINDANAO STATE U-IMELDA,50.00%
WESTERN MINDANAO STATE U-IPIL,0.00%
WESTERN MINDANAO STATE U- OLUTANGA,0.00%
WESTERN MINDANAO STATE U- PAGADIAN CITY,0.00%
WESTERN MINDANAO STATE U-SIAY,0.00%
WESTERN MINDANAO STATE U- TUNGAWAN,0.00%
WESTERN MINDANAO STATE U- ZAMBOANGA CITY,22.13%
WESTERN PHILIPPINE COLLEGES,50.00%
WESTERN PHILIPPINES UNIV.(for.PALAWAN N.A.C)-ABORLAN,62.50%
WESTERN PHILIPPINES UNIVERSITY- PUERTO PRINCESA,83.33%
WESTERN VISAYAS COLLEGE OF SCIENCE & TECHNOLOGY-LA PAZ,44.19%
"WORLD CITI COLLEGES, QUEZON CITY(QUEZON CITY M.C.C)",50.00%
WORLDTECH RESOURCES FOUNDATION,0.00%
XAVIER UNIVERSITY,88.89%
ZAMBALES PROVINCIAL HOSPITAL,0.00%
ZAMBOANGA CITY STATE POLYTECHNIC COLLEGE,8.09%
ZAMBOANGA DEL NORTE AGRICULTURAL COLLEGE,0.00%
ZAMBOANGA DEL NORTE SCHOOL OF ARTS & TRADES,0.00%
ZAMBOANGA DEL SUR AGRICULTURAL COLLEGE-DUMINGAG,0.00%
ZAMBOANGA DEL SUR MARITIME INSTITUTE OF TECHNOLOGY,25.00%
ZAMBOANGA INSTITUTE OF TECHNOLOGY,0.00%
ZAMBOANGA STATE COLLEGE OF MARINE SCIENCES & TECHNOLOGY,21.05%
ZAMORA MEMORIAL COLLEGE,20.00%
ZARAGOSA COLLEGE,0.00%
