SCHOOL,% PASSED
LUCAN POLYTECHNIC COLLEGE,0.00%
LUNA COLLEGES,10.00%
LUZON NAZARENE BIBLE COLLEGE,0.00%
LUZONIAN UNIVERSITY FOUNDATION- LUCENA CITY,100.00%
LYCEUM NORTHWESTERN-DAGUPAN CITY,35.00%
LYCEUM NORTHWESTERN-F.T. DUQUE COLLEGE-URDANETA,20.00%
LYCEUM OF APARRI,31.25%
LYCEUM OF CEBU- CEBU CITY,100.00%
LYCEUM OF ILIGAN FOUNDATION,0.00%
LYCEUM OF NORTHERN LUZON,0.00%
"LYCEUM OF THE PHILIPPINES UNIVERSITY-BATANGAS,INC",10.00%
LYCEUM OF THE PHILIPPINES UNIVERSITY-MANILA,50.00%
LYCEUM OF TUAO,0.00%
M. V. GALLEGO FOUNDATION COLLEGES,0.00%
MABA COMPUTER COLLEGE,0.00%
MABINI COLLEGE-DAET,24.14%
MAGSAYSAY MEMORIAL COLLEGE OF ZAMBALES,20.00%
MAGSAYSAY MEMORIAL COLLEGE- ISULAN,0.00%
MAGUINDANAO STATE UNIVERSITY,0.00%
MAHARDIKA INSTITUTE OF TECHNOLOGY,50.00%
MAKATI COLLEGES (MAKATI POLYTECHNIC COMM. COL),0.00%
MALASIQUI AGNO VALLEY COLLEGE (for.AGNO VC),5.56%
MALLIG PLAINS COLLEGES(for.W.ISABELA PC),0.00%
"MANDAUE CITY COLLEGE- MANDAUE CITY, CEBU",0.00%
"MANILA ADVENTIST MEDICAL CENTER & SCH. OF MEDICAL ARTS, INC",100.00%
MANILA CENTRAL UNIVERSITY- CALOOCAN CITY,55.56%
MANILA CENTRAL UNIVERSITY-MANILA,0.00%
MANILA DOCTORS COLLEGE,100.00%
MANILA THEOLOGICAL COLLEGE,80.00%
MANUEL L. QUEZON UNIVERSITY,25.93%
MANUEL QUEZON COLLEGE,0.00%
MANUEL S. ENVERGA UNIV. FOUNDATION-CANDELARIA,19.05%
MANUEL S. ENVERGA UNIV. FOUNDATION-CATANAUAN,13.64%
MANUEL S. ENVERGA UNIV. FOUNDATION-LUCENA CITY,22.64%
MAPANDI MEMORIAL COLLEGE,28.57%
MAPUA INSTITUTE OF TECHNOLOGY,100.00%
MARAWI CAPITOL FOUNDATION COLLEGE,0.00%
MARAWI ISLAMIC COLLEGE,0.00%
MARCELINO FULE MEMORIAL ACADEMY,50.00%
MARCELINO R. VELOSO NATIONAL POLYTECHNIC COLLEGE,0.00%
MARIAN COLLEGE,23.08%
MARIAN COMPUTER COLLEGE,50.00%
MARIANO MARCOS STATE UNIVERSITY- BATAC,30.00%
MARIANO MARCOS STATE UNIVERSITY- LAOAG-COLL. OF EDUCATION,42.31%
MARIANO MARCOS STATE UNIVERSITY- LAOAG-COLL. OF TECHNOLOGY,15.22%
MARIANO QUINTO ALARILLA POLYTECHNIC COLLEGE,58.06%
MARIKINA INSTITUTE OF SCIENCE & TECHNOLOGY,38.68%
MARIKINA SCHOOL OF ARTS & TRADES,40.00%
MARINDUQUE INSTITUTE OF SCIENCE & TECHNOLOGY-BOAC,0.00%
MARINDUQUE STATE COLLEGE-BOAC,26.39%
MARINDUQUE STATE COLLEGE-STA.,0.00%
MARINDUQUE STATE COLLEGE- TORRIJOS,50.00%
MARINERS POLYTECHNIC COLLEGE FOUNDATION-PANGANIBAN,0.00%
MARY CHILES COLLEGE (for.GEN. HOSP. SCH. OF NRSNG. & MID.),0.00%
MARY HELP OF CHRISTIANS COLLEGE SEMINARY,50.00%
MARY JOHNSTON COLLEGE,100.00%
"MARY THE QUEEN COLLEGE, INC",33.33%
MARYHILL COLLEGE,100.00%
MASBATE COLLEGES,0.00%
MATER DEI COLLEGE-BOHOL,30.77%
MATER DIVINAE GRATIAE COLLEGE,0.00%
MATS COLLEGE OF TECHNOLOGY,33.33%
MATTER SALUTIS COLLEGE SEMINARY,0.00%
MATUTUM VIEW CHRISTIAN COLLEGE,0.00%
MAYDOLONG NATIONAL AGRICULTURAL SCHOOL,28.57%
MEDICAL COLLEGE OF NORTHERN PHILIPPINES,66.67%
MEDINA COLLEGE-OZAMIS CITY,14.29%
MEDINA FOUNDATION COLLEGE,66.67%
MEIN COLLEGE INC.-ZAMBOANGA CITY,33.33%
METRO DAGUPAN COLLEGES,25.00%
METRO MANILA COLLEGE,26.83%
METRO POLYTECHNIC COLLEGE,0.00%
METRO TAGAYTAY COLLEGE OF BUSINESS & ARTS,0.00%
MEYCAUAYAN COLLEGE,9.68%
"MINDANAO AUTONOMOUS COLLEGE, FOUNDATION INC.",0.00%
MINDANAO CAPITOL COLLEGE,5.88%
MINDANAO CHRISTIAN FOUNDATION COLLEGE & SEMINARY,0.00%
MINDANAO ELECTRONICS INSTITUTE- SCHOOL OF MIDWIFERY,0.00%
MINDANAO ISLAMIC COMPUTER COLLEGE,0.00%
MINDANAO POLYTECHNIC STATE COLLEGE (DMMMPSC),34.92%
MINDANAO REGIONAL SCHOOL OF FISHERIES,0.00%
MINDANAO SCHOOL OF BUSINESS ADMINISTRATION,0.00%
MINDANAO STATE UNIVERSITY-(MAIGO SAT),23.08%
MINDANAO STATE UNIVERSITY-BUUG,20.59%
MINDANAO STATE UNIVERSITY-GEN. SANTOS CITY,37.00%
MINDANAO STATE UNIVERSITY-ILIGAN INSTITUTE OF TECHNOLOGY,63.40%
MINDANAO STATE UNIVERSITY- MAGUINDANAO,16.47%
MINDANAO STATE UNIVERSITY-MARAWI CITY,25.68%
MINDANAO STATE UNIVERSITY-NAAWAN,53.85%
MINDANAO STATE UNIVERSITY-SDTC- JOLO,4.86%
MINDANAO STATE UNIVERSITY-TAWI- TAWI,3.85%
MINDANAO UNIVERSITY OF SCIENCE & TECHNOLOGY,0.00%
"MINDORO STATE COLLEGE OF
AGRICULTURE & TECHNOLOGY- BONGABONG",36.00%
"MINDORO STATE COLLEGE OF
AGRICULTURE & TECHNOLOGY- CALAPAN",21.13%
"MINDORO STATE COLLEGE OF
AGRICULTURE & TECHNOLOGY- VICTORIA",30.00%
"MIRIAM COLLEGE (for.MARYKNOLL COLL.FDTN,INC)",100.00%
MISAMIS INSTITUTE OF TECHNOLOGY,0.00%
MISAMIS ORIENTAL STATE COLLEGE OF AGRICULTURE & TECHNOLOGY,20.00%
MISAMIS UNIVERSITY-OROQUIETA UNIT,0.00%
MISAMIS UNIVERSITY-OZAMIS CITY,16.13%
MLG INSTITUTE OF LEARNING,100.00%
MONDRIAAN AURA COLLEGE,57.14%
MONTESSORI PROFESSIONAL COLLEGE,100.00%
MOUNT CARMEL COLLEGE-BALER,25.00%
MOUNT CARMEL COLLEGE-ESCALANTE,16.00%
MOUNTAIN PROV. STATE POLYTECHNIC COLLEGE-BONTOC,28.77%
MOUNTAIN PROV. STATE POLYTECHNIC COLLEGE-TADIAN,33.33%
MOUNTAIN VIEW COLLEGE,26.92%
MYSTICAL ROSE COLLEGE OF SCIENCE & TECHNOLOGY,33.33%
NAGA COLLEGE FOUNDATION,10.53%
NATIONAL COLLEGE OF BUSINESS & ARTS-CUBAO,50.00%
NATIONAL COLLEGE OF BUSINESS & ARTS-FAIRVIEW,66.67%
NATIONAL COLLEGE OF BUSINESS & ARTS-MANILA,0.00%
NATIONAL COLLEGE OF BUSINESS & ARTS-RIZAL,16.67%
NATIONAL COLLEGE OF SCIENCE & TECHNOLOGY-DASMARINAS,20.00%
NATIONAL COLLEGE OF SCIENCE & TECHNOLOGY-SAN FERNANDO,100.00%
NATIONAL TEACHER'S COLLEGE,29.79%
NATIONAL UNIVERSITY-BAGUIO CITY,0.00%
NATIONAL UNIVERSITY-MANILA,20.00%
NAVAL STATE UNIVERSITY (for.NAVAL INST) BILIRAN,25.00%
NAVAL STATE UNIVERSITY (for.NAVAL INST)-NAVAL,15.07%
NAVOTAS POLYTECHNIC COLLEGE,17.54%
NAZARENUS COLLEGE FOUNDATION,100.00%
NEGROS COLLEGE,0.00%
"NEGROS MARITIME COLLEGE FOUNDATION, INC.-DUMAGUETE",0.00%
NEGROS MARITIME COLLEGE FOUNDATION-SIBULAN,0.00%
NEGROS OCCIDENTAL SCHOOL OF FISHERIES,15.38%
NEGROS ORIENTAL NATIONAL AGRICULTURAL COLLEGE,0.00%
NEGROS ORIENTAL STATE UNIVERSITY (CVPC)-BAIS CAMPUS,15.48%
NEGROS ORIENTAL STATE UNIVERSITY (CVPC)-BAYAWAN,10.00%
NEGROS ORIENTAL STATE UNIVERSITY (CVPC)-DUMAGUETE,28.13%
NEGROS ORIENTAL STATE UNIVERSITY (CVPC)-GUIHULNGAN,9.84%
NEGROS ORIENTAL STATE UNIVERSITY- SIATON,14.29%
NEGROS STATE COLLEGE OF AGRICULTURE (OCC. AGR'L COLL),27.27%
NEW ERA UNIVERSITY,45.65%
NORTH CENTRAL MINDANAO COLLEGES (CMTI),9.09%
NORTH COTABATO COLLEGE OF ARTS & TRADE-KIDAPAWAN,0.00%
NORTH DAVAO COLLEGE-TAGUM FOUNDATION,66.67%
NORTH DAVAO COLLEGES-PANABO,30.77%
NORTHEASTERN CEBU COLLEGES,50.00%
NORTHEASTERN COLLEGE,13.79%
NORTHEASTERN MINDANAO COLL.,4.17%
NORTHERN BATAAN INSTITUTE,0.00%
NORTHERN BUKIDNON COMM. COLL.(FRLY MANOLO FORT. COMM. COLL),60.00%
NORTHERN CAGAYAN COLLEGES,33.33%
NORTHERN CEBU COLLEGE,10.00%
NORTHERN CHRISTIAN COLLEGE,10.00%
NORTHERN COLLEGE FOUNDATION INC- DAGUPAN CITY,0.00%
NORTHERN COTABATO COLLEGES FOUNDATION INC.,0.00%
NORTHERN ILOCANDIA COLLEGE OF SCIENCE & TECHNOLOGY(NICOSAT),0.00%
NORTHERN ILOILO POLYTECHNIC COLLEGE-SARA,0.00%
"NORTHERN ILOILO POLYTECHNIC STATE COLL-BATAD, ILOILO CITY",12.50%
"NORTHERN ILOILO POLYTECHNIC STATE COLL-CONCEPCION, ILOILO",7.14%
NORTHERN ILOILO POLYTECHNIC STATE COLLEGE-AJUY,40.00%
NORTHERN ILOILO POLYTECHNIC STATE COLLEGE-BAROTAC VIEJO,33.33%
NORTHERN ILOILO POLYTECHNIC STATE COLLEGE-ESTANCIA,24.49%
NORTHERN ILOILO POLYTECHNIC STATE COLLEGE-LEMERY,0.00%
NORTHERN LUZON ADVENTIST COLLEGE,50.00%
NORTHERN MINDANAO COLLEGE,20.00%
NORTHERN MINDANAO COLLEGE OF ARTS SCIENCE & TECHNOLOGY,0.00%
NORTHERN MINDANAO STATE INSTITUTE OF SCIENCE & TECHNOLOGY,36.67%
NORTHERN NEGROS STATE COLLEGE OF SCIENCE & TECHNOLOGY,13.43%
"NORTHERN QUEZON COOPERATIVE COLLEGE, INC.",17.65%
NORTHERN SAMAR ACADEMY,0.00%
NORTHERN ZAMBALES COLLEGE (for.VDRC)-MASINLOC,0.00%
NORTHWEST SAMAR STATE UNIVERSITY (FOR.TIBURCIO TANCINCO),29.33%
NORTHWESTERN AGUSAN COLLEGE,0.00%
NORTHWESTERN MINDANAO STATE COLLEGE OF SCIENCE & TECHNOLOGY,16.67%
NORTHWESTERN UNIVERSITY,0.00%
NORTHWESTERN VISAYAN COLLEGES,26.09%
NOTRE DAME OF DADIANGAS COLLEGE,25.00%
NOTRE DAME OF JOLO COLLEGE,8.33%
NOTRE DAME OF KIDAPAWAN COLLEGE,18.60%
NOTRE DAME OF MARBEL UNIVERSITY,25.97%
NOTRE DAME OF MIDSAYAP COLLEGE,19.57%
NOTRE DAME OF SALAMAN COLLEGE,0.00%
NOTRE DAME OF SIENA COLLEGE,50.00%
NOTRE DAME OF TACURONG COLLEGE,20.00%
NOTRE DAME RVM COLLEGE OF COTABATO-COTABATO CITY,0.00%
NOTRE DAME UNIVERSITY,15.73%
NUEVA ECIJA COLLEGE,0.00%
NUEVA ECIJA UNIVERSITY OF SCIENCE & TECHNOLOGY-CABANATUAN),11.69%
NUEVA ECIJA UNIVERSITY OF SCIENCE & TECHNOLOGY-GABALDON),10.20%
NUEVA ECIJA UNIVERSITY OF SCIENCE & TECHNOLOGY-SAN ISIDRO),12.22%
NUEVA VIZCAYA STATE INSTITUTE OF TECHNOLOGY-TUAO,0.00%
NUEVA VIZCAYA STATE UNIVERSITY (NVPC)-BAMBANG,23.26%
NUEVA VIZCAYA STATE UNIVERSITY (NVSIT)-BAYOMBONG,13.89%
OCCIDENTAL MINDORO COMMUNITY COLLEGE,7.14%
OCCIDENTAL MINDORO STATE COLLEGE,21.71%
OLIVAREZ COLLEGE-PARA헤QUE,50.00%
OPOL COMMUNITY COLLEGE,0.00%
OROQUIETA CITY INSTITUTE OF COTTAGE INDUSTRIES,0.00%
OSIAS EDUCATIONAL FOUNDATION,0.00%
OSMENA COLLEGE-MASBATE,14.29%
OUR LADY OF FATIMA UNIVERSITY-QC,45.45%
OUR LADY OF FATIMA UNIVERSITY- VALENZUELA,47.06%
OUR LADY OF LOURDES COLLEGE,62.50%
OUR LADY OF LOURDES COLLEGE FOUNDATION,25.00%
OUR LADY OF LOURDES TECHNOLOGICAL COLLEGE,33.33%
OUR LADY OF MANAOAG COLLEGE,50.00%
OUR LADY OF PERPETUAL SUCCOR COLLEGE,0.00%
OUR LADY OF SALVACION COLLEGE,25.00%
OUR LADY OF THE ANGELS FRANCISCAN SEMINARY,66.67%
OUR LADY OF THE PILLAR'S COLLEGE,14.29%
OUR LADY OF WISDOM ACADEMY,0.00%
OVILLA TECHNICAL COLLEGE,33.33%
PACASUM COLLEGE,0.00%
PAGADIAN COLLEGE OF CRIMINOLOGY & SCIENCES,25.00%
PAGLAUM STATE COLLEGE,0.00%
PALARIS COLLEGE,0.00%
PALAWAN COLLEGE OF ARTS & TRADES,0.00%
PALAWAN STATE UNIVERSITY-BROOKS POINT,33.33%
PALAWAN STATE UNIVERSITY-CORON,100.00%
PALAWAN STATE UNIVERSITY-CUYO,14.29%
PALAWAN STATE UNIVERSITY-P. PRINCESA,54.55%
PALAWAN STATE UNIVERSITY-QUEZON,33.33%
PALAWAN STATE UNIVERSITY-ROXAS,25.00%
PALOMPON INSTITUTE OF TECHNOLOGY-PALOMPON,22.22%
PALOMPON INSTITUTE OF TECHNOLOGY-TABANGO CAMPUS,25.00%
PAMANTASAN NG BAYAN NG SAN MATEO,50.00%
PAMANTASAN NG CABUYAO,48.65%
PAMANTASAN NG LUNGSOD NG MARIKINA,62.50%
PAMANTASAN NG LUNGSOD NG MAYNILA,60.78%
PAMANTASAN NG LUNGSOD NG MUNTINLUPA (MPC),26.39%
PAMANTASAN NG LUNGSOD NG PASAY,29.27%
PAMANTASAN NG LUNGSOD NG PASIG,50.00%
PAMANTASAN NG LUNGSOD NG VALENZUELA,49.12%
PAMBAYANG KOLEHIYO NG MAUBAN,30.00%
PAMPANGA AGRICULTURAL COLLEGE,25.86%
PAMPANGA COLLEGES,0.00%
PANAY STATE POLYTECHNIC COLLEGE- PONTEVEDRA,31.03%
PANAY STATE POLYTECHNIC COLLEGE- SIGMA,0.00%
PANAY STATE POLYTECHNIC COLLEGE- TAPAZ,0.00%
PANAY TECHNOLOGICAL COLLEGE,0.00%
PANGASINAN MEMORIAL COLLEGE,50.00%
PANGASINAN STATE UNIVERSITY- ASINGAN,18.75%
PANGASINAN STATE UNIVERSITY- BAYAMBANG,33.33%
PANGASINAN STATE UNIVERSITY- BINMALEY,10.00%
PANGASINAN STATE UNIVERSITY- INFANTA,40.00%
PANGASINAN STATE UNIVERSITY- LINGAYEN,23.45%
PANGASINAN STATE UNIVERSITY-SAN CARLOS CITY,15.38%
PANGASINAN STATE UNIVERSITY-STA. MARIA,9.52%
PANGASINAN STATE UNIVERSITY- URDANETA,50.00%
PANPACIFIC UNIVERSITY NORTH PHILIPPINES (PANG.CST),36.36%
"PARADIGM COLLEGES OF SCIENCE & TECH-ODIONG ROXAS, ORIENTAL",50.00%
PARANG FOUNDATION COLLEGE,0.00%
PARTIDO COLLEGE,5.41%
PARTIDO STATE UNIVERSITY-(GOA)GAO,26.13%
PARTIDO STATE UNIVERSITY-SAN JOSE(for.SN JOSE P.I),0.00%
PASIG CATHOLIC COLLEGE,60.00%
PASSI CITY COLLEGE,50.00%
PATRIA SABLE CORPUZ COLLEGE,0.00%
PATTS SCHOOL OF AERONAUTICS,66.67%
PEDRO REBADILLA MEMORIAL AGRICULTURAL COLLEGE,0.00%
PERPETUAL HELP COLLEGE OF MANILA,0.00%
PERPETUAL HELP COLLEGE OF PANGASINAN,33.33%
"PHILIPPINE ADVENT COLLEGE, INC.",20.00%
PHILIPPINE AIR FORCE COLLEGE OF AERONAUTICS-PAMPANGA,25.00%
PHILIPPINE BAPTIST THEOLOGICAL COLLEGE,100.00%
"PHILIPPINE CAMBRIDGE SCH.OF LAW,ARTS,SCIENCES,BUS ECO & TECH",0.00%
PHILIPPINE CHRISTIAN ACADEMY- DASMARINAS,0.00%
PHILIPPINE CHRISTIAN UNIVERSITY- DASMARINAS,22.22%
PHILIPPINE CHRISTIAN UNIVERSITY- MANILA,29.41%
PHILIPPINE COLLEGE FOUNDATION,0.00%
PHILIPPINE COLLEGE OF CRIMINOLOGY,100.00%
PHILIPPINE COLLEGE OF HEALTH & SCIENCES,0.00%
PHILIPPINE COLLEGE OF SCIENCE & TECHNOLOGY-CALASIAO,20.00%
PHILIPPINE COMPUTER COLLEGE,0.00%
PHILIPPINE DOMINICAN CENTER OF INSTITUTIONAL STUDIES,50.00%
PHILIPPINE HARVARDIAN COLLEGE,0.00%
PHILIPPINE MARITIME INSTITUTE-BOHOL,0.00%
PHILIPPINE MARITIME INSTITUTE- MANILA,22.22%
PHILIPPINE MARITIME INSTITUTE- QUEZON CITY,0.00%
PHILIPPINE MISSIONARY INSTITUTE,27.27%
PHILIPPINE NORMAL UNIVERSITY- AGUSAN,52.00%
PHILIPPINE NORMAL UNIVERSITY-CADIZ CITY,45.16%
PHILIPPINE NORMAL UNIVERSITY- ISABELA,44.26%
PHILIPPINE NORMAL UNIVERSITY-LOPEZ,13.33%
PHILIPPINE NORMAL UNIVERSITY- MANILA,72.14%
PHILIPPINE SCHOOL OF BUSINESS ADMINISTRATION-MANILA,50.00%
PHILIPPINE SCHOOL OF BUSINESS ADMINISTRATION-QUEZON CITY,61.54%
PHILIPPINE STATE COLLEGE OF AERONAUTICS-LAPU-LAPU CITY,14.29%
PHILIPPINE STATE COLLEGE OF AERONAUTICS-PASAY,38.46%
PHILIPPINE STATE COLLEGE OF AERONAUTICS-SN.FERNANDO AIR BASE,0.00%
PHILIPPINE UNION COLLEGE-NAGA CITY,36.36%
PHILIPPINE WOMEN'S COLLEGE OF DAVAO,0.00%
PHILIPPINE WOMEN'S UNIVERSITY- MANILA,68.75%
PHILIPPINE WOMEN'S UNIVERSITY- QUEZON CITY,33.33%
PILGRIM CHRISTIAN COLLEGE,50.00%
PILI CAPITAL EDUCATIONAL CENTER,33.33%
PINES CITY COLLEGE (PCEC),60.00%
PIUS XII INSTITUTE,0.00%
"PLT COLLEGE, INC",0.00%
POLANGUI COMMUNITY COLLEGE,14.00%
POLYTECHNIC INSTITUTE OF TABACO,100.00%
POLYTECHNIC STATE COLLEGE OF ANTIQUE,39.53%
POLYTECHNIC STATE COLLEGE OF ANTIQUE-TARIO LIM RUIZ CAMPUS,25.00%
POLYTECHNIC UNIVERSITY OF THE PHILIPPINES-BATAAN,26.19%
POLYTECHNIC UNIVERSITY OF THE PHILIPPINES-COMMONWEALTH,45.00%
POLYTECHNIC UNIVERSITY OF THE PHILIPPINES-LOPEZ,13.73%
POLYTECHNIC UNIVERSITY OF THE PHILIPPINES-MAIN-STA. MESA,49.08%
POLYTECHNIC UNIVERSITY OF THE PHILIPPINES-MARAGONDON,30.16%
POLYTECHNIC UNIVERSITY OF THE PHILIPPINES-MULANAY,16.28%
POLYTECHNIC UNIVERSITY OF THE PHILIPPINES-RAGAY,26.79%
POLYTECHNIC UNIVERSITY OF THE PHILIPPINES-SAN PEDRO,37.50%
"POLYTECHNIC UNIVERSITY OF THE PHILIPPINES-STA MARIA, BULACAN",50.00%
POLYTECHNIC UNIVERSITY OF THE PHILIPPINES-STA. ROSA,69.23%
POLYTECHNIC UNIVERSITY OF THE,47.22%
POLYTECHNIC UNIVERSITY OF THE PHILIPPINES-TAGUIG,62.50%
POLYTECHNIC UNIVERSITY OF THE PHILIPPINES-UNISAN,11.43%
QUEEN OF APOSTLES COLLEGE SEMINARY,0.00%
QUEZON ACADEMY-BULAN,50.00%
QUEZON COLLEGES OF SOUTHERN PHILLIPINES,18.92%
QUEZONIAN EDUCATIONAL COLLEGE,10.00%
QUIRINO POLYTECHNIC COLLEGE,50.00%
QUIRINO STATE COLLEGE,33.33%
R. G. DE CASTRO COLLEGES,33.33%
RAMON MAGSAYSAY MEMORIAL COLLEGES,11.54%
RAMON MAGSAYSAY TECHNOLOGICAL UNIVERSITY-BOTOLAN CAMPUS,33.33%
RAMON MAGSAYSAY TECHNOLOGICAL UNIVERSITY-CANDELARIA,0.00%
RAMON MAGSAYSAY TECHNOLOGICAL UNIVERSITY-CASTILLEJOS,25.00%
RAMON MAGSAYSAY TECHNOLOGICAL UNIVERSITY-IBA,15.73%
RAMON MAGSAYSAY TECHNOLOGICAL UNIVERSITY-SAN MARCELINO,16.67%
RAPU-RAPU COMMUNITY COLLEGE,0.00%
REGIS MARIE COLLEGE,28.57%
REMEDIOS T. ROMUALDEZ MEDICAL FOUNDATION,0.00%
REPUBLIC CENTRAL COLLEGES,13.64%
REPUBLIC COLLEGES,11.11%
REPUBLICAN COLLEGE,0.00%
RIVERSIDE COLLEGE,16.67%
RIZAL COLLEGE OF LAGUNA,0.00%
RIZAL COLLEGE OF TAAL,25.71%
RIZAL MEMORIAL COLLEGE,0.00%
RIZAL MEMORIAL INSTITUTE,0.00%
RIZAL MEMORIAL STATE COLLEGE,25.00%
RIZAL TECHNOLOGICAL UNIVERSITY,42.68%
ROGATIONIST COLLEGE,41.18%
ROMBLON COLLEGE OF FISHERIES & FORESTRY-SAN ANDRES,0.00%
ROMBLON STATE COLLEGE-(SIBUYAN PC)-SAN FERNANDO,0.00%
ROMBLON STATE COLLEGE- CAJIDIONGAN,0.00%
ROMBLON STATE COLLEGE-CALATRAVA,0.00%
ROMBLON STATE COLLEGE-ODIONGAN,36.96%
ROMBLON STATE COLLEGE-SAN AGUSTIN,0.00%
ROMBLON STATE COLLEGE-SAWANG CAMPUS,33.33%
ROMBLON STATE COLLEGE-STA. FE,0.00%
ROMBLON STATE COLLEGE-STA. MARIA,33.33%
ROOSEVELT COLLEGE-CAINTA,16.67%
ROOSEVELT COLLEGE-MARIKINA,18.18%
ROXAS COLLEGE-ROXAS,8.70%
ROXAS MEMORIAL AGRICULTURAL & INDUSTRIAL SCHOOL-ROXAS,0.00%
ROXAS MEMORIAL COLLEGE OF ARTS & TRADE,25.00%
ROYAL CHRISTIAN COLLEGE,0.00%
RUPERTO K. KANGLEON MEMORIAL AGRO-FISHERIES TECHNICAL COLL.,0.00%
SABINI ESTATE AGRICULTURAL COLLEGE,0.00%
"SACRED HEART COLLEGE OF LUCENA CITY, INC.",46.67%
SACRED HEART SCHOOL-MISAMIS OCCIDENTAL,0.00%
SACRED HEART SEMINARY,100.00%
SAINT ANTHONY COLLEGE OF TECHNOLOGY,16.67%
SAINT ANTHONY'S COLLEGE-ANTIQUE,27.78%
SAINT ANTHONY'S COLLEGE-CAGAYAN,44.44%
SAINT ANTHONY'S COLLEGE-ROXAS CITY,100.00%
"SAINT AUGUSTINE COLLEGES FOUNDATION, INC",100.00%
SAINT BENEDICT COLLEGE-COTABATO CITY,0.00%
"SAINT BENEDICT INSTITUTE-VIGAN, ILOCOS SUR",0.00%
SAINT BERNADETTE COLLEGE OF ALABANG,75.00%
SAINT BRIDGET'S COLLEGE,50.00%
SAINT CATHERINE COLLEGE,25.00%
SAINT CATHERINE'S COLLEGE-CARCAR,38.89%
SAINT CLAIRE'S COLLEGE OF NURSING,0.00%
SAINT COLUMBAN COLLEGE-PAGADIAN CITY,13.33%
SAINT COLUMBAN'S COLLEGE- LINGAYEN,33.33%
SAINT DOMINIC COLLEGE OF BATANES,75.00%
SAINT DOMINIC SAVIO COLLEGE,0.00%
SAINT FERDINAND COLLEGE-ILAGAN,21.43%
SAINT FRANCIS COLLEGE-GUIHULNGAN,50.00%
SAINT FRANCIS EDUCATIONAL INSTITUTE,25.00%
SAINT FRANCIS OF ASSISSI COLLEGE,66.67%
SAINT FRANCIS XAVIER COLLEGE,0.00%
SAINT GABRIEL COLLEGE-KALIBO,0.00%
SAINT JAMES COLLEGE OF CALAMBA,0.00%
SAINT JOHN COLLEGE-CALAMBA,71.43%
SAINT JOHN GENERAL HOSPITAL COLLEGE-BUUG,0.00%
SAINT JOSEPH ACADEMY-CANLAON,0.00%
SAINT JOSEPH COLLEGE OF BULACAN,16.67%
SAINT JOSEPH COLLEGE-CAGAYAN,40.00%
SAINT JOSEPH COLLEGE-ZAMBOANGA DEL NORTE,0.00%
SAINT JOSEPH INSTITUTE OF TECHNOLOGY,18.75%
SAINT JOSEPH'S COLLEGE OF QUEZON CITY,0.00%
SAINT JOSEPH'S COLLEGE-MAASIN,40.00%
SAINT JOSEPH'S JUNIOR COLLEGE,0.00%
SAINT JUDE COLLEGE-MANILA,40.00%
SAINT JUDE THADDEUS INSTITUTE OF TECHNOLOGY,50.00%
"SAINT LOUIS ANNE COLLEGES OF SAN PEDRO, LAGUNA, INC",62.50%
SAINT LOUIS COLLEGE OF BULANAO,31.03%
SAINT LOUIS COLLEGE OF SAN FERNANDO,37.50%
SAINT LOUIS COLLEGE VALENZUELA,0.00%
SAINT LOUIS UNIVERSITY,69.15%
SAINT LOUISE DE MARILLAC COLLEGE OF BOGO,25.00%
SAINT LOUISE DE MARILLAC COLLEGE OF SORSOGON,16.67%
SAINT LUKES INSTITUTE,0.00%
SAINT MARTIN TECHNICAL INSTITUTE,0.00%
SAINT MARY'S COLLEGE (ST. JOSEPH'S COLL.)-BORONGAN,16.67%
SAINT MARY'S COLLEGE OF CATBALOGAN (SACRED HEART COLL.),12.50%
SAINT MARY'S COLLEGE OF MEYCAUAYAN,33.33%
SAINT MARY'S COLLEGE-BOAC,50.00%
SAINT MARY'S COLLEGE-LABASON,0.00%
SAINT MARY'S COLLEGE-TAGUM,21.74%
SAINT MARY'S UNIVERSITY,45.45%
"SAINT MICHAEL COLLEGE  OF GUAGUA, INC.",8.33%
"SAINT MICHAEL COLLEGE-HINDANG, LEYTE",0.00%
SAINT MICHAEL'S COLLEGE OF LAGUNA,30.77%
SAINT MICHAEL'S COLLEGE-ILIGAN CITY,22.22%
SAINT MICHAEL'S COLLEGE-SURIGAO DEL SUR,33.33%
SAINT PAUL BUSINESS SCHOOL OF TACLOBAN,0.00%
"SAINT PAUL COLLEGE FOUNDATION, INC (CEBU-ST PAUL COLL)",16.67%
SAINT PAUL COLLEGE OF SAN MIGUEL,14.29%
SAINT PAUL COLLEGE-BANTAY(ST.PAUL- VIGAN),50.00%
SAINT PAUL SEMINARY FOUNDATION,100.00%
SAINT PAUL UNIVERSITY-DUMAGUETE,36.36%
SAINT PAUL UNIVERSITY-ILOILO,75.00%
SAINT PAUL UNIVERSITY-MANILA,75.00%
SAINT PAUL UNIVERSITY-QUEZON CITY,50.00%
SAINT PAUL UNIVERSITY-SURIGAO,18.18%
SAINT PAUL UNIVERSITY-TUGUEGARAO,34.62%
SAINT PAUL'S BUSINESS SCHOOL-PALO,33.33%
SAINT PEDRO POVEDA COLLEGE,100.00%
SAINT PETER BAPTIST COLLEGE,50.00%
SAINT PETER COLLEGE-BALINGASAG,11.11%
"SAINT PETER'S COLLEGE OF DALIOAN, INC",0.00%
SAINT PETER'S COLLEGE OF ORMOC,45.45%
SAINT PETER'S COLLEGE OF TORIL,13.33%
SAINT PETER'S COLLEGE SEMINARY,0.00%
SAINT PETER'S COLLEGE-ILIGAN CITY,15.79%
SAINT RITA'S COLLEGE-BALINGASAG,20.00%
SAINT RITA'S COLLEGE-MANILA,50.00%
SAINT SCHOLASTICA'S COLLEGE,85.71%
SAINT THERESA COLLEGE-TANDAG,30.77%
SAINT THERESA'S COLLEGE-CEBU,100.00%
SAINT THERESE-MTC COLLEGE-ILOILO CITY,0.00%
SAINT VINCENT COLLEGE-DIPOLOG CITY,7.14%
SAINT VINCENT DE PAUL COLLEGE SEMINARY,33.33%
SAINT VINCENT DE PAUL COLLEGE- BISLIG,33.33%
SAL FOUNDATION COLLEGE,0.00%
SALAZAR INSTITUTE OF TECHNOLOGY- CEBU CITY,0.00%
SALAZAR INSTITUTE OF TECHNOLOGY- MADRIDEJOS,100.00%
"SAMAL INSTITUTE COLLEGE-BABAK, SAMAL",0.00%
SAMAR AGRICULTURAL COLLEGE,0.00%
SAMAR COLLEGE,10.71%
SAMAR REGIONAL SCHOOL OF FISHERIES,33.33%
SAMAR STATE COLLEGE OF AGRICULTURE & FORESTRY (SNAS),33.33%
SAMAR STATE UNIVERSITY (SAMAR S.P.C.),13.13%
SAN AGUSTIN INSTITUTE OF TECHNOLOGY,16.67%
SAN ANTONIO DE PADUA INSTITUTE,0.00%
SAN BEDA COLLEGE,100.00%
SAN CARLOS COLLEGE,19.23%
SAN CARLOS SEMINARY COLLEGE,66.67%
SAN CARLOS SEMINARY-MAKATI CITY,100.00%
SAN ESTANISLAO KOSTKA COLLEGE,33.33%
SAN FRANCISCO JAVIER COLLEGE,0.00%
SAN ILDEFONSO COLLEGE,33.33%
SAN ISIDRO COLLEGE,27.78%
SAN JOSE COMMUNITY COLLEGE- MALILIPOT,21.43%
"SAN JUAN DE DIOS EDUCATIONAL FOUNDATION, INC",100.00%
SAN JUAN POLYTECHNIC COLLEGE,16.67%
SAN NICOLAS COLLEGE,16.67%
SAN PABLO COLLEGES,20.69%
SAN PABLO MAJOR SEMINARY-BAGUIO CITY,85.71%
SAN PEDRO COLLEGE OF BUSINESS ADMINISTRATION,40.00%
SAN PEDRO COLLEGE-DAVAO CITY,100.00%
"SAN SEBASTIAN COLLEGE- RECOLETOS,CAVITE",33.33%
"SAN SEBASTIAN COLLEGE- RECOLETOS,MANILA",87.50%
SAN VICENTE SCHOOL OF MIDWIFERY,0.00%
SANCTA MARIA MATER ET REGINA SEMINARIUM (for.ST PIUS X SEM),0.00%
SANTA CRUZ INSTITUTE,3.45%
"SANTA CRUZ MISSION SCHOOL, INC.- LAKE SEBU, SOUTH COTABATO",0.00%
SANTA ISABEL COLLEGE,44.44%
SANTA MONICA INSTITUTE OF TECHNOLOGY,0.00%
SANTA TERESA COLLEGE,58.33%
SANTO ROSARIO SAPANG PALAY COLLEGE,14.29%
SARIFF KABUNSUAN COLLEGE,0.00%
SENATOR NINOY AQUINO COLLEGE FOUNDATION,7.69%
SERAPION C. BASALO MEMORIAL FOUNDATION COLLEGE,6.25%
SHARIFF KABUNSUAN COLLEGE,0.00%
SHEPHERDS COLLEGE,33.33%
SIARGAO ISLAND INSTITUTE OF TECHNOLOGY,0.00%
SIARGAO NATIONAL COLLEGE OF SCIENCE & TECHNOLOGY,0.00%
SIATON COMMUNITY COLLEGE,0.00%
SIBUYAN POLYTECHNIC COLLEGE- SIBUYAN,0.00%
SIENA COLLEGE OF TAYTAY,42.86%
SIENA COLLEGE-QUEZON CITY,21.43%
SIENA SCHOOL OF SAN JOSE,50.00%
SILLIMAN UNIVERSITY,61.90%
SIQUIJOR STATE COLLEGE,29.41%
SOLIS INSTITUTE OF TECHNOLOGY,0.00%
SOMASCAN FATHERS SEMINARY,100.00%
SORSOGON COLLEGE OF ARTS & TRADE,0.00%
SORSOGON COLLEGE OF CRIMINOLOGY,100.00%
SORSOGON STATE COLLEGE-BULAN CAMPUS,14.89%
SORSOGON STATE COLLEGE-CASTILLA,20.00%
SORSOGON STATE COLLEGE- MAGALLANES,0.00%
SORSOGON STATE COLLEGE- SORSOGON,29.33%
SOUTH COTABATO SCHOOL OF MIDWIFERY,0.00%
SOUTH PHILIPPINE ADVENTIST COLLEGE,15.38%
SOUTH UPI COLLEGE,0.00%
SOUTHEAST ASIAN COLLEGE (UDMC),100.00%
SOUTHEASTERN COLLEGE OF PADADA,20.00%
SOUTHEASTERN COLLEGE-PASAY,0.00%
SOUTHERN BAPTIST COLLEGE,45.45%
SOUTHERN BICOL COLLEGES,33.33%
SOUTHERN BUKIDNON FOUNDATION ACADEMY,0.00%
SOUTHERN CAPITAL COLLEGE,0.00%
SOUTHERN CHRISTIAN COLLEGE,15.38%
SOUTHERN CITY COLLEGES,12.50%
SOUTHERN DE ORO PHILIPPINE COLLEGE,33.33%
SOUTHERN ILOILO POLYTECHNIC COLLEGE,42.11%
SOUTHERN LEYTE STATE COLLEGE OF SCIENCE & TECH.-BONTOC,0.00%
SOUTHERN LEYTE STATE COLLEGE OF SCIENCE & TECH.-HINUNANGAN,25.00%
SOUTHERN LEYTE STATE COLLEGE OF SCIENCE & TECH.-SAN JUAN,19.61%
SOUTHERN LEYTE STATE UNIVERSITY (SLSCST)-SOGOD,0.00%
SOUTHERN LEYTE STATE UNIVERSITY- T.OPPUS,29.69%
SOUTHERN LUZON COLLEGE,0.00%
SOUTHERN LUZON INSTITUTE,20.00%
SOUTHERN LUZON STATE UNIVERSITY- ALABAT (SLPC),9.09%
SOUTHERN LUZON STATE UNIVERSITY- INFANTA (SLPC),7.14%
SOUTHERN LUZON STATE UNIVERSITY- LUCBAN (SLPC),30.26%
SOUTHERN LUZON STATE UNIVERSITY- TAGKAWAYAN (SLPC),23.08%
SOUTHERN MASBATE ROOSEVELT INSTITUTE,11.11%
SOUTHERN MINDANAO COLLEGES,2.40%
SOUTHERN MINDANAO INSTITUTE OF TECHNOLOGY,15.00%
SOUTHERN NEGROS COLLEGE,0.00%
"SOUTHERN PHILIPPINE ACADEMY COLLEGE, INC",100.00%
SOUTHERN PHILIPPINE COLLEGE,0.00%
"SOUTHERN PHILIPPINES BAPTIST THEO SEM-PAUAN,DAVAO CITY",0.00%
SOUTHERN PHILIPPINES INSTITUTE OF SCIENCE & TECHNOLOGY,14.29%
"SOUTHERN PHILS.AGRI,BUSS,MARINE & AQUATIC SCH.OF TECH-MALITA",17.54%
"SOUTHERN PHILS.AGRI,BUSS,MARINE & AQUATIC SCH.OF TECH-MATI",12.12%
"SOUTHERN SAMAR COLLEGE OF
AGRICULTURE SCIENCE & TECHNOLOGY",0.00%
SOUTHWESTERN AGUSAN COLLEGES,0.00%
SOUTHWESTERN MINDANAO ISLAMIC,0.00%
SOUTHWESTERN PHILIPPINES FOUNDATION COLLEGE,0.00%
SOUTHWESTERN UNIVERSITY,18.00%
"SPA COLLEGE, INC.",25.00%
"ST. ALEXIUS COLLEGE (for.DOCTORS CHSF,INC)",0.00%
ST. CAMILLUS COLLEGE OF SEMINARY,100.00%
ST. CLAIRE COLLEGE,100.00%
ST. CLARE COLLEGE OF CALOOCAN,38.89%
ST. DOMINIC COLLEGE OF ARTS AND SCIENCES,0.00%
ST. FRANCIS XAVIER SEMINARY,100.00%
ST. JOSEPH COLLEGE-CAVITE CITY,16.67%
ST. JOSEPH COLLEGE-OLONGAPO CITY,0.00%
ST. JOSEPH'S COLLEGE-BORONGAN,0.00%
"ST. JUDE COLLEGE-DASMARI헤S, CAVITE, INC.",0.00%
ST. MARY'S ANGELS COLLEGE OF PAMPANGA,0.00%
ST. PATRICK COLLEGE (for.BATAAN EDUC'L.INST.),0.00%
"ST. ROSE COLLEGE EDUCATIONAL FOUNDATION, INC",100.00%
STATE POLYTECHNIC COLLEGE OF PALAWAN,0.00%
STELLA MARIS COLLEGE-OROQUIETA CITY,14.29%
STELLA MARIS COLLEGE-QUEZON CITY,26.67%
STI COLLEGE - BACOLOD CITY,0.00%
STI COLLEGE - BAGUIO CITY,100.00%
STI COLLEGE - BALAGTAS,100.00%
STI COLLEGE - BALAYAN,0.00%
STI COLLEGE - CALOOCAN CITY,33.33%
STI COLLEGE - CUBAO,100.00%
STI COLLEGE - EDSA CROSSING,0.00%
STI COLLEGE - FAIRVIEW,0.00%
STI COLLEGE - ILOILO,0.00%
STI COLLEGE - MAKATI CITY,100.00%
STI COLLEGE - MEYCAUAYAN,100.00%
STI COLLEGE - ORMOC,100.00%
"STI COLLEGE - STA CRUZ, LAGUNA",33.33%
STI COLLEGE - ZAMBOANGA CITY,0.00%
STI e-COLLEGE SOUTHWOODS- CARMONA,50.00%
"STO TOMAS COLLEGE-DANAO CITY
,CEBU",0.00%
SULTAN KUDARAT EDUCATIONAL INSTITUTION,0.00%
SULTAN KUDARAT ISLAMIC ACADEMY,0.00%
SULTAN KUDARAT POLYTECHNIC STATE COLLEGE-ISULAN,0.00%
SULTAN KUDARAT POLYTECHNIC STATE COLLEGE-TACURONG,14.74%
SULTAN KUDARAT STATE UNIVERSITY- KALAMANSIG,0.00%
SULU STATE COLLEGE,2.44%
SUNRISE CHRISTIAN COLLEGE FOUNDATION OF THE PHILIPPINES,0.00%
SURIGAO DEL NORTE COLLEGE OF AGRICULTURE & TECHNOLOGY,18.18%
SURIGAO DEL NORTE SCHOOL OF ARTS & TRADES,0.00%
SURIGAO DEL SUR INSTITUTE OF TECHNOLOGY,33.33%
"SURIGAO DEL SUR POLYTECHNIC COLL- CAGWAIT,SURIGAO  DEL SUR",0.00%
SURIGAO DEL SUR POLYTECHNIC COLLEGE-LIANGA,10.00%
SURIGAO DEL SUR POLYTECHNIC COLLEGE-TANDAG,27.78%
SURIGAO DEL SUR POLYTECHNIC STATE COLLEGE-CANTILAN,4.55%
SURIGAO DEL SUR POLYTECHNIC STATE COLLEGE-SAN MIGUEL,0.00%
SURIGAO DEL SUR POLYTECHNIC STATE COLLEGE-TAGBINA,14.29%
SURIGAO EDUCATION CENTER,50.00%
SURIGAO NATIONAL COLLEGE OF SCHOOL & TECHNOLOGY,0.00%
SURIGAO STATE COLLEGE OF TECHNOLOGY,16.97%
SURIGAO SUR COLLEGE,0.00%
"SYSTEMS PLUS COLLEGE
FOUNDATION,INC-ANGELES CITY(SPCCF)",50.00%
TABACO COLLEGE,0.00%
TAGOLOAN COMMUNITY COLLEGE,100.00%
TALISAY CITY COLLEGE,55.26%
TANAUAN INSTITUTE,0.00%
TANCHULING COLLEGE,25.00%
TANGUB AGRO-INDUSTRIAL SCHOOL,0.00%
TARLAC COLLEGE OF AGRICULTURE,16.00%
TARLAC STATE UNIVERSITY  (TARLAC COLLEGE OF TECH.),17.21%
TAWI-TAWI REGIONAL AGRICULTURAL COLLEGE,0.00%
TAYABAS WESTERN ACADEMY,30.77%
TA헲N COLLEGE,11.11%
TECHNOLOGICAL INSTITUTE OF THE PHILIPPINES-MANILA,31.58%
TECHNOLOGICAL INSTITUTE OF THE PHILIPPINES-QUEZON CITY,52.94%
