SCHOOL,% PASSED
ABADA COLLEGE,26.19%
ABE INTERNATIONAL COLLEGE OF BUSINESS & ACCOUNTANCY-URDANETA,0.00%
ABELLANA COLLEGE OF ARTS & TRADE,0.00%
ABRA STATE INST. OF SCIENCE & TECH.(ABRA IST)-BANGUED,18.75%
ABRA STATE INST. OF SCIENCE & TECH.(ABRA IST)-LAGANGILANG,28.57%
ABRA VALLEY COLLEGE,0.00%
ABUBAKAR COMPUTER LEARNING CENTER,0.00%
ABUYOG COMMUNITY COLLEGE,70.00%
ACADEMIA DE SAN LORENZO DEMA-ALA,20.00%
ACES TAGUM COLLEGE,8.33%
ADAMSON UNIVERSITY,41.56%
ADELPHI COLLEGE,0.00%
ADIONG MEMORIAL POLYTECHNIC STATE COLLEGE,0.00%
ADVENTIST UNIVERSITY OF THE PHILIPPINES,46.15%
AEMILIANUM INSTITUTE,50.00%
AGO FOUNDATION COLLEGE,0.00%
AGO MEDICAL & EDUCATIONAL CENTER- BICOL CHRISTIAN COLL.OF MED,12.50%
AGRO-INDUSTRIAL FOUNDATION COLLEGES OF THE PHILIPPINES,40.00%
AGUSAN COLLEGES,16.67%
AGUSAN DEL SUR COLLEGE,20.00%
AGUSAN DEL SUR STATE COLLEGE OF AGRICULTURE & TECHNOLOGY,28.57%
AGUSAN INSTITUTE OF TECHNOLOGY,22.22%
AGUSAN-SURIGAO COLLEGE,0.00%
AIR LINK INTERNATIONAL AVIATION SCHOOL,0.00%
AJUY POLYTECHNIC COLLEGE,100.00%
AKLAN CATHOLIC COLLEGE-KALIBO,10.34%
AKLAN COLLEGE,37.50%
AKLAN POLYTECHNIC INSTITUTE,0.00%
AKLAN STATE UNIVERSITY(AKLAN S.C.A.)-BANGA,35.53%
AKLAN STATE UNIVERSITY-IBAJAY,34.78%
AKLAN STATE UNIVERSITY-KALIBO,14.71%
AKLAN STATE UNIVERSITY-MAKATO,30.00%
AKLAN STATE UNIVERSITY-NATIONAL COLLEGE OF FISHERIES,0.00%
AKLAN STATE UNIVERSITY-NEW WASHINGTON,28.00%
ALANGALANG AGRO INDUSTRIAL SCHOOL,33.33%
ALDERSGATE COLLEGE,40.00%
ALEJANDRO COLLEGE,50.00%
ALFELOR SR. MEMORIAL COLLEGE,15.00%
ALITAGTAG COLLEGE,33.33%
ALTAVAS COLLEGE,33.33%
AMA COMPUTER COLLEGE-BAGUIO CITY,33.33%
AMA COMPUTER COLLEGE-CALOOCAN CAMPUS,100.00%
AMA COMPUTER COLLEGE-CEBU CITY,50.00%
AMA COMPUTER COLLEGE-COTABATO CITY,0.00%
AMA COMPUTER COLLEGE-DAVAO CITY,100.00%
AMA COMPUTER COLLEGE-EAST RIZAL,100.00%
AMA COMPUTER COLLEGE-ILOILO CITY,0.00%
AMA COMPUTER COLLEGE-LAS PI헤S,100.00%
AMA COMPUTER COLLEGE-LEGAZPI CAMPUS,50.00%
AMA COMPUTER COLLEGE-MAKATI CITY,66.67%
AMA COMPUTER COLLEGE-NAGA CITY,0.00%
AMA COMPUTER COLLEGE-OLONGAPO CITY,100.00%
AMA COMPUTER COLLEGE-ZAMBOANGA CITY,0.00%
"AMA COMPUTER UNIVERSITY-PROJ. 8, QC",50.00%
ANDRES BONIFACIO COLLEGE,0.00%
ANDRES SORIANO COLLEGE,13.04%
ANGELES UNIVERSITY FOUNDATION,57.14%
ANGELICUM COLLEGE,30.77%
ANNUNCIATION COLLEGE,8.33%
ANTIQUE SCHOOL OF ARTS & TRADES,0.00%
"ANTONIO R. PACHECO COLLEGE, INC",14.29%
APAYAO STATE COLLEGE-CONNER,12.00%
APAYAO STATE COLLEGE-LUNA CAMPUS,7.69%
AQUINAS UNIVERSITY,35.71%
ARAULLO UNIVERSITY,3.77%
ARC OF THE COVENANT MONTESSORI CHAMBER OF LEARNING CENTER,16.67%
ARELLANO UNIVERSITY-MALABON,28.57%
ARELLANO UNIVERSITY-MANILA,17.65%
ARELLANO UNIVERSITY-PASAY,62.50%
ARELLANO UNIVERSITY-PASIG,33.33%
"ARRIESGADO COLLEGE FOUNDATION, INC.",100.00%
ASBURRY COLLEGE,42.86%
"ASIA COLLEGE OF ADVANCE STUDIES IN ARTS, SCIENCES & TECH.",0.00%
ASIA SCHOOL OF ARTS & SCIENCES,20.00%
ASIACAREER COLLEGE FOUNDATION,0.00%
ASIAN COLLEGE OF SCIENCE & TECHNOLOGY-DUMAGUETE,0.00%
ASIAN COLLEGE OF TECHNOLOGY,50.00%
ASIAN DEVELOPMENT FOUNDATION COLLEGE,36.36%
ASIAN INSTITUTE OF MARITIME STUDIES,0.00%
ASIAN SEMINARY OF CHRISTIAN MINISTRIES,0.00%
ASSUMPTION COLLEGE OF DAVAO,50.00%
ASSUMPTION COLLEGE OF NABUNTURAN,20.00%
ASSUMPTION COLLEGE-MAKATI,100.00%
ATENEO DE DAVAO BRANCH- COMPOSTELA,100.00%
ATENEO DE DAVAO UNIVERSITY,100.00%
ATENEO DE MANILA UNIVERSITY- MANILA,100.00%
ATENEO DE MANILA UNIVERSITY-Q.C.,100.00%
ATENEO DE NAGA,65.38%
ATENEO DE ZAMBOANGA,70.00%
AURORA PIONEERS MEMORIAL COLLEGE,0.00%
AURORA PROSPERIDAD MEMORIAL COLLEGE,100.00%
AURORA STATE COLLEGE OF TECHNOLOGY,66.67%
BAAO COMMUNITY COLLEGE,27.78%
BACOLOD CITY COLLEGE,50.00%
BAGO CITY COLLEGE,13.04%
BAGUIO ARTS THEOLOGICAL COLLEGE,66.67%
BAGUIO CENTRAL UNIVERSITY,12.00%
BALANGA COMMUNITY COLLEGE,0.00%
BALAYAN COLLEGES,0.00%
BALETE COMMUNITY COLLEGE,14.29%
BALICUATRO COLLEGE OF ARTS & TRADES,4.17%
BALITE INSTITUTE OF TECHNOLOGY,0.00%
BALIUAG UNIVERSITY (BALIUAG COLLEGES),21.43%
"BALUD MUNICIPAL COLLEGE-BALUD, MASBATE",100.00%
BANSUD INSTITUTE-ORIENTAL MINDORO,0.00%
BANTAYAN SOUTHERN INSTITUTE,0.00%
BAPTIST BIBLE SEMINARY & INSTITUTE,40.00%
BAPTIST MISSIONARY ASS. BIBLE COLLEGE,0.00%
BAPTIST THEOLOGICAL COLLEGE- BANILAD,26.67%
BAPTIST VOICE BIBLE COLLEGE,25.00%
BASILAN STATE COLLEGE,8.33%
BATAAN HEROES MEMORIAL COLLEGE,28.57%
BATAAN NATIONAL SCHOOL OF ARTS & TRADES,0.00%
BATAAN PENINSULA STATE UNIVERSITY- BALANGA (for.BATAAN P.S),19.71%
BATAAN POLYTECHNIC STATE COLLEGE-ORANI,0.00%
BATAAN STATE COLLEGE,10.00%
"BATAD POLYTECHNIC COLLEGE-BATAD, ILOILO",100.00%
BATANES POLYTECHNIC COLLEGE,33.33%
BATANGAS EASTERN ACADEMY,50.00%
BATANGAS STATE UNIVERSITY-ARASOF- NASUGBU,20.34%
BATANGAS STATE UNIVERSITY- BATANGAS CITY,25.35%
BAYAWAN COLLEGE,11.11%
"BENEDICTO COLLEGE, INC.",50.00%
BENGUET STATE UNIVERSITY-BOKOD,50.00%
BENGUET STATE UNIVERSITY-BUGUIAS- LOO,23.08%
BENGUET STATE UNIVERSITY-LA TRINIDAD,47.87%
BERNARDO COLLEGE,0.00%
BETI COLLEGE OF TECHNOLOGY,0.00%
BICOL COLLEGE,12.50%
BICOL COLLEGE OF AGRICULTURE,0.00%
BICOL INSTITUTE OF SCIENCE & TECHNOLOGY,50.00%
BICOL UNIVERISTY-DARAGA,16.67%
BICOL UNIVERSITY IND'L TECH.(BUCIT)- LEGAZPI,24.59%
BICOL UNIVERSITY-GUBAT,22.22%
BICOL UNIVERSITY-GUINOBATAN,18.52%
BICOL UNIVERSITY-LEGAZPI,38.49%
BICOL UNIVERSITY-POLANGUI,28.89%
BICOL UNIVERSITY-TABACO,27.27%
BILIRAN NATIONAL AGRICULTURAL COLLEGE,0.00%
BINALBAGAN CATHOLIC COLLEGE,10.71%
"BLANCIA CARREON COLLEGE FOUNDATION, INC.",0.00%
BLESSED TRINITY COLLEGE,28.57%
BOHOL INSTITUTE OF TECHNOLOGY- JAGNA,50.00%
BOHOL INSTITUTE OF TECHNOLOGY- TAGBILARAN CITY,23.08%
BOHOL INSTITUTE OF TECHNOLOGY- TALIBON,0.00%
BOHOL ISLAND STATE UNIVERSITY (FOR.CVSCAFT)-BILAR,50.00%
BOHOL ISLAND STATE UNIVERSITY (FOR.CVSCAFT)-CALAPE,14.29%
BOHOL ISLAND STATE UNIVERSITY (FOR.CVSCAFT)-CANDIJAY,8.70%
BOHOL ISLAND STATE UNIVERSITY (FOR.CVSCAFT)-CLARIN,40.00%
BOHOL ISLAND STATE UNIVERSITY (FOR.CVSCAFT)-TAGBILARAN,48.00%
BOHOL NORTHEASTERN COLLEGE,0.00%
BOHOL NORTHWESTERN COLLEGE,25.00%
BOHOL SCHOOL OF FISHERIES,28.57%
BROKENSHIRE COLLEGE,50.00%
BUBONG MARZOK MEMORIAL COLLEGE FOUNDATION,0.00%
BUCAS GRANDE FOUNDATION COLLEGE,0.00%
BUKIDNON STATE COLLEGE (EXTERNAL STUDIES) TANDAG,13.64%
BUKIDNON STATE COLLEGE- MALAYBALAY,20.79%
BULACAN NATIONAL AGRICULTURAL STATE COLLEGE,28.57%
BULACAN PUBLIC COLLEGE,0.00%
BULACAN STATE UNIVERSITY (for.BCAT)- MALOLOS,30.90%
BULACAN STATE UNIVERSITY-BUSTOS,27.27%
BURAUEN POLYTECHNIC COLLEGE,16.67%
CABALUM WESTERN COLLEGE,0.00%
CABARRUS CATHOLIC COLLEGE,44.44%
CAGAYAN DE ORO COLLEGE,22.22%
CAGAYAN STATE UNIVERSITY-APARRI,33.33%
CAGAYAN STATE UNIVERSITY-CARITAN,30.41%
CAGAYAN STATE UNIVERSITY-GONZAGA,50.00%
CAGAYAN STATE UNIVERSITY-LAL-LO,10.00%
CAGAYAN STATE UNIVERSITY-PIAT,34.78%
CAGAYAN STATE UNIVERSITY-SANCHEZ MIRA,36.36%
CAGAYAN STATE UNIVERSITY- TUGUEGARAO,18.33%
CAGAYAN VALLEY COLLEGES OF TUGUEGARAO,0.00%
CAINTA CATHOLIC COLLEGE,45.45%
CALABANGA COMMUNITY COLLEGE,0.00%
CALABANGA POLYTECHNIC COLLEGE,20.00%
CALAUAG CENTRAL COLLEGE,5.00%
CALAYAN EDUCATIONAL FOUNDATION INC.(for. MED.CTR.LUCENA),50.00%
CALI PARAMEDICAL COLLEGE FOUNDATION,0.00%
CALINOG AGRICULTURAL & INDUSTRIAL COLLEGE-CALINOG,0.00%
CAMARINES NORTE COLLEGE,14.29%
CAMARINES NORTE STATE COLLEGE- DAET,29.00%
CAMARINES NORTE STATE COLLEGE- LABO,10.00%
CAMARINES NORTE STATE COLLEGE- PANGANIBAN,25.00%
CAMARINES SUR INSTITUTE OF FISHERIES & MARINE SCIENCES,11.11%
CAMARINES SUR POLYTECHNIC COLLEGE-NABUA,33.33%
CAMARINES SUR POLYTECHNIC COLLEGES(BICAT)-NAGA,27.16%
CAMARINES SUR STATE AGRICULTURAL COLLEGE-PASACAO,26.67%
CAMIGUIN POLYTECHNIC STATE COLLEGE,24.32%
CAMILING COLLEGES,25.00%
CAN-AVID NATIONAL AGRICULTURAL COLLEGE,33.33%
CANOSSA COLLEGE,100.00%
CANUTO M. S. ENERIO COLLEGE OF ARTS & TRADES,0.00%
"CAP COLLEGE FOUNDATION, INC",16.67%
CAPALONGA COLLEGE,0.00%
CAPITOL UNIVERSITY (for.CAGAYAN CAPITOL COLL.),15.00%
CAPIZ STATE UNIVERSITY (CIT)(PSPC)- MAIN CAMPUS,21.57%
CAPIZ STATE UNIVERSITY (PANAY SPC)- DAYAO CAMPUS,0.00%
CAPIZ STATE UNIVERSITY (PANAY SPC)- DUMARAO,9.09%
CAPIZ STATE UNIVERSITY (PANAY SPC)- MAMBUSAO,25.93%
CAPIZ STATE UNIVERSITY-SAPI-AN,33.33%
CARAMOAN COMMUNITY COLLEGE,0.00%
CARLOS A. HILADO MEMORIAL STATE COLLEGE-ESCALANTE,50.00%
CARLOS C. HILADO MEMORIAL STATE COLLEGE-BACOLOD,25.00%
CARLOS C. HILADO MEMORIAL STATE COLLEGE-TALISAY,43.66%
CARLOS HILADO STATE COLLEGE OF FISHERIES-BINALBAGAN,24.14%
"CARTHEL SCIENCE EDUCATIONAL FOUNDATION,INC. (for.OLRA)",0.00%
CATAINGAN MUNICIPAL COLLEGE,15.00%
CATANDUANES AGRICULTURAL & INDUSTRIAL COLLEGE,20.00%
CATANDUANES COLLEGE,12.50%
CATANDUANES STATE COLLEGE- MASBATE,0.00%
CATANDUANES STATE COLLEGES- VIRAC,17.36%
CAVITE STATE UNIVERSITY (CAVITE C.A.T)-ROSARIO,20.00%
CAVITE STATE UNIVERSITY (CAVITE COLL. OF FISHERIES)-NAIC,21.62%
CAVITE STATE UNIVERSITY (DON SEVERINO AGR'L. COLL.),19.27%
CAVITE STATE UNIVERSITY-CARMONA,27.78%
CAVITE STATE UNIVERSITY-CAVITE CITY,55.56%
CAVITE WEST POINT COLLEGE,20.00%
CBD INSTITUTE OF LEARNING,0.00%
CEBU CITY MEDICAL CENTER (CC GEN HOSP),100.00%
CEBU DOCTORS UNIVERSITY,71.43%
CEBU DOCTORS UNIVERSITY-COLLEGE OF MEDICINE,0.00%
CEBU INSTITUTE OF TECHNOLOGY,50.00%
CEBU MARY IMMACULATE COLLEGE,100.00%
CEBU NORMAL UNIVERSITY (CEBU STATE COLLEGE),50.92%
CEBU ROOSEVELT MEMORIAL COLLEGES,32.35%
CEBU STATE COLLEGE OF SCIENCE & TECHNOLOGY SYSTEM(for.CSAT),37.14%
CEBU STATE COLLEGE OF SCIENCE & TECHNOLOGY-LAHUG,20.00%
CEBU STATE COLLEGE OF SCIENCE & TECHNOLOGY-OSMENA,33.33%
CEBU TECHNICAL SCHOOL,100.00%
CEBU TECHNOLOGICAL UNIVERSITY- ARGAO (for.CSCST),44.44%
CEBU TECHNOLOGICAL UNIVERSITY- BARILI (for.CSCST),16.67%
CEBU TECHNOLOGICAL UNIVERSITY- CARMEN (for.CSCST),5.88%
CEBU TECHNOLOGICAL UNIVERSITY- DAANBATAYAN (for.CSCST),9.76%
CEBU TECHNOLOGICAL UNIVERSITY- DANAO (for.CSCST),54.55%
CEBU TECHNOLOGICAL UNIVERSITY- MAIN (for.CSCST),46.34%
CEBU TECHNOLOGICAL UNIVERSITY- MOALBOAL (for.CSCST),10.00%
CEBU TECHNOLOGICAL UNIVERSITY- SAN FRANCISCO (for.CSCST),0.00%
CEBU TECHNOLOGICAL UNIVERSITY- TUBURAN (for.CSCST),40.00%
CEGUERRA INSTITUTE OF SCIENCE & TECHNOLOGY,33.33%
CENTRAL BICOL STATE UNIV. OF AGRICULTURE-(for.CSSAC)-PILI,31.87%
CENTRAL BICOL STATE UNIV. OF AGRICULTURE-(for.CSSAC)-SIPOCOT,32.00%
CENTRAL COLLEGES OF THE PHILIPPINES,20.83%
CENTRAL ILOCANDIA COLLEGE OF SCIENCE & TECHNOLOGY,0.00%
CENTRAL INSTITUTE OF TECHNOLOGY- PANIQUI,20.00%
CENTRAL LUZON DOCTOR'S HOSPITAL EDUCATIONAL INSTITUTION,50.00%
CENTRAL LUZON STATE UNIVERSITY,27.11%
CENTRAL MAGUINDANAO INSTITUTE,0.00%
CENTRAL MINDANAO COLLEGES,12.50%
CENTRAL MINDANAO UNIVERSITY,51.22%
CENTRAL NEGROS COLLEGE,12.50%
CENTRAL PHILIPPINE ADVENTIST COLLEGE,61.54%
CENTRAL PHILIPPINE UNIVERSITY,56.67%
CENTRAL VISAYAS STATE C.A.F.T.- BAYAWAN,0.00%
CENTRO ESCOLAR UNIVERSITY- MALOLOS,50.00%
CENTRO ESCOLAR UNIVERSITY-MANILA,60.61%
CHIANG KAI SHEK COLLEGE,100.00%
CHILDREN OF MARY IMMACULATE COLLEGE,0.00%
CHRIST THE KING COLLEGE OF MARANDING,100.00%
CHRIST THE KING COLLEGE-GINGOOG,28.57%
CHRIST THE KING MISSION SEMINARY,66.67%
CHRIST THE KING OF CALBAYOG,13.04%
CHRISTIAN COLLEGE OF TANAUAN,100.00%
CITY COLLEGE OF CALAMBA,60.00%
CITY COLLEGE OF TAGAYTAY,33.33%
CITY OF MALABON UNIVERSITY (for.MALABON COM. COLL.),36.11%
CLARENDON COLLEGE,40.00%
CLARET COLLEGE OF ISABELA,13.33%
COLEGIO DE DAGUPAN (for.COMPUTRONIX COLL),38.46%
COLEGIO DE KIDAPAWAN(for N.COTABATO IT),50.00%
COLEGIO DE LA IMMACULADA CONCEPCION-CEBU,50.00%
COLEGIO DE LA PURISIMA CONCEPCION,19.05%
COLEGIO DE LAS NAVAS,100.00%
COLEGIO DE LOS BANOS,50.00%
COLEGIO DE SAN AGUSTIN-BACOLOD CITY,47.37%
COLEGIO DE SAN ANTONIO,50.00%
COLEGIO DE SAN ANTONIO DE PADUA,0.00%
COLEGIO DE SAN FRANCISCO JAVIER,0.00%
COLEGIO DE SAN GABRIEL ARCANGEL,14.29%
COLEGIO DE SAN JOSE,25.00%
COLEGIO DE SAN JUAN DE LETRAN- CALAMBA,20.00%
COLEGIO DE SAN JUAN DE LETRAN- INTRAMUROS,33.33%
COLEGIO DE SAN LORENZO,100.00%
COLEGIO DE SAN PASCUAL BAYLON,50.00%
COLEGIO DE STA. CATALINA DE ALEJANDRIA,0.00%
COLEGIO DE STA. EUGENIA,0.00%
COLEGIO DE STA. RITA,10.00%
COLEGIO DE STO. NI헲 DE CABUYAO,0.00%
COLEGIO DE STO. NI헲 DE JASAAN,0.00%
COLEGIO DEL SAGRADO CORAZON DE JESUS,0.00%
COLEGIO DELA MILAGROSA,0.00%
COLEGIO SAN JOSE DE ALAMINOS,50.00%
COLLEGE OF OUR LADY OF MT. CARMEL,0.00%
COLLEGE OF SAINT LAWRENCE,0.00%
COLLEGE OF ST. JOHN-ROXAS,0.00%
COLLEGE OF TECHNOLOGICAL SCIENCES-CEBU,100.00%
COLLEGE OF THE HOLY SPIRIT OF MANILA,71.43%
COLLEGE OF THE HOLY SPIRIT OF TARLAC,20.00%
COLLEGE OF THE IMMACULATE CONCEPTION-CABANATUAN,16.67%
COLLEGE OF THE MOST HOLY TRINITY,14.29%
COLUMBAN COLLEGE-OLONGAPO CITY,26.32%
COLUMBAN COLLEGE-ZAMBALES,0.00%
COLUMBUS COLLEGE,100.00%
COMPUTER ARTS & TECHNOLOGY SCHOOL-OLD ALBAY,50.00%
COMPUTER COLLEGE OF THE VISAYAS,0.00%
COMPUTER COMMUNICATION DEVELOPMENT INSTITUTE-IRIGA,50.00%
COMPUTER COMMUNICATION DEVELOPMENT INSTITUTE-NAGA,100.00%
CONCEPCION COLLEGE OF FISHERIES,0.00%
CONCEPCION HOLY CROSS COLLEGE,12.50%
CONCEPCION POLYTECHNIC COLLEGE- CONCEPCION,30.00%
CONCORDIA COLLEGE,50.00%
CONGRESS COLLEGE,0.00%
CONSOLATRIX COLLEGE OF TOLEDO CITY,100.00%
COR JESU COLLEGE (HOLY CROSS OF DIGOS),27.03%
CORDILLERA CAREER DEVELOPMENT COLLEGE,18.75%
CORE GATEWAY COLLEGE (for.THE COLL.OF THE REP),7.14%
COTABATO CITY STATE POLYTECHNIC COLLEGE,8.67%
COTABATO COLLEGE OF ARTS & TECHNOLOGY,0.00%
COTABATO FOUNDATION COLLEGE OF SCIENCE & TECHNOLOGY,17.86%
COTABATO MARITIME ACADEMY,0.00%
CRISTAL e-COLLEGE-PANGLAO CAMPUS,66.67%
DAGUPAN COLLEGES FOUNDATION (DAGUPAN C.C.S.T.),0.00%
DAGUPAN SCHOOL OF NURSING,0.00%
DALUBHASAAN NG LUNGSOD NG SAN PABLO,38.82%
DANIEL B. PENA MEMORIAL COLLEGE FOUNDATION,7.69%
DARAGA COMMUNITY COLLEGE,36.11%
DATU IBRAHIM PAGLAS MEMORIAL COLLEGE,0.00%
DATU MALA MUSLIM MINDANAO ISLAMIC COLLEGE FOUNDATION INC,0.00%
DAVAO CENTRAL COLLEGE,42.86%
DAVAO DEL NORTE STATE COLLEGE,20.00%
"DAVAO DOCTORS COLLEGE, INC.",40.00%
DAVAO MEDICAL SCHOOL FOUNDATION,100.00%
DAVAO ORIENTAL STATE COLLEGE OF SCIENCE & TECHNOLOGY,44.44%
"DE LA SALLE JOHN BOSCO COLLEGE- BISLIG,SURIGAO CITY",0.00%
DE LA SALLE UNIVERSITY-COLLEGE OF SAINT BENILDE,100.00%
DE LA SALLE UNIVERSITY-DASMARI헤S,47.22%
DE LA SALLE UNIVERSITY-LIPA,80.00%
DE LA SALLE UNIVERSITY-MANILA,100.00%
"DE LA SALLE-ARANETA UNIVERSITY,INC (GAUF)",15.79%
DE LA VIDA COLLEGE,11.76%
DE OCAMPO MEMORIAL COLLEGE,0.00%
DE PAUL COLLEGE,0.00%
DEE HWA LIONG COLLEGE FOUNDATION,0.00%
DEL SUR GOOD SHEPHERD COLLEGE,0.00%
DIAZ COLLEGE,16.67%
DIPOLOG CITY INSTITUTE OF TECHNOLOGY,0.00%
DIPOLOG SCHOOL OF FISHERIES,0.00%
DIVINA PASTORA COLLEGE,17.65%
"DIVINE MERCY COLLEGE FOUNDATION, INC",28.57%
DIVINE WORD COLLEGE OF BANGUED,30.43%
DIVINE WORD COLLEGE OF CALAPAN,25.00%
DIVINE WORD COLLEGE OF LAOAG,30.77%
DIVINE WORD COLLEGE OF LEGAZPI,25.53%
DIVINE WORD COLLEGE OF SAN JOSE,8.70%
DIVINE WORD COLLEGE OF VIGAN,20.00%
DIVINE WORD SEMINARY,0.00%
DIVINE WORD UNIVERSITY-TACLOBAN,18.18%
DOMINICAM COLLEGE OF TARLAC,22.22%
DOMINICAN COLLEGE OF ILOILO,16.67%
DOMINICAN COLLEGE-MANILA,100.00%
DON BOSCO COLLEGE SEMINARY- LAGUNA,70.00%
DON BOSCO TECHNOLOGY CENTER- CEBU CITY,75.00%
DON HONORIO VENTURA TECHNOLOGICAL STATE UNIVERSITY,27.83%
DON JOSE ECLEO MEMORIAL EDUCATIONAL FOUNDATION,9.09%
DON JOSE SUSTIGUER MONFORT MEMORIAL NATIONAL COLLEGE,50.00%
DON MARIANO MARCOS MEMORIAL STATE UNIVERSITY-AGOO,31.08%
DON MARIANO MARCOS MEMORIAL STATE UNIVERSITY-BACNOTAN,27.27%
DON MARIANO MARCOS MEMORIAL STATE UNIVERSITY-ROSARIO,0.00%
DON MARIANO MARCOS MEMORIAL STATE UNIVERSITY-SAN FERNANDO,18.46%
DON MARIANO MARCOS MEMORIAL STATE UNIVERSITY-STO. TOMAS,0.00%
DR. AURELIO MENDOZA MEMORIAL COLLEGES,18.18%
DR. CARLOS S. LANTING COLLEGE- ALBAY,0.00%
DR. CARLOS S. LANTING COLLEGE-Q. C.,16.67%
DR. CONCEPCION A. AGUILA MEMORIAL COLLEGE,0.00%
DR. EMILIO B. ESPINOSA SR. MEMORIAL AGRICULTURAL COLLEGE,14.96%
DR. FILEMON C. AGUILAR MEMORIAL COLLEGE,0.00%
DR. GLORIA D. LACSON COLLEGES,0.00%
DR. NICANOR REYES MEMORIAL COLLEGES,100.00%
DR. P. OCAMPO COLLEGES,0.00%
DR. YANGA'S FRANCISCO BALAGTAS COLLEGE,44.44%
DUMANGAS POLYTECHNIC COLLEGE,0.00%
DYNAMIC COMPUTER CENTRUM- LEGASPI,0.00%
E. L. JOSON MEMORIAL COLLEGE,47.37%
EAST CENTRAL COLLEGE,30.00%
EAST NEGROS INSTITUTE,50.00%
EASTER COLLEGE INC,25.00%
EASTERN LAGUNA COLLEGES,9.09%
EASTERN LUZON COLLEGES-BAMBANG,0.00%
EASTERN LUZON COLLEGES-LA TRINIDAD,16.67%
EASTERN MINDORO COLLEGE,33.33%
EASTERN MINDORO INSTITUTE OF TECHNOLOGY & SCIENCES,12.50%
EASTERN PHILIPPINES COLLEGE,100.00%
EASTERN QUEZON COLLEGE,26.09%
EASTERN SAMAR INSTITUTE OF TECHNOLOGY,0.00%
EASTERN SAMAR STATE COLLEGE- BORONGAN,21.74%
EASTERN SAMAR STATE COLLEGE-CAN- AVID CAMPUS,3.45%
EASTERN SAMAR STATE COLLEGE- GUIUAN CAMPUS,12.77%
EASTERN SAMAR STATE COLLEGE- SALCEDO CAMPUS,5.88%
EASTERN VISAYAS CENTRAL COLLEGE,0.00%
EASTERN VISAYAS STATE UNIVERSITY (for.LIT)TACLOBAN,13.07%
ECUMENICAL CHRISTIAN COLLEGE,33.33%
EDENTON MISSION COLLEGE,36.36%
EDUCATIONAL SYSTEM TECHNOLOGICAL INSTITUTE,0.00%
EMILIO AGUINALDO COLLEGE- DASMARINAS,16.67%
EMILIO AGUINALDO COLLEGE-MANILA,50.00%
EULOGIO (AMANG) RODRIGUEZ INSTITUTE OF SCIENCE & TECHNOLOGY,31.87%
EULOGIO R. DIZON COLLEGE OF NUEVA ECIJA (CORREGIDOR COLL),18.18%
EVANGELICAL THEOLOGICAL COLLEGE OF THE PHILIPPINES,0.00%
F.A.M.M. COLLEGE OF ARTS & TRADE,0.00%
FAR EASTERN UNIVERSITY-MANILA,38.36%
FAR EASTERN UNIVERSITY-NICANOR REYES MEDICAL FOUNDATION,100.00%
FATHER SATURNINO URIOS UNIVERSITY (URIOS COLL),21.21%
FATIMA COLLEGE OF CAMIGUIN,0.00%
"FATIMA MEDICAL SCIENCE FOUNDATION, INC.-VALENZUELA",50.00%
FEATI UNIVERSITY,33.33%
FEBIAS COLLEGE OF BIBLE,50.00%
FELIPE ABRIGO NATIONAL MEMORIAL COLLEGE OF ARTS & TRADE,0.00%
FELIX O. ALFELOR SR. FOUNDATION COLLEGE,50.00%
FELLOWSHIP BAPTIST COLLEGE,16.67%
FERNANDEZ COLLEGE OF ARTS & TECHNOLOGY,25.00%
FEU-EAST ASIA COLLEGE,0.00%
FEU-FERN COLLEGE-QUEZON CITY,100.00%
FILAMER CHRISTIAN COLLEGE,22.58%
FIRST ASIA INSTITUTE OF TECHNOLOGY & HUMANITIES,75.00%
FIRST CITY PROVIDENTIAL COLLEGE (for.FRANCISCO H.C.),0.00%
FLORENCIO L. VARGAS COLLEGE- TUGUEGARAO,33.33%
FOUNDATION UNIVERSITY,27.27%
FRANCISCAN COLLEGE OF THE IMMACULATE CONCEPTION-BAYBAY,33.33%
FRANCISCO COLLEGE,0.00%
FRANCISCO HOMES COLLEGE,100.00%
FULLBRIGHT COLLEGE,100.00%
GALANG MEDICAL CENTER,0.00%
"GANI L. ABPI COLLEGES, INC.",0.00%
GARCIA COLLEGE OF TECHNOLOGY,18.18%
GENARO GONI MEMORIAL COLLEGE,33.33%
GENERAL ALVAREZ SCHOOL OF ARTS & TRADE,20.00%
GENERAL BAPTIST BIBLE COLLEGE,6.67%
GENERAL DE JESUS COLLEGE,0.00%
"GENSANTOS FOUNDATION, INC.",19.51%
GINGOOG CITY JUNIOR COLLEGE,50.00%
GINGOOG INSTITUTE,0.00%
GLAN SCHOOL OF ARTS & TRADE,0.00%
GOLDEN GATE COLLEGES,50.00%
GOLDEN HERITAGE POLYTECHNIC COLLEGE-CARMEN,100.00%
GORDON COLLEGE (for.OLONGAPO CITY COLL.),0.00%
GOV. ALFONSO D. TAN MEMORIAL COLLEGE,20.00%
GOV. ANDRES PASCUAL COLLEGE,0.00%
"GOV. BADO DANGWA AGRO-INDUSTRIAL SCHOOL-KAPANGAN, BENGUET",100.00%
GREAT PLEBIAN COLLEGE,9.09%
GREENVILLE COLLEGE,50.00%
GUAGUA NATIONAL COLLEGES,32.26%
GUIMARAS STATE COLLEGE (GUIMARAS POLY. COLL.),24.00%
GUZMAN INSTITUTE OF TECHNOLOGY,0.00%
H. G. BAQUIRAN COLLEGE,25.00%
HADJI BUTU SCHOOL OF ARTS & TRADES,0.00%
HARRIS MEMORIAL COLLEGE-TAYTAY,20.00%
HARVARDIAN COLLEGE-PAMPANGA,12.50%
HERCOR COLLEGE,100.00%
"HINATUAN SOUTHERN COLLEGE
(for.USP)",12.50%
HMIJ-FOUNDATION PHILIPPINE ISLAMIC COLLEGE,0.00%
HOLY ANGEL UNIVERSITY,64.52%
HOLY CHILD COLLEGE OF BUTUAN,0.00%
HOLY CHILD SCHOOL OF DAVAO,0.00%
HOLY CROSS COLLEGE OF CALINAN,0.00%
HOLY CROSS COLLEGE OF CARIGARA,50.00%
HOLY CROSS COLLEGE-PAMPANGA,0.00%
HOLY CROSS OF BANSALAN JUNIOR COLLEGE,0.00%
HOLY CROSS OF DAVAO COLLEGE,46.60%
HOLY FAMILY CENTER OF STUDIES,80.00%
HOLY INFANT COLLEGE,0.00%
HOLY INFANT JESUS COLLEGE,0.00%
HOLY NAME COLLEGE,33.33%
HOLY NAME UNIVERSITY (for.DIVINE WORD-TAGBILARAN),37.66%
HOLY ROSARY COLLEGE,22.50%
HOLY ROSARY MINOR SEMINARY-NAGA CITY,80.00%
HOLY TRINITY COLLEGE OF GENERAL SANTOS CITY,25.81%
HOLY TRINITY COLLEGE OF PUERTO PRINCESA,25.00%
HOLY TRINITY COLLEGE-ALANG-ALANG,0.00%
HOLY TRINITY COLLEGE-GINATILAN,0.00%
"ICCT COLLEGES FOUNDATION,INC(INST.OF CREATIVE COMP TECH INC)",34.48%
IETI-COLLEGE,0.00%
IFUGAO STATE COLLEGE OF AGRICULTURE & FORESTRY-LAGAWE,0.00%
IFUGAO STATE COLLEGE OF AGRICULTURE & FORESTRY-LAMUT,26.92%
IFUGAO STATE COLLEGE OF AGRICULTURE & FORESTRY-POTIA,42.86%
"IFUGAO STATE COLLEGE OF AGRICULTURE & FORESTRY-TINOC
CAMPUS",0.00%
IGNATIAN COLLEGE,0.00%
ILIGAN CAPITOL COLLEGE,11.54%
"ILIGAN MEDICAL CENTER COLLEGE, INC.",14.29%
ILOCOS SUR POLYTECHNIC STATE COLLEGE-CANDON,0.00%
ILOCOS SUR POLYTECHNIC STATE COLLEGE-CERVANTES,0.00%
ILOCOS SUR POLYTECHNIC STATE COLLEGE-NARVACAN,0.00%
ILOCOS SUR POLYTECHNIC STATE COLLEGE-SANTIAGO,14.29%
ILOCOS SUR POLYTECHNIC STATE COLLEGE-STA MARIA,9.09%
ILOCOS SUR POLYTECHNIC STATE COLLEGE-TAGUDIN,23.08%
ILOILO DOCTORS COLLEGE OF MEDICINE,0.00%
ILOILO SCHOOL OF ARTS & TRADES,100.00%
ILOILO STATE COLLEGE OF FISHERIES- B.NUEVO,22.58%
ILOILO STATE COLLEGE OF FISHERIES- DINGLE,33.33%
ILOILO STATE COLLEGE OF FISHERIES- DUMANGAS,21.43%
ILOILO STATE COLLEGE OF FISHERIES- SAGAY,0.00%
ILOILO STATE COLLEGE OF FISHERIES- SAN ENRIQUE,34.78%
IMMACULADA CONCEPCION COLLEGES,100.00%
IMMACULADA CONCEPCION-SOLDIERS HILLS COLL.-BACOOR,0.00%
IMMACULATE CONCEPCION COLLEGE SEMINARY,100.00%
IMMACULATE CONCEPTION COLLEGE- ALBAY,0.00%
IMMACULATE CONCEPTION COLLEGE- BALAYAN,16.22%
IMMACULATE CONCEPTION COLLEGE- BOAC,0.00%
IMMACULATE HEART OF MARY SEMINARY-UBAY,100.00%
IMUS BUSINESS & TECHNOLOGICAL COLL.-IMUS,33.33%
IMUS INSTITUTE,26.67%
INDIANA AEROSPACE UNIVERSITY,66.67%
INNOVATIVE COLLEGE OF SCIENCE & TECHNOLOGY,75.00%
INTERNATIONAL EVANGELICAL HOLINESS COLLEGE,0.00%
INTERNATIONAL HARVARDIAN UNIVERSITY,0.00%
INTERNATIONAL SCHOOL OF ASIA & THE PACIFIC,33.33%
INTERWORLD COLLEGES FOUNDATION- PANIQUI (ICT),50.00%
INTERWORLD COLLEGES FOUNDATION- TARLAC CITY (ICT),0.00%
ISABEL NATIONAL AGRICULTURAL & VOCATIONAL SCHOOL,0.00%
ISABELA COLLEGES (for.ISABELA C.F),8.00%
ISABELA STATE UNIVERSITY- ANGADANAN (for.A AGRO-IND COL.),0.00%
ISABELA STATE UNIVERSITY-CABAGAN,15.71%
ISABELA STATE UNIVERSITY-CAUAYAN (for.C.POLY.COLL.),21.57%
ISABELA STATE UNIVERSITY-ECHAGUE,20.29%
ISABELA STATE UNIVERSITY-ILAGAN,9.72%
ISABELA STATE UNIVERSITY-JONES CAMPUS,25.00%
ISABELA STATE UNIVERSITY-PALANAN,0.00%
ISABELA STATE UNIVERSITY-ROXAS,46.67%
ISABELA STATE UNIVERSITY-SAN,15.15%
ISABELA STATE UNIVERSITY-SAN MATEO,50.00%
ISABELO B. CALINGASAN MEMORIAL INSTITUTE,14.29%
JAMIATU MARAWI AL-ISLAMIA FOUNDATION,0.00%
JAMIATU MUSLIM MINDANAO,9.09%
JAMIATUL PHILIPPINE AL-ISLAMIC,0.00%
JE MONDEJAR COMPUTER COLLEGE,0.00%
JESUS IS LORD COLLEGES FOUNDATION,66.67%
"JESUS REIGNS CHRISTIAN COLLEGE FOUNDATION, INC",100.00%
JOHN B. LACSON COLLEGES FOUNDATION-BACOLOD CITY,0.00%
JOHN B. LACSON COLLEGES FOUNDATION-ILOILO CITY,0.00%
JOHN BOSCO COLLEGE,0.00%
JOHN PAUL COLLEGE,17.65%
JOSE MARIA COLLEGE,100.00%
JOSE P. LAUREL POLYTECHNIC COLLEGE,18.18%
JOSE RIZAL MEMORIAL STATE COLLEGE-DIPOLOG,9.68%
JOSE RIZAL MEMORIAL STATE COLLEGE-SIOCON,0.00%
JOSE RIZAL MEMORIAL STATE COLLEGE-TAMPILISAN,6.67%
JOSE RIZAL MEMORIAL STATE UNIVERSITY-DAPITAN,10.71%
JOSE RIZAL UNIVERSITY (for.JRC),25.71%
JOSEFINA H. CERILLES POLYTECHNIC COLLEGE,6.59%
JOSEPH H. CERILLES POLYTECHNIC COLLEGE,0.00%
JUDGE GUILLERMO ELEAZAR MEM'L SCHOOL OF FISHERIES,0.00%
KABANKALAN CATHOLIC COLLEGE,15.79%
KABASALAN INSTITUTE OF TECHNOLOGY,0.00%
KABASALAN NATIONAL VOCATIONAL SCHOOL,0.00%
KALINGA APAYAO STATE COLLEGE (KALINGA COMM. COLL.),19.44%
KALOS MISSION ARTS COLLEGE,50.00%
"KAPALONG COLLEGES OF ARTS, SCIENCES & TECHNOLOGY",66.67%
KATIPUNAN NATIONAL AGRICULTURAL SCHOOL-KATIPUNAN,0.00%
"KING'S COLLEGE OF ISULAN, INC.",0.00%
KING'S COLLEGE OF MARBEL,18.75%
KOLEHIYO NG SUBIC,66.67%
L. D. WOOSLEY BETHANY COLLEGES,0.00%
LA CARLOTA CITY COMMUNITY COLLEGE,44.44%
LA CONCEPCION COLLEGE-BULACAN,0.00%
LA CONSOLACION COLLEGE-BACOLOD CITY,30.77%
LA CONSOLACION COLLEGE-BINAN,0.00%
LA CONSOLACION COLLEGE-DAET,50.00%
LA CONSOLACION COLLEGE-IRIGA CITY,42.86%
LA CONSOLACION COLLEGE-LA CARLOTA CITY,0.00%
"LA CONSOLACION COLLEGE-LILOAN, CEBU CITY",100.00%
LA CONSOLACION COLLEGE-MANILA,62.50%
LA FORTUNA COLLEGE,0.00%
LA SALLE UNIVERSITY (for.IMMA.CONCEPCION-LA SALLE),39.13%
LA UNION SCHOOL OF ARTS & TRADES,0.00%
LAGUNA COLLEGE,22.22%
LAGUNA COLLEGE OF BUSINESS & ARTS,23.40%
LAGUNA NORTHWESTERN COLLEGE,0.00%
"LAGUNA SANTIAGO EDUCATIONAL FOUNDATION, INC.",33.33%
LAGUNA STATE POLYTECHNIC COLLEGE-SAN PABLO (SPCSAT),24.73%
LAGUNA STATE POLYTECHNIC COLLEGE-STA. CRUZ (LCAT),14.88%
LAGUNA STATE POLYTECHNIC UNIVERSITY-LOS BA헲S,23.53%
LAGUNA STATE POLYTECHNIC UNIVERSITY-SINILOAN,19.57%
"LAGUNA UNIVERSITY-STA CRUZ, LAGUNA",66.67%
"LAKE LANAO COLLEGE, INC.",0.00%
LAMBUNAO INSTITUTE OF SCIENCE & TECHNOLOGY,0.00%
LANAO DEL NORTE AGRICULTURAL COLLEGE,40.00%
LANAO EDUCATIONAL INSTITUTE,0.00%
LANAO NATIONAL COLLEGE OF ARTS & TRADES,0.00%
LANAO SCHOOL OF SCIENCE & TECHNOLOGY,0.00%
LAOANG NATIONAL TRADE SCHOOL,0.00%
LAPAK AGRICULTURAL COLLEGE-SIASI,0.00%
LAPAK NATIONAL SCHOOL OF FISHERIES,0.00%
LAS PI헤S COLLEGE,0.00%
LEGACY COLLEGE OF COMPOSTELA,0.00%
LEMERY COLLEGES,33.33%
LEON GUINTO MEMORIAL COLLEGE,0.00%
LEON NATIONAL COLLEGE OF AGRICULTURE,28.57%
LEWIS COLLEGE,100.00%
LEYTE COLLEGES,12.20%
LEYTE INSTITUTE OF TECHNOLOGY (for.OCSAT),0.00%
LEYTE INSTITUTE OF TECHNOLOGY- BURAUEN CAMPUS,21.43%
LEYTE INSTITUTE OF TECHNOLOGY- CARIGARA CAMPUS,15.15%
LEYTE INSTITUTE OF TECHNOLOGY- ORMOC CAMPUS,4.76%
LEYTE INSTITUTE OF TECHNOLOGY- TANAUAN CAMPUS,7.89%
LEYTE NATIONAL COLLEGE OF AGRICULTURE SCIENCE & TECHNOLOGY,33.33%
LEYTE NORMAL UNIVERSITY,32.30%
LEYTE POLYTECHNIC INSTITUTE- TACLOBAN,0.00%
LEYTE STATE COLLEGE,0.00%
LEYTE STATE SCHOOL OF AGRICULTURE,0.00%
LEYTE STATE SCHOOL OF FISHERIES,0.00%
LEYTE STATE UNIVERSITY-ALANG- ALANG CAMPUS,14.29%
LEYTE STATE UNIVERSITY-ISABEL CAMPUS,0.00%
LEYTE STATE UNIVERSITY-TOLOSA CAMPUS,0.00%
LEYTE STATE UNIVERSITY-VILLABA CAMPUS,3.85%
LIBACAO COLLEGE OF SCIENCE & TECHNOLOGY,16.67%
LICEO DE CAGAYAN UNIVERSITY,12.50%
LICEO DE DAVAO,14.29%
LICEO DE MASBATE COLLEGE,25.00%
LICEO DE SAN JACINTO,25.00%
LIGAO COMMUNITY COLLEGE,46.67%
LIMAY POLYTECHNIC COLLEGE,0.00%
LIPA CITY COLLEGES,20.00%
LIPA CITY PUBLIC COLLEGE,29.75%
LISUN INSTITUTE,0.00%
LORMA COLLEGE,66.67%
LOURDES COLLEGE,23.08%
LOURDES COLLEGE OF BULACAN,0.00%
LOYALA COLLEGE OF CULION,40.00%
